1,"[य]
सर्वत्र बुद्धिः कथिता शरेष्ठा ते भरतर्षभ
अनागता तथॊत्पन्ना दीर्घसूत्रा विनाशिनी"
115,"ततश चिच्छेद तं तन्तुं मार्जारस्य स मूषकः
विप्रमुक्तॊ ऽथ मार्जारस तम एवाभ्यपतद दरुमम"
116,"स च तस्माद भयान मुक्तॊ मुक्तॊ घॊरेण शत्रुणा
बिलं विवेश पलितः शाखां भेजे च लॊमशः"
117,"उन्माथम अप्य अथादाय चण्डालॊ वीक्ष्य सर्वशः
विहताशः कषणेनाथ तस्माद देशाद अपाक्रमत
जगाम च सवभवनं चण्डालॊ भरतर्षभ"
118,"ततस तस्माद भयान मुक्तॊ दुर्लभं पराप्य जीवितम
बिलस्थं पादपाग्रस्थः पलितं लॊमशॊ ऽबरवीत"
119,"अकृत्वा संविदं कां चित सहसाहम उपप्लुतः
कृतज्ञं कृतकल्याणं कच चिन मां नाभिशङ्कसे"
120,"गत्वा च मम विश्वासं दत्त्वा च मम जीवितम
मित्रॊपभॊग समये किं तवं नैवॊपसर्पसि"
121,"कृत्वा हि पूर्वं मित्राणि यः पश्चान नानुतिष्ठति
न स मित्राणि लभते कृच्छ्रास्व आपत्सु दुर्मतिः"
122,"तत कृतॊ ऽहं तवया मित्रं सामर्थ्याद आत्मनः सखे
स मां मित्रत्वम आपन्नम उपभॊक्तुं तवम अर्हसि"
123,"यानि मे सन्ति मित्राणि ये च मे सन्ति बान्धवाः
सर्वे तवां पूजयिष्यन्ति शिष्या गुरुम इव परियम"
124,"अहं च पूजयिष्ये तवां समित्रगणबान्धवम
जीवितस्य परदातारं कृतज्ञः कॊ न पूजयेत"
125,"ईश्रवॊ मे भवान अस्तु शरीरस्य गृहस्य च
अर्थानां चैव सर्वेषाम अनुशास्ता च मे भव"
126,"अमात्यॊ मे भव पराज्ञ पितेव हि परशाधि माम
न ते ऽसति भयम अस्मत्तॊ जीवितेनात्मनः शपे"
127,"बुद्ध्या तवम उशनाः साक्षाद बले तव अधिकृता वयम
तवन्मन्त्रबलयुक्तॊ हि विन्देत जयम एव ह"
128,"एवम उक्तः परं सान्त्वं मार्जारेण स मूषकः
उवाच परमार्थज्ञः शलक्ष्णम आत्महितं वचः"
129,"यद भवान आह तत सर्वं मया ते लॊमश शरुतम
ममापि तावद बरुवतः शृणु यत परतिभाति माम"
130,"वेदितव्यानि मित्राणि बॊद्धव्याश चापि शत्रवः
एतत सुसूक्ष्मं लॊके ऽसमिन दृश्यते पराज्ञसंमतम"
131,"शत्रुरूपाश च सुहृदॊ मित्ररूपाश च शत्रवः
सान्त्वितास ते न बुध्यन्ते रागलॊभ वशंगताः"
132,"नास्ति जात्या रिपुर नाम मित्रं नाम न विद्यते
सामर्थ्य यॊगाज जायन्ते मित्राणि रिपवस तथा"
133,"यॊ यस्मिञ जीवति सवार्थं पश्येत तावत स जीवति
स तस्य तावन मित्रं सयाद यावन न सयाद विपर्ययः"
134,"नास्ति मैत्री सथिरा नाम न च धरुवम असौहृदम
अर्थयुक्त्या हि जायन्ते मित्राणि रिपवस तथा"
135,"मित्रं च शत्रुताम एति कस्मिंश चित कालपर्यये
शत्रुश च मित्रताम एति सवार्थॊ हि बलवत्तरः"
136,"यॊ विश्वसति मित्रेषु न चाश्वसति शत्रुषु
अर्थयुक्तिम अविज्ञाय चलितं तस्य जीवितम"
137,"अर्थयुक्तिम अविज्ञाय यः शुभे कुरुते मतिम
मित्रे वा यदि वा शत्रौ तस्यापि चलिता मतिः"
138,"न विश्वसेद अविश्वस्ते विश्वस्ते ऽपि न विश्वसेत
विश्वासाद भयम उत्पन्नं मूलान्य अपि निकृन्तति"
139,"अर्थयुक्त्या हि देश्यन्ते पिता माता सुतास तथा
मातुला भागिनेयाश च तथा संबन्धिबान्धवाः"
140,"पुत्रं हि माता पितरु तयजतः पतितं परियम
लॊकॊ रक्षति चात्मानं पश्य सवार्थस्य सारताम"
141,"तं मन्ये निकृतिप्रज्ञं यॊ मॊक्षं परत्यनन्तरम
कृत्यं मृगयसे कर्तुं सुखॊपायम असंशयम"
142,"अस्मिन निलय एव तवं नयग्रॊधाद अवतारितः
पूर्वं निविष्टम उन्माथं चपलत्वान न बुद्धिवान"
143,"आत्मनश चपलॊ नास्ति कुतॊ ऽनयेषां भविष्यति
तस्मात सर्वाणि कार्याणि चपलॊ हन्त्य असंशयम"
144,"बरवीति मधुरं कं चित परियॊ मे ह भवान इति
तन मिथ्या करणं सर्वं विस्तरेणापि मे शृणु"
145,"कारणात परियताम एति दवेष्यॊ भवति कारणात
अर्थार्थी जीवलॊकॊ ऽयं न कश चित कस्य चित परियः"
146,"सख्यं सॊदरयॊर भरात्रॊर दम्पत्यॊर वा परस्परम
कस्य चिन नाभिजानामि परीतिं निष्कारणाम इह"
147,"यद्य अपि भरातरः करुद्धा मार्या वा कारणान्तरे
सवभावतस ते परीयन्ते नेतरः परीयते जनः"
148,"परियॊ भवति दानेन परियवादेन चापरः
मन्त्रहॊम जपैर अन्यः कार्यार्थं परीयते जनः"
149,"उत्पन्ने कारणे परीतिर नास्ति नौ कारणान्तरे
परध्वस्ते कारणस्थाने सा परीतिर विनिवर्तते"
150,"किं नु तत कारणं मन्ये यनाहं भवतः परियः
अन्यत्राभ्यवहारार्थात तत्रापि च बुधा वयम"
151,"कालॊ हेतुं विकुरुते सवार्थस तम अनुवर्तते
सवार्थं पराज्ञॊ ऽभिजानाति पराज्ञं लॊकॊ ऽनुवर्तते"
152,"न तव ईदृशं तवया वाच्यं विदुषि सवार्थपण्डिते
अकाले ऽविषमस्थस्य सवार्थहेतुर अयं तव"
153,"तस्मान नाहं चले सवार्थात सुस्थितः संधिविग्रहे
अभ्राणाम इव रूपाणि विकुर्वन्ति कषणे कषणे"
154,"अद्यैव हि रिपुर भूत्वा पुनर अद्यैव सौहृदम
पुनश च रिपुर अद्यैव युक्तीनां पश्य चापलम"
155,"आसीत तावत तु मैत्री नौ यावद धेतुर अभूत पुरा
सा गता सह तेनैव कालयुक्तेन हेतुना"
156,"तवं हि मे ऽतयन्ततः शत्रुः सामर्थ्यान मित्रतां गतः
तत कृत्यम अभिनिर्वृत्तं परकृतिः शत्रुतां गता"
157,"सॊ ऽहम एवं परणीतानि जञात्वा शास्त्राणि तत्त्वतः
परविशेयं कथं पाशं तवत्कृतं तद वदस्व मे"
158,"तवद्वीर्येण विमुक्तॊ ऽहं मद्वीर्येण तथा भवान
अन्यॊन्यानुग्रहे वृत्ते नास्ति भूयः समागमः"
159,"तवं हि सौम्य कृतार्थॊ ऽदय निर्वृत्तार्थास तथा वयम
न ते ऽसत्य अन्यन मया कृत्यं किं चिद अन्यत्र भक्षणात"
160,"अहम अन्नं भवान भॊक्ता दुर्बलॊ ऽहं भवान बली
नावयॊर विद्यते संधिर नियुक्ते विषमे बले"
161,"संमन्ये ऽहं तव परज्ञां यन मॊक्षात परत्यनन्तरम
भक्ष्यं मृगयसे नूनं सुखॊपायम असंशयम"
162,"भक्ष्यार्थम एव बद्धस तवं स मुक्तः परसृतः कषुधा
शास्त्रज्ञम अभिसंधाय नूनं भक्षयिताद्य माम"
163,"जानामि कषुधितं हि तवाम आहारसमयश च ते
स तवं माम अभिसंधाय भक्ष्यं मृगयसे पुनः"
164,"यच चापि पुत्रदारं सवं तत संनिसृजसे मयि
शुश्रूषां नाम मे कर्तुं सखे मम न तत्क्षमम"
165,"तवया मां सहितं दृष्ट्वा परिया भार्या सुताश च ये
कस्मान मां ते न खादेयुर हृष्टाः परणयिनस तवयि"
166,"नाहं तवया समेष्यामि वृत्तॊ हेतुः समागमे
शिवं धयायस्व मे ऽतरस्थः सुकृतं समर्यते यदि"
167,"शत्रॊर अन्नाद्य भूतः सन कलिष्टस्य कषुधितस्य च
भक्ष्यं मृगयमाणस्य कः पराज्ञॊ विषयं वरजेत"
168,"सवस्ति ते ऽसतु गमिष्यामि दूराद अपि तवॊद्विजे
नाहं तवया समेष्यामि निर्वृतॊ भव लॊमश"
169,"बलवत संनिकर्षॊ हि न कदा चित परशस्यते
परशान्ताद अपि मे पराज्ञ भेतव्यं बलिनः सदा"
170,"यदि तव अर्थेन मे कार्यं बरूहि किं करवाणि ते
कामं सर्वं परदास्यामि न तव आत्मानं कदा चन"
171,"आत्मार्थे संततिस तयाज्या राज्यं रत्नं धनं तथा
अपि सर्वस्वम उत्सृज्य रक्षेद आत्मानम आत्मना"
172,"ऐश्वर्यधनरत्नानां परत्यमित्रे ऽपि तिष्ठताम
दृष्टा हि पुनर आवृत्तिर जीविताम इति नः शरुतम"
173,"न तव आत्मनः संप्रदानं धनरत्नवद इष्यते
आत्मा तु सर्वतॊ रक्ष्यॊ दारैर अपि धनैर अपि"
174,"आत्मरक्षित तन्त्राणां सुपरीक्षित कारिणाम
आपदॊ नॊपपद्यन्ते पुरुषाणां सवदॊषजाः"
175,"शत्रून सम्यग विजानन्ति दुर्बला ये बलीयसः
तेषां न चाल्यते बुद्धिर आत्मार्थं कृतनिश्चया"
176,"इत्य अभिव्यक्तम एवासौ पलितेनावभर्त्सितः
मार्जारॊ वरीडितॊ भूत्वा मूषकं वाक्यम अब्रवीत"
177,"संमन्ये ऽहं तव परज्ञां यस तवं मम हिते रतः
उक्तवान अर्थतत्त्वेन मया संभिन्नदर्शनः"
178,"न तु माम अन्यथा साधॊ तवं विज्ञातुम इहार्हसि
पराणप्रदानजं तवत्तॊ मम सौहृदम आगतम"
179,"धर्मज्ञॊ ऽसमि गुणज्ञॊ ऽसमि कृतज्ञॊ ऽसमि विशेषतः
मित्रेषु वत्सलश चास्मि तवद्विधेषु विशेषतः"
180,"तन माम एवंगते साधॊ न यावयितुम अर्हसि
तवया हि याव्यमानॊ ऽहं पराणाञ जह्यां सबान्धवः"
181,"धिक शब्दॊ हि बुधैर दृष्टॊ मद्विधेषु मनस्विषु
मरणं धर्मतत्त्वज्ञ न मां शङ्कितुम अर्हसि"
182,"इति संस्तूयमानॊ हि मार्जारेण स मूषकः
मनसा भावगम्भीरं मार्जारं वाक्यम अब्रवीत"
183,"साधुर भवाञ शरुतार्थॊ ऽसमि परीयते न च विश्वसे
संस्तवैर वा धनौघैर वा नाहं शक्यः पुनस तवया"
184,"न हय अमित्रवशं यान्ति पराज्ञा निष्करणं सखे
अस्मिन्न अर्थे च गाथे दवे निबॊधॊशनसा कृते"
185,"शत्रुसाधारणे कृत्ये कृत्वा संधिं बलीयसा
समाहितश चरेद युक्त्या कृतार्थश च न विश्वसेत"
186,"तस्मात सर्वास्व अवस्थासु रक्षेञ जीवितम आत्मनः
दरव्याणि संततिश चैव सर्वं भवति जीवतः"
187,"संक्षेपॊ नीतिशास्त्राणाम अविश्वासः परॊ मतः
नृषु तस्माद अविश्वासः पुष्कलं हितम आत्मनः"
188,"वध्यन्ते न हय अविश्वस्ताः शत्रुभिर दुर्बला अपि
विश्वस्तास तव आशु वध्यन्ते बलवन्तॊ ऽपि दुर्बलैः"
189,"तवद्विधेभ्यॊ मया हय आत्मा रक्ष्यॊ मार्जारसर्वदा
रक्ष तवम अपि चात्मानं चण्डालाञ जातिकिल्बिषात"
190,"स तस्य बरुवतस तव एवं संत्रासाञ जातसाध्वसः
सवबलिं हि जवेनाशु मार्जारः परययौ ततः"
191,"ततः शास्त्रार्थतत्त्वज्ञॊ बुद्धिसामर्थ्यम आत्मनः
विश्राव्य पलितः पराज्ञॊ बिलम अन्यञ जगाम ह"
192,"एवं परज्ञावता बुद्ध्या दुर्बलेन महाबलाः
एकेन बहवॊ ऽमित्राः संधिं कुर्वीत पण्डितः"
193,"अरिणापि समर्थेन संधिं कुर्वीत पण्डितः
मूषकश च विडालश च मुक्ताव अन्यॊन्यसंश्रयात"
194,"इत्य एष कषत्रधर्मस्य मया मार्गॊ ऽनुदर्शितः
विस्तरेण महीपाल संक्षेपेण पुनः शृणु"
195,"अन्यॊन्यकृतवैरौ तु चक्रतुः परीतिम उत्तमाम
अन्यॊन्यम अभिसंधातुम अभूच चैव तयॊर मतिः"
196,"तत्र पराज्ञॊ ऽभिसंधत्ते सम्यग बुद्धिबलाश्रयात
अभिसंधीयते पराज्ञः परमादाद अपि चाबुधैः"
197,"तस्माद अभीतवद भीतॊ विश्वस्तवद अविश्वसन
न हय अप्रमत्तश चलति चलितॊ वा विनश्यति"
198,"कालेन रिपुणा संधिः काले मित्रेण विग्रहः
कार्य इत्य एव तत्त्वज्ञाः पराजुर नित्यं युधिष्ठिर"
199,"एवं मत्वा महाराज शास्त्रार्थम अभिगम्य च
अभियुक्तॊ ऽपरमत्तश च पराग भयाद भीतवच चरेत"
200,"भीतवत संविधिः कार्यः परतिसंधिस तथैव च
भयाद उत्पद्यते बुद्धिर अप्रमत्ताभियॊगजा"
201,"न भयं विद्यते राजन भीतस्यानागते भये
अभीतस्य तु विस्रम्भात सुमहाञ जायते भयम"
202,"न भीरुर इति चात्यन्तं मन्त्रॊ ऽदेयः कथं चन
अविज्ञानाद धि विज्ञाते गच्छेद आस्पद दर्शिषु"
203,"तस्माद अभीतवद भीतॊ विश्वस्तवद अविश्वसन
कार्याणां गुरुतां बुद्ध्वा नानृतं किं चिद आचरेत"
204,"एवम एतन मया परॊक्तम इतिहासं युधिष्ठिर
शरुत्वा तवं सुहृदां मध्ये यथावत समुपाचर"
205,"उपलभ्य मतिं चाग्र्याम अरिमित्रान्तरं तथा
संधिविग्रहकालं च मॊक्षॊपायं तथापदि"
206,"शत्रुसाधारणे कृत्ये कृत्वा संधिं बलीयसा
समागमं चरेद युक्त्या कृतार्थॊ न च विश्वसेत"
207,"अविरुद्धां तरिवर्गेण नीतिम एतां युधिष्ठिर
अभ्युत्तिष्ठ शरुताद अस्माद भूयस तवं रञ्जयन परजाः"
208,"बराह्मणैश चापि ते सार्धं यात्रा भवतु पाण्डव
बराह्मणा हि परं शरेयॊ दिवि चेह च भारत"
209,"एते धर्मस्य वेत्तारः कृतज्ञाः सततं परभॊ
पूजिताः शुभकर्माणः पूर्वजित्या नराधिप"
210,"राज्यं शरेयः परं राजन यशः कीर्तिं च लप्स्यसे
कुलस्य संततिं चैव यथान्यायं यथाक्रमम"
211,"दवयॊर इमं भारत संधिविग्रहं; सुभाषितं बुद्धिविशेषकारितम
तथान्ववेक्ष्य कषितिपेन सर्वदा; निषेवितव्यं नृप शत्रुमण्डले"
