1,"[य]
मग्नस्य वयसने कृच्छ्रे किं शरेयः पुरुषस्य हि
बन्धुनाशे महीपाल राज्यनाने ऽपि वा पुनः"
115,"अस्मत्तस ते भयं नास्ति समयं परतिपालय
सुखी भव निराबाधः सवस्थचेता निरामयः"
116,"तम एवम उक्त्वा भगवाञ शतक्रतुः; परतिप्रयातॊ गजराजवाहनः
विजित्य सर्वान असुरान सुराधिपॊ; ननन्द हर्षेण बभूव चैकराट"
117,"महर्षयस तुष्टुवुर अञ्जसा च तं; वृषाकपिं सर्वचराचरेश्वरम
हिमापहॊ हव्यम उदावहंस तवरंस; तथामृतं चार्पितम ईश्वराय ह"
118,"दविजॊत्तमैः सर्वगतैर अभिष्टुतॊ; विदीप्त तेजा गतमन्युर ईश्वरः
परशान्तचेता मुदितः सवम आलयं; तरिविष्टपं पराप्य मुमॊद वासवः"
