chapter,verse,sanskrit,translation,question
3,39,उदानजयाज्जलपङ्ककण्टकादिष्वसङ्ग उत्क्रान्तिश्च,"By achieving mastery over the vital energy in the neck and head (udana*), one can traverse water, mud, thorns, and other obstacles without making contact with the ground, but instead floating over them.",How does perfect control over various pranas (5 pranas) benefit? What is the importance of perfect control over sub-prana called Udaana? How does one levitate by the knowledge of Yoga? How is the power to levitate accquired through Yoga? 
3,40,समानजयाज्जवलनम्,"By acheiving mastery over the flow of energy through the solar plexus (samana*), one becomes radiant.",How does perfect control over sub-prana Saamana help in Yoga? What is the importance of perfect control over sub-prana Saamana? How is radiant aura achieved/accquired by Yoga?
3,41,श्रोत्राकाशयोः संबन्धसंयमाद्दिव्यं श्रोत्रम्,"By intently focusing (samyama*) on the inter-relationship of the organ of hearing and space, one can attain divine hearing.",How can one attain divine hearing?
3,42,कायाकाशयोः संबन्धसंयमाल्लघुतूलसमापत्तेश्चाऽऽकाशगमनम्,"By intently focusing (samyama*) on the body's connection with the space and cultivating intense concentration (samapatti*) on the lightness as of cotton, one can travel through space.",How can one travel through space?
3,43,बहिरकल्पिता वृत्तिर्महाविदेहा ततः प्रकाशावरणक्षयः,The state of 'great disembodiment' (mahavidheha*) happens when the mind is projected outside the body into a non-imagined state. Then the veil obscuring the mind's radiance is lifted.,How can we become disembodied?
3,44,स्थूलस्वरूपसूक्ष्मान्वयार्थवत्त्वसंयमाद्भूतजयः,"By intently observing the different dimensions of matter such as gross, intrinsic, subtle, interconnectedness (at the level of gunas) and purpose (of objects) with samyama*, one attains mastery over the elements.",How can we attain mastery over nature?
3,45,ततोऽणिमादिप्रादुर्भावः कायसंपत्तद्धर्मानभिघातश्च,"As a result, extraordinary abilities, such as the power to reduce oneself to the size of an atom (anima*) etc. ( and 7 more abilities) manifest. Thus the body develops ability to transcend the laws of the physical matter and attains perfection too. ",What is anima? Can we reduce our size through Yoga? Can we transcend the laws of nature? Can Yoga help us in going beyond nature? Name the most popular siddhis attained by Yoga?
3,46,रूपलावण्यबलवज्रसंहननत्वानि कायसंपत्,"This level of perfection of the body includes qualities such as beauty, grace, strength, and the indestructibility of a thunderbolt.",Does the body become more powerful due to Yoga? Can Yoga make our body more powerful?
3,47,ग्रहणस्वरूपास्मितान्वयार्थवत्त्वसंयमादिन्द्रियजयः,"One can gain control over sense organs by samyama* (on the various aspects of sense organs) - the process of obtaining knowledge, basic properties (of the sense organs), the individuating principle (asmita*), the inherent qualities and need (of the gunas*). ",What is asmita? Can we gain control over our senses by Yoga?
3,48,ततो मनोजवित्वं विकरण भावः प्रधानजयश्च,"By doing that (samyama over sense organs) one also accquires ability to travel with the speed of thought, body independant perception and control over fundamental facets of matter (mula prakriti*).",Can we perceive things beyond the senses through Yoga?
3,49,सत्त्वपुरुषान्यताख्यातिमात्रस्य सर्वभावाधिष्ठातृत्वं सर्वज्ञातृत्वं च,"Only when an individual perceives the distinction between pure awareness and the the intellect, they become knower of all and gain authority over existence.",How can we become knower of all? How can we gain mastery over ourselves?
3,50,तद्वैराग्यादपि दोषबीजक्षये कैवल्यम्,"When one detaches even from this omniscience and mastery, and the seeds of suffering decay, and pristine consciousness realizes its independent existence (state of kaivalya*).",Does self-mastery lead to happiness?
3,51,स्थान्युपनिमन्त्रणे सङ्गस्मयाकरणं पुनरनिष्टप्रसङ्गात्,"Even if the divine beings call upon one, it is vital to refrain from becoming attached or arrogant; otherwise, suffering will resurface.",Should we answer the call of divine beings?
3,52,क्षणतत्क्रमयोः संयमाद्विवेकजं ज्ञानम्,"By intently focusing (samyama*) on the succession of moments in time, one gains insights that arise from discernment.",What happens when we meditate on time?
3,53,जातिलक्षणदेशैरन्यतानवच्छेदात्तुल्ययोस्ततः प्रतिपत्तिः,"Due to which, distinction even between seemingly similar things on the basis of species, properties and location can be ascertained.  ",How can we learn to differentiate between similar things?
3,54,तारकं सर्वविषयं सर्वथाविषयमक्रमं चेति विवेकजं ज्ञानम्,This liberating insight deconstructs each object and every conditions in an time independant manner (i.e it is never changing unlike any other knowledge) and signifies viveka jnanam* or liberative discernment.,How can we attain liberating discernment?
3,55,सत्त्वपुरुषयोः शुद्धिसाम्ये कैवल्यमिति,The state of 'kaivalya' or liberation dawns when the purity of intellect equals to that of the pure consciousness. ,What happens when our intellect becomes pure? Can intellect become as pure as consciousness? Can intellect become as pure as awareness? 
4,1,जन्मौषधिमन्त्रतपः समाधिजाः सिद्धयः,"The mystic powers can manifest by the virtue from birth, herbal remedies, chanting of mantras, austerities and absorption in samadhi.",What are the ways of attaining mystic powers? Can herbs lead to mystic powers? Can mantras lead to mystic powers? Can someone acquire mystic powers by birth?
4,2,जात्यन्तरपरिणामः प्रकृत्यापूरात्,The transformation (or evolution) of a species is a result of nature's abundance. OR The transition to a new form occurs when the natural energies overflow.,How does evolution happen? How do living beings evolve?
4,3,निमित्तमप्रयोजकं प्रकृतीनां वरणभेदस्तु ततः क्षेत्रिकवत्,"The transformation from one form to another is not caused by the inherent factors, but they only serve as guidance, akin to a farmer (directing water flow for irrigation).",What causes transformation from one form to another?
4,4,निर्माणचित्तान्यस्मितामात्रात्,Assembly of chitta (mind) is done by ego only. ,What holds the mind in its place? What causes the mind to be assembled?
4,5,प्रवृत्तिभेदे प्रयोजकं चित्तमेकमनेकेषाम्,A sequence of consciousnesses that create a multitude of unique perceptions is a orchestrated by a single personal consciousness (of the yogi).,How do we perceive the sequence of conscious events?
4,6,तत्र ध्यानजमनाशयम्,Consciousness focused due to meditative absorption does not add to the accumulation of potential impressions (unlike the other four means mentioned in 4.1).,Does meditation also lead to accumulation of impressions?
4,7,कर्माशुक्लाकृष्णं योगिनस्त्रिविधमितरेषाम्,"The actions of a (true) yogi is neither white (right) nor black (wrong) unlike others (non-yogi) which are of three types (right, wrong or both).",Can the actions of a Yoga be categorised as good or bad?
4,8,ततस्तद्विपाकानुगुणानामेवाभिव्यक्तिर्वासनानाम्,"From it (the three fold actions), furthur outcome in accordance with the latent subconscious traits manifest .",What are the outcomes of the three fold action?
4,9,जातिदेशकालव्यवहितानामप्यानन्तर्यं स्मृतिसंस्कारयोरेकरूपत्वात्,"Memory and samskaras (subconscious impressions) are essentially identical, therefore, even if (both are) seperated by the virtue of birth, place and time they manifest without any difference of order.",Are memory and samskaras different or the same? Are samskaras same as memory?
4,10,तासामनादित्वं चाऽऽशिषो नित्यत्वात्,These (subconscious impressions) are beginningless as the desire (to exist) is everlasting.,Do the samskaras have a beginning? Does the universe have a beginning? Do our mental impressions have a beginning? Do our mental impressions get created at birth? When does our mind start accumulating impressions? When does our mind start to learn? Is a child born with a blank state?
4,11,हेतुफलाश्रयालम्बनैः संगृहीतत्वादेषामभावे तदभावः,"(The fourfold pillars that sustains samskara i.e.) Cause, Motive, Substratum, and Object (of impression) are interconnected, thus, it (samskara) becomes non-existent when these (four) do so.",What are the pillars that sustain samskaras?
4,12,अतीतानागतं स्वरूपतोऽस्त्यध्वभेदाद्धर्माणाम्,"Time periods of past and future are inherent in the underlying foundation (dharmi* refer 3.14), representing distinct aspects in the same continuum of experiential substances (dharma*).",What do the past and future represent?
4,13,ते व्यक्तसूक्ष्मा गुणात्मानः,"Each of these (past, present or future), whether manifest or subtle, displays characteristics that stem from the fundamental qualities of nature (tri-gunas).",Where does time originate from?
4,14,परिणामैकत्वाद्  वस्तुतत्त्वम्,The uniformity in/of the transformation is due to the singularity in the elemental quality (or principles).,Why does time seem to flow uniformly?
4,15,वस्तुसाम्ये चित्तभेदात्तयोर्विभक्तः पन्थाः,"Because there is a multiplicity of minds (perceiving an object) but yet the object remains consistent, there is a difference in nature between the object and the mind (of the observer).",Is the mind made up of the same elements as physical objects? What is the difference between the mind and physical body? What is the difference between the mind and physical objects?
4,16,न चैकचित्ततन्त्रं वस्तु तदप्रमाणकं तदा किं स्यात्,"An object is not dependant on a single mind (for its exixtence); if it were, then what happens to it when it is not perceived (by that particular mind)?",Does the existence of an object depend on the mind? Does the moon exist when no one is watching? Do objects exist when no one is watching?
4,17,तदुपरागापेक्षित्वाच्चित्तस्य वस्तु ज्ञाता ज्ञातम्,A thing is either known or not known by the mind depending on whether it is noticed by the mind.,When does an object become known by the mind? What is the role of attention in perception?
4,18,सदाज्ञाताश्चित्तवृत्तयस्तत्प्रभोः पुरुषस्यापरिणामित्वात्,"The permutations of the mind are always known to its master, the purusa soul, because of the soul's unchanging nature.",Does the soul know the permutations of the mind? Does the soul know the mind? Does Purusha know the mind?
4,19,न तत्स्वाभासं दृश्यत्वात्,"Nor is the mind self-illuminating, because of its nature as the object of perception.",Is the mind self-illuminating? Does consciousness originate in the mind? Is mind the origin of consciousness?
4,20,एकसमये चोभयानवधारणम्,There cannot be discernment of both (the mind and the object it perceives) at the same time. ,Can we observe both the mind and the objects at the same time?
4,21,चित्तान्तरदृश्ये बुद्धिबुद्धेरतिप्रसङ्गः स्मृतिसंकरश्च,"If (the mind) were cognized by another mind, then there would be an infinite regress of one intelligence (being known) by another intelligence. Moreover, there would also be confusion of memory.",Can one mind be cognized by another mind? Can one mind be experienced by another mind?
4,22,चित्तेरप्रतिसंक्रमायास्तदाकारापत्तौ स्वबुद्धिसंवेदनम्,"Although it is unchanging, consciousness becomes aware of its own intelligence by means of pervading the forms assumed by the intelligence.",How does consciousness become aware of its own intelligence?
4,23,द्रष्टृदृश्योपरक्तं चित्तं सर्वार्थम्,"The mind, colored by the seer as well as by that which is seen, knows all objects.",How does the mind become aware of objects? How does the mind experience the objects? How does the mind observe the universe?
4,24,तदसंख्येयवासनाभिश्चित्रमपि परार्थं संहत्यकारित्वात्,"That mind, with its countless variegated subliminal impressions, exists for another entity (other than itself) because it operates in conjunction (with other instruments).",What is the purpose of the mind?
4,25,विशेषदर्शिन आत्मभावभावनानिवृत्तिः,"For one who sees the distinction (between the mind and the soul), reflecting on the nature of the self ceases.",What happens if we can see the difference between the mind and the soul?
4,26,तदा विवेकनिम्नं कैवल्यप्राग्भारं चित्तम्,"At that point, the mind, inclined towards discrimination, gravitates toward ultimate liberation.",What does the mind seek after discrimination arises?
4,27,तच्छिद्रेषु प्रत्ययान्तराणि संस्कारेभ्यः,During the intervals (in this state of discriminate awareness) other ideas (arise) because of previous samskaras.,Does the mind of a Yogi remain focussed all the time?
4,28,हानमेषां क्लेशवदुक्तम्,The removal (of these previous samskaras) is said to be like (the removal) of the klesa afflictions.,Do our samskaras cause suffering?
4,29,प्रसंख्यानेऽप्यकुसीदस्य सर्वथा विवेकख्यातेर्धर्ममेघः समाधिः,"For one who has no interest even in (the fruits) of meditative wisdom on account of the highest degree of discriminative insight, the samadhi called dharma-megha, cloud of virtue, ensues. ",What is dharma megha samadhi? Should we be detached with the fruits of meditation?
4,30,ततः क्लेशकर्मनिवृत्तिः,From this comes the cessation of the klesas (impediments to yoga) and karma.,Can Karma also cease to exist?
4,31,तदा सर्वावरणमलापेतस्य ज्ञानस्याऽऽनन्त्याज्ज्ञेयमल्पम्,"At this point, because of the unlimited nature of knowledge when all impurities have been removed from it, that which remains to be known is little.",Can humans reach a state of omniscience?
4,32,ततः कृतार्थानां परिणामक्रमसमाप्तिर्गुणानाम्,"As a result, there is a cessation of the ongoing permutations of the gunas, their purpose now fulfilled.",Can the permutations of the Gunas cease?
4,33,क्षणप्रतियोगी परिणामापरान्तनिर्ग्राह्यः क्रमः,The progression (of any object through Time) corresponds to a (series of) moments. It is perceivable at the final (moment) of change.,How do we perceive time? What is time?
4,34,पुरुषार्थशून्यानां गुणानां प्रतिप्रसवः कैवल्यं स्वरूपप्रतिष्ठा वा चितिशक्तिरिति,"Ultimate liberation is when the gunas, devoid of any purpose for the purusa, return to their original (latent) state; in other words, when the power of consciousness is situated in its own essential nature.",What is ultimate liberation? What happens to Prakriti when Purusha attains liberation?