chapter,verse,sanskrit,translation,question
2,26,विवेकख्यातिरविप्लवा हानोपायः,"Unflinching discriminative discernment (between the seer and the seen) is the path to liberation (not the final state yet, this is the upper stage of Ritambhara pragya (1.48) where even this prayga ceases).",What path leads one to Kailvalya or Liberation? What trait is required to get on the path towards Liberation? What path is to be followed after the mind gets established in the higher levels of meditation (Ritambhara Pragya)?
2,27,तस्य सप्तधा प्रान्तभूमिः प्रज्ञा,"On this path of liberation, the one (yogi) with the wisdom of discriminative discernment extends to seven ultimate stages.",How many cognitive levels does the path towards liberation have?
2,28,योगाङ्गानुष्ठानादशुद्धिक्षये ज्ञानदीप्तिरा विवेकख्यातेः,"By practicing the components of yoga, impurities diminish, allowing the light of understanding to shine and illuminate the path to discriminative awareness.",What practice leads on to the path towards liberation? What is the tool which enables one to cover the path towards liberation? How does Yoga establish one on the path towards liberation?
2,29,यमनियमासनप्राणायामप्रत्याहारधारणाध्यानसमाधयोऽष्टावङ्गानि,"Social discipline, personal observances, pyscho-physical posture, breath regulation, withdrawl of senses, concentration, meditation and liberation make up the eight limbs of yoga.",What constitutes Astanga Yoga? How many limbs does Yoga have? What are the names of the limbs of Yoga? What is the eightfold path of Yoga?
2,30,अहिंसासत्यास्तेयब्रह्मचर्यापरिग्रहा यमाः,"The five social disciplines are non-violence, being truthful, not stealing, practicing celibacy, and avoiding materialism.",What are social disciplines? How many social disciplines are there? What constitutes social disciplines? What are the names of social disciplines? What are yamas? What is yama?
2,31,जातिदेशकालसमयानवच्छिन्ना सार्वभौमा महाव्रतम्,"These principles are solemn resolutions. They are not bound by one's social status, territory, specific time or any duration. They are universal.",When does social disciplines become firmly established? When does social disciplines become unshakable vows?
2,32,शौचसंतोषतपः स्वाध्यायेश्वरप्रणिधानानि नियमाः,"The five personal observances are purifying the body, cultivating contentment, practicing austerity, self-study, and devotion to God.",How many personal observances are there? What are Niyamas? What constitutes personal observances? What are the names of all personal observances? What is niyama?
2,33,वितर्कबाधने प्रतिपक्षभावनम्,Negative thoughts can be countered by developing positive ones.,What should be done to combat the negative feelings towards the practice of social disciplines and personal observances?
2,34,वितर्का हिंसादयः कृतकारितानुमोदिता लोभक्रोधमोहपूर्वका मृदुमध्याधिमात्रा दुःखाज्ञानानन्तफला इति प्रतिपक्षभावनम्,"Negative thoughts such as violence etc. arise from greed, anger, or attachment, and regardless of their intensity such as less, medium or excessive, inevitably lead to ignorance and suffering. Therefore, it is necessary to cultivate counteracting (i.e.positive) thoughts.",What are the features of negative feelings? What are the details of the negative feelings one encounters on the path of Yoga? What kind of negative feelings one faces in the path of Yoga and how to counter them?
2,35,अहिंसाप्रतिष्ठायां तत्सन्निधौ वैरत्यागः,"When one is strongly rooted in non-violence, it fosters an environment (around that yogi) where others resign their hatred.",What are the merits of practicing non-violence? WHat happens when one gets firmly established in the virtue of non-violence?
2,36,सत्यप्रतिष्ठायां क्रियाफलाश्रयत्वम्,"Those who become firmly rooted in truthfulness, experience every action and its outcome in accordance with the truth.",What are the merits of practicing truthfulness? What happens when one gets firmly established in the virtue of truthfulness?
2,37,अस्तेयप्रतिष्ठायां सर्वरत्नोपस्थानम्,"For those established in the virtue of non-stealing (or not accepting which is not their's), entire treasures are revealed.",What are the benefits of non-stealth? What happens when one firmly refrains from stealing?
2,38,ब्रह्मचर्यप्रतिष्ठायां वीर्यलाभः,Celibacy when deeply ingrained secures energy.,What is the worth of unshakable celibacy? Is celibacy useful in spirituality? Is celibacy useful?
2,39,अपरिग्रहस्थैर्ये जन्मकथंतासंबोधः,"Being resolute in the state of non-greediness (desirelessness), the understanding of (previous) births is revealed. ",What is the reward of establishing oneself in the virtue of non-hoarding? Can we remember our past births?
2,40,शौचात्स्वाङ्गजुगुप्सा परैरसंसर्गः,"Practicing cleanliness, one becomes free from the body's compulsions and from the need of (physically) associating with others.",What are the benefits of practicing (physical) cleanliness?
2,41,सत्त्वशुद्धिसौमनस्यैकाग्र्येन्द्रियजयात्मदर्शनयोग्यत्वानि च,"Developing sattva through the practice of cleanliness (mental purification) leads to radiance, increased ability to focus, sense control, and ability for self-awareness.",What are the benefits of mental cleanliness?
2,42,संतोषादनुत्तमः सुखलाभः,Contentment brings an unmatched sense of joy.,What is the reward of cultivating contentment?
2,43,कायेन्द्रियसिद्धिरशुद्धिक्षयात्तपसः,"Through intense discipline, impurities are burned away, and the body and senses become highly refined.",What are the benefits of successful practice of austerity (intense discipline)? 
2,44,स्वाध्यायादिष्टदेवतासंप्रयोगः,Self-reflection strengthens the connection with one's personal deity.,What is the merit of self reflection (self-study)? How can strengthen our relation with God?
2,45,समाधिसिद्धिरीश्वरप्रणिधानात्,Devotion towards God or Ishvara* bestows the competence to attain samadhi* (liberation).,What is the reward for devotion towards God? What is the reward for devotion towards Ishvara?
2,46,स्थिरसुखमासनम्,The body should actualize both steadiness and ease during a psychophysical posture.,What qualifies as psychophysical posture? What are the qualities of psychophysical posture?
2,47,प्रयत्नशैथिल्यानन्तसमापत्तिभ्याम्,"This is possible when all effort is relaxed, and a sense of unity between the body and the infinite universe emerges.",What is the means to achieve psychophysical posture? What is the method to establish oneself in psychophysical posture?
2,48,ततो द्वंद्वानभिघातः,"At this point, the dualities of opposites no longer disturbs one.",What is the marker to gauge the success in psychophysical posture? WHat is the fruit of performing asana? What is the effect of psychophysical posture? What does practice of psychophysical posture result in?
2,49,तस्मिन्सति श्वासप्रश्वासयोर्गतिविच्छेदः प्राणायामः,"After the psychophysical posture is achieved, breath regulation follows. It happens when inhalations and exhalations are regulated.",What constitutes Pranayama? What constitutes Breath Control in Yoga? What is the prerequsite to the practice of breath control?
2,50,बाह्याभ्यन्तरस्तम्भवृत्तिर्देशकालसंख्यामि परिदृष्टो दीर्घसूक्ष्मः,"(Breath regulation or Pranayama* has three dimensions) inhalation, exhalation, and the (various) pauses (kumbhakka*). By paying attention to the place, time and number of each aspects, they become more subtle and extended.","What are the types of Pranayama? What are the types of breath control? What are the names, types and details of the breath control?"
2,51,बाह्याभ्यन्तरविषयाक्षेपी चतुर्थः,"In the fourth dimension (of breath regulation), the division between inhaling and exhaling disappears.",WHat is the fourth type of breath control called? What constitutes the fourth type of breath control?
2,52,ततः क्षीयते प्रकाशावरणम्,"Then, the concealer of the illumination (sattva*) fades.",What is the eventual outcome of breath control? 
2,53,धारणासु च योग्यता मनसः,"Also, the capability of the mind to concentrate (dharana*) is actualized.",What is the benefit of breath control? What is the pre-requisite for meditation in Yoga? 
2,54,स्वविषयासंप्रयोगे चित्तस्वरूपानुकार इवेन्द्रियाणां प्रत्याहारः,"When the senses are disengaged from their respective sense objects and identifies with the nature of the chitta, then sense withdrawal (Pratyahara*) happens. ",What constitutes as withdrawl of the senses for meditation? What is withdrawl of the senses for meditation? 
2,55,ततः परमावश्यतेन्द्रियाणाम्,"Afterwards, the supreme mastery over the senses is attained.",What is the result of withdrawl of the senses for meditation? What is the fruit of withdrawl of the senses for meditation? What is the marker for success in withdrawl of the senses for meditation?
3,1,देशबन्धश्चित्तस्य धारणा,Concentration/Attention is focusing on a single place.,How to focus? How to concentrate? What is concentration? What is focus?
3,2,तत्र प्रत्ययैकतानता ध्यानम्,"In meditation, one's entire perceptual experience becomes uninturreptedly aligned with that object.",What actually happens in meditation? How do we know we are meditating?
3,3,तदेवार्थमात्रनिर्भास स्वरूपशून्यमिव समाधिः,"When only the essence of that object (used for dhyana) remains, and (chitta's) own functions (other cognitive abilities) appears non-existent then samadhi* has been achieved.",How to know one has succeeded in developing focus or concentration? What is the sign of success in developing focus or concentration? How to develop single pointedness? How to acheive Shunyata?
3,4,त्रयमेकत्र संयमः,"The pure state of cognition (samyama*) involves all the (above) three (concentration, meditative absorption, and integration towards a single object.) ",What is Samyama? What is Sanyam? What is the pure state of cognition?
3,5,तज्जयात्प्रज्ञालोकः,"When one masters this discipline, light of wisdom dawns. [Stages of this wisdom has been mentioned in sutra 2.27]",What are the fruits or rewards of Samyama or Sanyam? How to develop insight? Why should one practice/develop concentration?
3,6,तस्य भूमिषु विनियोगः,It (Samyama* or pure state of cognition) should be applied (sequentially) on various stages or planes (of refined cognition).,Why should one practice Yoga sequentially? What is the importance of doing Yoga sequentially?
3,7,त्रयमन्तरङ्गं पूर्वेभ्यः,"These three limbs (concentration, absorption, and integration) are innermost with respect to the previous five.",What are the subtle paths of Yoga? How many subtle limbs of Yoga are there? How many categories are the eight paths of Yoga divided in? 
3,8,तदपि बहिरङ्गं निर्बीजस्य,"However, even these three are considered extrinsic with respect to the state of integration that bears no potential/seeds (Nirbeej Samadhi*). ",Which limb(s) of Yoga preceeds the deepest meditaive absorption? What happens when all the eight limbs of Astanga Yoga reach their conclusion?
3,9,व्युत्थाननिरोधसंस्कारयोरभिभवप्रादुर्भावौ निरोधक्षणचित्तान्वयो निरोधपरिणामः,The cyclical suppression of worldly or distracting smaskaras and emergence of restraining (nirodha*) samskaras eventually fades the former resulting in the frequent contact of the chitta with restraining samskaras. This enables the state of restraint or Nirodha-parinama*.,What happens when the 'nirodha' state of mind is achieved? How to know that the mind is controlled? How does the mind behave when it has been controlled? 
3,10,तस्य प्रशान्तवाहिता संस्कारात्,The unhinged fludity of the thoughts in the mind is due to the samskaras. ,Why does the mind behave in an uncontrolled manner? What is the reason for the continous thoughts on our mind? 
3,11,सर्वार्थतैकाग्रतयोः क्षयोदयौ चित्तस्य समाधिपरिणामः,"In the state of liberation (Samadhi parinama*), the chitta eliminates multi-pointedness and develops one-pointedness.",How does the mind behave when it enters deep concentration? What happens to chitta or the mind after liberation? What happens to chitta or the mind in samadhi?
3,12,ततः पुनः शान्तोदितौ तुल्यप्रत्ययौ चित्तस्यैकाग्रतापरिणामः,"Then, again, the one object or idea of focus present/arising on the chitta is identical to the one which subsides. This state is of one-pointedness (Ekagrata parinama*).",How does the mind behave during the process of deep meditation?
3,13,एतेन भूतेन्द्रियेषु धर्मलक्षणावस्थापरिणामा व्याख्याताः,"Similar to this (like the above changes in consiousness), dynamic changes (due to interplay of gunas) in material objects and senses can be interpreted at three levels : funtion (dharma*), timespan (lakshana*) and condition (awastha*).",How does the changes in the material world appear as we progress in meditation? What are the levels at which changes in the material world can be noticed/observed as we progress in our ability to meditate?
3,14,शान्तोदिताव्यपदेश्यधर्मानुपाती धर्मी,"The underlying foundation (dharmi*) remains the same, irrespective of whether it manifests in a particular form or funtion (dharma*) - before, during, or after the transformation.",What aspects of 'observation' does not change as we progress towards deeper awareness?
3,15,क्रमान्यत्व परिणामान्यत्वे हेतुः,"These transformations (of objects/awareness) seem to occur in a specific manner, which is caused by change in sequence (of characteristics).",How does one interpret the transformation appearing while one meditates?
3,16,परिणामत्रयसंयमादतीतानागतज्ञानम्,"By carefully observing (a pure state of cognition or samyama*) the three aspects of change - function, timespan, and condition, one can gain insights into both the past and future.",How does our awareness refine as we meditate? 
3,17,शब्दार्थप्रत्ययानामितरेतराध्यासात्संकरस्तत्प्रविभागसंयमात्सर्वभूतरुतज्ञानम्,"The concepts of word, meaning, and perception are often intertwined, creating confusion between them. However, by paying attention to the differences between them through perfect discipline (samyama*), one can gain insights into the sounds of all living beings.",How does the discipline of Yoga/Samyama/meditation translates into increased awareness/insight? 
3,18,संस्कारसाक्षात्करणात्पूर्वजातिज्ञानम्,Examining the dormant mental impressions (samskaras*) through direct perception bestows insights into past lives.,How does the ability to know the contents of the past lives gained? What powers comes with deep meditation?
3,19,प्रत्ययस्य परचित्तज्ञानम्,It is possible to gain insight into the consciousness of another person by focusing on their perceptions (pratyaya*).,How does the power to read other's mind accquired? 
3,20,न च तत्सालम्बनं तस्याविषयीभूतत्वात्,"However, this insight does not extend to the object (alambana*) of their perceptions since it (the object) is not actually the subject matter of the one who is focussing (i.e. the yogi).", Does confusion arise in the mind of yogi/person who can read other's mind (due to mixing of contents)?
3,21,कायरूपसंयमात्तद्ग्राह्यशक्तिस्तम्भे चक्षुष्प्रकाशासंयोगेऽन्तर्धानम्,"By observing the body's physical form with perfect discipline (samyama*), it becomes invisible. This happens when the power to perceive is suspended amidst the eye and the incoming light.",How does the yogic/mysic power of invisibilty achieved? What is the science behind the power of being invisible?
3,22,सोपक्रमं निरुपक्रमं च कर्म तत्संयमादपरान्तज्ञानमरिष्टेभ्यो वा,The consequences of actions (karma) may manifest instantly or take time to appear. Observing one's actions with perfect discipline or studying omens can offer insight into death.,Can one accquire insight into death? How does insight into death developed by meditation?
3,23,मैत्र्यादिषु बलानि,"By using perfect discipline to focus on friendliness etc.(i.e compassion, delight, and equanimity), one can internalize (their) strengths.",How does meditation give strength? What should one focus upon to gain strength? What is the role of friendliness in meditation? 
3,24,बलेषु हस्तिबलादीनि,"Through focusing (samyama*) on strengths, it is possible to acquire the powers of an elephant, etc.",How does one accquire immense strength by Yoga and meditation? Can one become physically strong by meditation?
3,25,प्रवृत्त्यालोकन्यासात्सूक्ष्मव्यवहितविप्रकृष्टज्ञानम्,"Being deeply engaged in the radiance of the mind provides insight into the subtle, concealed, and remote aspects of existence (of things).",How does one obtain power to know remote things?  Can one know about things one cannot see by Yoga/meditation? How does one gain knowledge about secrets of body by meditation/Yoga? 
3,26,भुवनज्ञानं सूर्ये संयमात्,"With perfect focusing (samayama*) on the sun, allows one to gain insight into the universe.",How does one gain knowledge about secrets of universe by meditation/Yoga? Can one know about secrets of universe by meditation/Yoga? 
3,27,चन्द्रे ताराव्यूहज्ञानम्,"By using perfect discipline (samayama*) to focus on the moon, one can gain insight into the position of the stars.",How does meditation on pole star affect us? Can one know about position of stars? 
3,28,ध्रुवे तद्गतिज्ञानम्,Perfect discipline (samayama*) enables one to gain insight into the movements/speed of the stars by focusing on the polestar.,Can we gain knowledge of astrology by meditation? What is the significance of meditation on stars?
3,29,नाभिचक्रे कायव्यूहज्ञानम्,"By using perfect discipline (samayama*) to focus on the navel plexus, one can gain insight into the organization of the body.",How does meditation on navel affect us? Can one know all about the organization of the body? Can we gain knowledge of body by meditation? What is the significance of meditation on navel? Can one know about secrets of body by meditation/Yoga? 
3,30,कण्ठकूपे क्षुत्पिपासानिवृत्तिः,Focusing with perfect discipline (samayama*) on the pit of the throat helps to eliminate hunger and thirst.,How does one gain control over hunger and thirst by Yoga/meditation? What is the importance of intense meditation on the pit of throat? Can one exert control over one's hunger and thirst by Yoga/meditation?
3,31,कूर्मनाड्यां स्थैर्यम्,Focusing with perfect discipline (samayama*) on the 'tortoise channel' (kurma naadi) helps to cultivate steadiness.,How does one achieve stability/steadiness by intense focus? Can Yoga/meditation confer stability/steadiness? What can one do to achieve stability?
3,32,मूर्धज्योतिषि सिद्धदर्शनम्,"Through perfect discipline (samayama*), focusing on the light at the crown of the head allows one to acquire the perspective of those who have achieved perfection (siddhas).",How does one accquire visionary sight? How can one accquire supernatural powers? Can Yoga/meditation confer supernatural powers?
3,33,प्रातिभाद्वा सर्वम्,"Or, intuition (a foreground of districrinatory knowledge) may bring about knowlede of all.",How does knowledge about everything gained? Can one know about everything? What is the importance of intuition?
3,34,हृदये चित्तसंवित्,"By concentrating with utmost discipline on the heart, one can comprehend the essence of consciousness.",Can one know everything about mind and its functions? How does one know about mind and its functions? What is the importance of meditating on the heart (region)? 
3,35,सत्त्वपुरुषयोरत्यन्तासंकीर्णयोः प्रत्ययाविशेषो भोगः परार्थात्स्वार्थसंयमात्पुरुषज्ञानम्,"Wordly perception comprises of experiences where the pure consiousness (purusha*) is misconceived as pure (sattva*) intellect, whereas both are seperate. However, wordly perception exists to serve the comprehension of the other (i.e. pure consiousness).  By concentrating with utmost discipline on the one that dwells for itself, understanding of the pure consciousness is revealed.",How does one usually perceive consciousness or awareness of the self? What is the role of 'the self' ? How does the knowledge of the 'self arises'? What is the importance of the worldly experience?
3,36,ततः प्रातिभश्रावणवेदनादर्शास्वादवार्ता जायन्ते,"As a result of this (above) understanding, intuition and elevated sense of hearing, touch, sight, taste, smell emerge.",What powers does one accquire by having intuition? How can one develop mystical/divine sense experiences?
3,37,ते समाधावुपसर्गा व्युत्थाने सिद्धयः,"Although these heightened sensory abilities may seem like accomplishments to outwardly directed mind, they are obstacles in the path of liberation/integration.",Are supernatural powers desirable on the path of Yoga? Does supernatural powers help in Yoga progress? How does siddhis/supernatural powers help in Yoga?
3,38,बन्धकारणशैथिल्यात्प्रचारसंवेदनाच्च चित्तस्य परशरीरावेशः,"By letting go of one's attachment(s) and being acutely attuned to the pathways of consciousness, it can settle in another individual's body.",How does detachment help in Yoga? What is the importance of detachment in Yoga? What is the importance of perfectly knowing the the behaviour of the mind? What (supernatural) powers are accquired by developing detachment and thorough knowledge/behaviour of the mind? Is it possible to perfectly know the behaviour of the mind?
