1,"[य]
शतायुर उक्तः पुरुषः शतवीर्यश च वैदिके
कस्मान मरियन्ते पुरुषा बाला अपि पितामह"
112,"संध्यायां न सवपेद राजन विद्यां न च समाचरेत
न भुञ्जीत च मेधावी तथायुर विन्दते महत"
113,"नक्तं न कुर्यात पित्र्याणि भुक्त्वा चैव परसाधनम
पानीयस्य करिया नक्तं न कार्या भूतिम इच्छता"
114,"वर्जनीयाश च वै नित्यं सक्तवॊ निशि भारत
शेषाणि चावदातानि पानीयं चैव भॊजने"
115,"सौहित्यं च न कर्तव्यं रात्रौ नैव समाचरेत
दविजच छेदं न कुर्वीत भुक्त्वा नच समाचरेत"
116,"महाकुलप्रसूतां च परशस्तां लक्षणैस तथा
वयःस्थां च महाप्राज्ञ कन्याम आवॊढुम अर्हति"
117,"अपत्यम उत्पाद्य ततः परतिष्ठाप्य कुलं तथा
पुत्राः परदेया जञानेषु कुलधर्मेषु भारत"
118,"कन्या चॊत्पाद्य दातव्या कुलपुत्राय धीमते
पुत्रा निवेश्याश च कुलाद भृत्या लभ्याश च भारत"
119,"शिरःस्नातॊ ऽथ कुर्वीत दैवं पित्र्यम अथापि च
नक्षत्रे न च कुर्वीत यस्मिञ जातॊ भवेन नरः
न परॊष्ठपदयॊः कार्यं तथाग्नेये च भारत"
120,"दारुणेषु च सर्वेषु परत्यहं च विवर्जयेत
जयॊतिषे यानि चॊक्तानि तानि सर्वाणि वर्जयेत"
121,"पराङ्मुखः शमश्रुकर्माणि कारयेत समाहितः
उदङ्मुखॊ वा राजेन्द्र तथायुर विन्दते महत"
122,"परिवादं न च बरूयात परेषाम आत्मनस तथा
परिवादॊ न धर्माय परॊच्यते भरतर्षभ"
123,"वर्जयेद वयङ्गिनीं नारीं तथा कन्यां नरॊत्तम
समार्षां वयङ्गितां चैव मातुः सवकुलजां तथा"
124,"वृद्धां परव्रजितां चैव तथैव च पतिव्रताम
तथातिकृष्ण वर्णां च वर्णॊत्कृष्टां च वर्जयेत"
125,"अयॊनिं च वियॊनिं च न गच्छेत विचक्षणः
पिङ्गलां कुष्ठिनीं नारीं न तवम आवॊढुम अर्हसि"
126,"अपस्मारि कुले जातां निहीनां चैव वर्जयेत
शवित्रिणां च कुले जातां तरयाणां मनुजेश्वर"
127,"लक्षणैर अन्विता या च परशस्ता या च लक्षणैः
मनॊज्ञा दर्शनीया च तां भवान वॊढुम अर्हति"
128,"महाकुले निवेष्टव्यं सदृशे वा युधिष्ठिर
अवरा पतिता चैव न गराह्या भूतिम इच्छता"
129,"अग्नीन उत्पाद्य यत्नेन करियाः सुविहिताश च याः
वेदेषु बराह्मणैः परॊक्तास ताश च सर्वाः समाचरेत"
130,"न चेर्ष्या सत्रीषु कर्तव्या दारा रक्ष्याश च सर्वशः
अनायुष्या भवेद ईर्ष्या तस्माद ईर्ष्यां विवर्जयेत"
131,"अनायुष्यॊ दिवा सवप्नस तथाभ्युदित शायिता
परातर निशायां च तथा ये चॊच्छिष्टाः सवपन्ति वै"
132,"पारदार्यम अनायुष्यं नापितॊच्च्छिष्टता तथा
यत्नतॊ वै न कर्तव्यम अभ्यासश चैव भारत"
133,"संध्यां न भुञ्जेन न सनायान न पुरीषं समुत्सृजेत
परयतश च भवेत तस्यां न च किं चित समाचरेत"
134,"बराह्मणान पूजयेच चापि तथा सनात्वा नराधिप
देवांश च परणमेत सनातॊ गुरूंश चाप्य अभिवादयेत"
135,"अनिमन्त्रितॊ न गच्छेत यज्ञं गच्छेत तु दर्शकः
अनिमन्त्रिते हय अनायुष्यं गमनं तत्र भारत"
136,"न चैकेन परिव्राज्यं न गन्तव्य तथा निशि
अनागतायां संध्यायां पश्चिमायां गृहे वसेत"
137,"मातुः पितुर गुरूणां च कार्यम एवानुशासनम
हितं वाप्य अहितं वापि न विचार्यं नरर्षभ"
138,"धनुर्वेदे च वेदे च यत्नः कार्यॊ नराधिप
हस्तिपृष्ठे ऽशवपृष्ठे च रथचर्यासु चैव ह
यत्नवान भव राजेन्द्र यत्नवान सुखम एधते"
139,"अप्रधृष्यश च शत्रूणां भृत्यानां सवजनस्य च
परजापालनयुक्तश च न कषतिं लभते कव चित"
140,"युक्तिशास्त्रं च ते जञेयं शब्दशास्त्रं च भारत
गन्धर्वशास्त्रं च कलाः परिज्ञेया नराधिप"
141,"पुराणम इतिहासाश च तथाख्यानानि यानि च
महात्मनां च चरितं शरॊतव्यं नित्यम एव ते"
142,"पत्नीं रजस्वलां चैव नाभिगच्छेन न चाह्वयेत
सनातां चतुर्थे दिवसे रात्रौ गच्छेद विचक्षणः"
143,"पञ्चमे दिवसे नारी षष्ठे ऽहनि पुमान भवेत
एतेन विधिना पत्नीम उपगच्छेत पण्डितः"
144,"जञातिसंबन्धिमित्राणि पूजनीयानि नित्यशः
यष्टव्यं च यथाशक्ति यज्ञैर विविधदक्षिणैः
अत ऊर्ध्वम अरण्यं च सेवितव्यं नराधिप"
145,"एष ते लक्षणॊद्देश आयुष्याणां परकीर्तितः
शेषस तरैविद्य वृद्धेभ्यः परत्याहार्यॊ युधिष्ठिर"
146,"आचारॊ भूतिजनन आचारः कीर्तिवर्धनः
आचाराद वर्धते हय आयुर आचारॊ हन्त्य अलक्षणम"
147,"आगमानां हि सर्वेषाम आचारः शरेष्ठ उच्यते
आचार परभवॊ धर्मॊ धर्माद आयुर विवर्धते"
148,"एतद यशस्यम आयुष्यं सवर्ग्यं सवस्त्ययनं महत
अनुकम्पता सर्ववर्णान बरह्मणा समुदाहृतम"
