1,"[धृ]
तथा परयाते शिबिरं दरॊणपुत्रे महारथे
कच चित कृपश च भॊजश च भयार्तौ न नयवर्तताम"
112,"एवं विचरतस तस्य निघ्नतः सुबहून नरान
तमसा रजनी घॊरा बभौ दारुणदर्शना"
113,"किं चित पराणैश च पुरुषैर हतैश चान्यैः सहस्रशः
बहुना च गजाश्वेन भूर अभूद भीमदर्शना"
114,"यक्षरक्षःसमाकीर्णे रथाश्वद्विपदारुणे
करुद्धेन दरॊणपुत्रेण संछिन्नाः परापतन भुवि"
115,"मातॄर अन्ये पितॄन अन्ये भरातॄन अन्ये विचुक्रुशुः
के चिद ऊचुर न तत करुद्धैर धार्तराष्ट्रैः कृतं रणे"
116,"यत्कृतं नः परसुप्तानां रक्षॊभिः करूरकर्मभिः
असांनिध्याद धि पार्थानाम इदं नः कदनं कृतम"
117,"न देवासुरगन्धर्वैर न यक्षैर न च राक्षसैः
शक्यॊ विजेतुं कौन्तेयॊ गॊप्ता यस्य जनार्दनः"
118,"बरह्मण्यः सत्यवाग दान्तः सर्वभूतानुकम्पकः
न च सुप्तं परमत्तं वा नयस्तशस्त्रं कृताञ्जलिम
धावन्तं मुक्तकेशं वा हन्ति पार्थॊ धनंजयः"
119,"तद इदं नः कृतं घॊरं रक्षॊभिः करूरकर्मभिः
इति लालप्यमानाः सम शेरते बहवॊ जनाः"
120,"सतनतां च मनुष्याणाम अपरेषां च कूजताम
ततॊ मुहूर्तात पराशाम्यत स शब्दस तुमुलॊ महान"
121,"शॊणितव्यतिषिक्तायां वसुधायां च भूमिप
तद रजस तुमुलं घॊरं कषणेनान्तर अधीयत"
122,"संवेष्टमानान उद्विग्नान निरुत्साहान सहस्रशः
नयपातयन नरान करुद्धः पशून पशुपतिर यथा"
123,"अन्यॊन्यं संपरिष्वज्य शयानान दरवतॊ ऽपरान
संलीनान युध्यमानांश च सर्वान दरौणिर अपॊथयत"
124,"दह्यमाना हुताशेन वध्यमानाश च तेन ते
परस्परं तदा यॊधा अनयन यमसादनम"
125,"तस्या रजन्यास तव अर्धेन पाण्डवानां महद बलम
गमयाम आस राजेन्द्र दरौणिर यम निवेशनम"
126,"निशाचराणां सत्त्वानां स रात्रिर हर्षवर्धिनी
आसीन नरगजाश्वानां रौद्री कषयकरी भृशम"
127,"तत्रादृश्यन्त रक्षांसि पिशाचाश च पृथग्विधाः
खादन्तॊ नरमांसानि पिबन्तः शॊणितानि च"
128,"करालाः पिङ्गला रौद्राः शैलदन्ता रजस्वलाः
जटिला दीर्घसक्थाश च पञ्च पादा महॊदराः"
129,"पश्चाद अङ्गुलयॊ रूक्षा विरूपा भैरवस्वनाः
घटजानवॊ ऽतिह्रस्वाश च नीलकण्ठा विभीषणाः"
130,"सपुत्रदाराः सुक्रूरा दुर्दर्शन सुनिर्घृणाः
विविधानि च रूपाणि तत्रादृश्यन्त रक्षसाम"
131,"पीत्वा च शॊणितं हृष्टाः परानृत्यन गणशॊ ऽपरे
इदं वरम इदं मेध्यम इदं सवाद्व इति चाब्रुवन"
132,"मेदॊ मज्जास्थि रक्तानां वसानां च भृशासिताः
परमांसानि खादन्तः करव्यादा मांसजीविनः"
133,"वसां चाप्य अपरे पीत्वा पर्यधावन विकुक्षिलाः
नाना वक्त्रास तथा रौद्राः करव्यादाः पिशिताशिनः"
134,"अयुतानि च तत्रासन परयुतान्य अर्बुदानि च
रक्षसां घॊररूपाणां महतां करूरकर्मणाम"
135,"मुदितानां वितृप्तानां तस्मिन महति वैशसे
समेतानि बहून्य आसन भूतानि च जनाधिप"
136,"परत्यूषकाले शिबिरात परतिगन्तुम इयेष सः
नृशॊणितावसिक्तस्य दरौणेर आसीद असि तसरुः
पाणिना सह संश्लिष्ट एकीभूत इव परभॊ"
137,"स निःशेषान अरीन कृत्वा विरराज जनक्षये
युगान्ते सर्वभूतानि भस्मकृत्वेव पावकः"
138,"यथाप्रतिज्ञं तत कर्मकृत्वा दरौणायनिः परभॊ
दुर्गमां पदवीं कृत्वा पितुर आसीद गतज्वरः"
139,"यथैव संसुप्त जने शिबिरे पराविशन निशि
तथैव हत्वा निःशब्दे निश्चक्राम नरर्षभः"
140,"निष्क्रम्य शिबिरात तस्मात ताभ्यां संगम्य वीर्यवान
आचख्यौ कर्म तत सर्वं हृष्टः संहर्षयन विभॊ"
141,"ताव अप्य आचख्यतुस तस्मै परियं परियकरौ तदा
पाञ्चालान सृञ्जयांश चैव विनिकृत्तान सहस्रशः
परीत्या चॊच्चैर उदक्रॊशंस तथैवास्फॊटयंस तलान"
142,"एवंविधा हि सा रात्रिः सॊमकानां जनक्षये
परसुप्तानां परमत्तानाम आसीत सुभृशदारुणा"
143,"असंशयं हि कालस्य पर्यायॊ दुरतिक्रमः
तादृशा निहता यत्र कृत्वास्माकं जनक्षयम"
144,"[धृ]
पराग एव सुमहत कर्म दरौणिर एतन महारथः
नाकरॊद ईदृशं कस्मान मत पुत्र विजये धृतः"
145,"अथ कस्माद धते कषत्रे कर्मेदं कृतवान असौ
दरॊणपुत्रॊ महेष्वासस तन मे शंसितुम अर्हसि"
146,"[स]
तेषां नूनं भयान नासौ कृतवान कुरुनन्दन
असांनिध्याद धि पार्थानां केशवस्य च धीमतः"
147,"सात्यकेश चापि कर्मेदं दरॊणपुत्रेण साधितम
न हि तेषां समक्षं तान हन्याद अपि मरुत्पतिः"
148,"एतद ईदृशकं वृत्तं राजन सुप्त जने विभॊ
ततॊ जनक्षयं कृत्वा पाण्डवानां महात्ययम
दिष्ट्या दिष्ट्येति चान्यॊन्यं समेत्यॊचुर महारथाः"
149,"पर्यष्वजत ततॊ दरौणिस ताभ्यां च परतिनन्दितः
इदं हर्षाच च सुमहद आददे वाक्यम उत्तमम"
150,"पाञ्चाला निहताः सर्वे दरौपदेयाश च सर्वशः
सॊमका मत्स्यशेषाश च सर्वे विनिहता मया"
151,"इदानीं कृतकृत्याः सम यामतत्रैव माचिरम
यदि जीवति नॊ राजा तस्मै शंसामहे परियम"
