1,"[पुलस्त्य]
ततॊ गच्छेत धर्मज्ञ धर्मतीर्थं पुरातनम
तत्र सनात्वा नरॊ राजन धर्मशीलः समाहितः
आ सप्तमं कुलं राजन पुनीते नात्र संशयः"
110,"जातिस्मर उपस्पृश्य शुचिः परयत मानसः
जातिस्मरत्वं पराप्नॊति सनात्वा तत्र न संशयः"
111,"वटेश्वर पुरं गत्वा अर्चयित्वा तु केशवम
ईप्सिताँल लभते कामान उपवासान न संशयः"
112,"ततस तु वामनं गत्वा सर्वपापप्रमॊचनम
अभिवाद्य हरिं देवं न दुर्गतिम अवाप्नुयात"
113,"भरतस्याश्रमं गत्वा सर्वपापप्रमॊचनम
कौशिकीं तत्र सेवेत महापातक नाशिनीम
राजसूयस्य यज्ञस्य फलं पराप्नॊति मानवः"
114,"ततॊ गच्छेत धर्मज्ञ चम्पकारण्यम उत्तमम
तत्रॊष्य रजनीम एकां गॊसहस्रफलं लभेत"
115,"अथ जयेष्ठिलम आसाद्य तीर्थं परमसंमतम
उपॊष्य रजनीम एकाम अग्निष्टॊम फलं लभेत"
116,"तत्र विश्वेश्वरं दृष्ट्वा देव्या सह महाद्युतिम
मित्रा वरुणयॊर लॊकान आप्नॊति पुरुषर्षभ"
117,"कन्या संवेद्यम आसाद्य नियतॊ नियताशनः
मनॊः परजापतेर लॊकान आप्नॊति भरतर्षभ"
118,"कन्यायां ये परयच्छन्ति पानम अन्नं च भारत
तद अक्षयम इति पराहुर ऋषयः संशितव्रताः"
119,"निश्चीरां च समासाद्य तरिषु लॊकेषु विश्रुताम
अश्वमेधम अवाप्नॊति विष्णुलॊकं च गच्छति"
120,"ये तु दानं परयच्छन्ति निश्चीरा संगमे नराः
ते यान्ति नरशार्दूल बरह्मलॊकं न संशयः"
121,"तत्राश्रमॊ वसिष्ठस्य तरिषु लॊकेषु विश्रुतः
तत्राभिषेकं कुर्वाणॊ वाजपेयम अवाप्नुयात"
122,"देवकूटं समासाद्य बरह्मर्षिगणसेवितम
अश्वमेधम अवाप्नॊति कुलं चैव समुद्धरेत"
123,"ततॊ गच्छेत राजेन्द्र कौशिकस्य मुनेर हरदम
यत्र सिद्धिं परां पराप्तॊ विश्वा मित्रॊ ऽथ कौशिकः"
124,"तत्र मासं वसेद वीर कौशिक्यां भरतर्षभ
अश्वमेधस्य यत पुण्यं तन मासेनाधिगच्छति"
125,"सर्वतीर्थवरे चैव यॊ वसेत महाह्रदे
न दुर्गतिम अवाप्नॊति विन्देद बहुसुवर्णकम"
126,"कुमारम अभिगत्वा च वीराश्रमनिवासिनम
अश्वमेधम अवाप्नॊति नरॊ नास्त्य अत्र संशयः"
127,"अग्निधारां समासाद्य तरिषु लॊकेषु विश्रुताम
अग्निष्टॊमम अवाप्नॊति न च सवर्गान निवर्तते"
128,"पिता मह सरॊ गत्वा शैलराजप्रतिष्ठितम
तत्राभिषेकं कुर्वाणॊ अग्निष्टॊम फलं लभेत"
129,"पिता महस्य सरसः परस्रुता लॊकपावनी
कुमार धारा तत्रैव तरिषु लॊकेषु विश्रुता"
130,"यत्र सनात्वा कृतार्थॊ ऽसमीत्य आत्मानम अवगच्छति
षष्ठ कालॊपवासेन मुच्यते बरह्महत्यया"
131,"शिखरं वै महादेव्या गौर्यास तरैलॊक्यविश्रुतम
समारुह्य नरः शराद्धः सतनकुण्डेषु संविशेत"
132,"तत्राभिषेकं कुर्वाणः पितृदेवार्चने रतः
हयमेधम अवाप्नॊति शक्र लॊकं च गच्छति"
133,"ताम्रारुणं समासाद्य बरह्म चारी समाहितः
अश्वमेधम अवाप्नॊति शक्र लॊकं च गच्छति"
134,"नन्दिन्यां च समासाद्य कूपं तरिदशसेवितम
नरमेधस्य यत पुण्यं तत पराप्नॊति कुरूद्वह"
135,"कालिका संगमे सनात्वा कौशिक्यारुणयॊर यतः
तरिरात्रॊपॊषितॊ विद्वान सर्वपापैः परमुच्यते"
136,"उर्वशी तीर्थम आसाद्य ततः सॊमाश्रमं बुधः
कुम्भकर्णाश्रमे सनात्वा पूज्यते भुवि मानवः"
137,"सनात्वा कॊका मुखे पुण्ये बरह्म चारी यतव्रतः
जातिस्मरत्वं पराप्नॊति दृष्टम एतत पुरातने"
138,"सकृन नन्दां समासाद्य कृतात्मा भवति दविजः
सर्वपापविशुद्धात्मा शक्र लॊकं च गच्छति"
139,"ऋषभद्वीपम आसाद्य सेव्यं करौञ्चनिषूदनम
सरस्वत्याम उपस्पृश्य विमानस्थॊ विराजते"
140,"औद्दालकं महाराज तीर्थं मुनिनिषेवितम
तत्राभिषेकं कुर्वीत सर्वपापैः परमुच्यते"
141,"धर्मतीर्थं समासाद्य पुण्यं बरह्मर्षिसेवितम
वाजपेयम अवाप्नॊति नरॊ नास्त्य अत्र संशयः"
142,"तथा चम्पां समासाद्य भागीरथ्यां कृतॊदकः
दण्डार्कम अभिगम्यैव गॊसहस्रफलं लभेत"
143,"लवेडिकां ततॊ गच्छेत पुण्यां पुण्यॊपसेविताम
वाजपेयम अवाप्नॊति विमानस्थश च पूज्यते"
