1,"[व]
धनंजयॊत्सुकास ते तु वने तस्मिन महारथाः
नयवसन्त महाभागा दरौपद्या सह पाण्डवाः"
114,"यजनं याजनं गत्वा तथैव बरह्म वालुकाम
पुष्पन्यास उपस्पृश्य न शॊचेन मरणं ततः"
115,"अर्धयॊजनविस्तारां पञ्चयॊजनम आयताम
एतावद देविकाम आहुः पुण्यां देवर्षिसेविताम"
116,"ततॊ गच्छेत धर्मज्ञ दीर्घसत्रं यथाक्रमम
यत्र बरह्मादयॊ देवाः सिद्धाश च परमर्षयः
दीर्घसत्रम उपासन्ते दक्षिणाभिर यतव्रताः"
117,"गमनाद एव राजेन्द्र दीर्घसत्रम अरिंदम
राजसूयाश्वमेधाभ्यां फलं पराप्नॊति मानवः"
118,"ततॊ विनशनं गच्छेन नियतॊ नियताशनः
गच्छत्य अन्तर्हिता यत्र मरु पृष्ठे सरस्वती
चमसे च शिवॊद्भेदे नागॊद्भेदे च दृश्यते"
119,"सनात्वा च चमसॊद्भेदे अग्निष्टॊम फलं लभेत
शिवॊद्भेदे नरः सनात्वा गॊसहस्रफलं लभेत"
120,"नागॊद्भेदे नरः सनात्वा नागलॊकम अवाप्नुयात
शशयानं च राजेन्द्र तीर्थम आसाद्य दुर्लभम
शशरूपप्रतिछन्नाः पुष्करा यत्र भारत"
121,"सरस्वत्यां महाराज अनु संवत्सरं हि ते
सनायन्ते भरतश्रेष्ठ वृत्तां वै कार्तिकीं सदा"
122,"तत्र सनात्वा नरव्याघ्र दयॊतते शशिवत सदा
गॊसहस्रपलं चैव पराप्नुयाद भरतर्षभ"
123,"कुमार कॊटिम आसाद्य नियतः कुरुनन्दन
तत्राभिषेकं कुर्वीत पितृदेवार्चने रतः
गवामयम अवाप्नॊति कुलं चैव समुद्धरेत"
124,"ततॊ गच्छेत धर्मज्ञ रुद्र कॊटिं समाहितः
पुरा यत्र महाराज ऋषिकॊटिः समाहिता
परहर्षेण च संविष्टा देव दर्शनकाङ्क्षया"
125,"अहं पूर्वम अहं पूर्वं दरक्ष्यामि वृषभध्वजम
एवं संप्रस्थिता राजन्न ऋषयः किल भारत"
126,"ततॊ यॊगेष्वरेणापि यॊगम आस्थाय भूपते
तेषां मन्युप्रणाशार्थम ऋषीणां भावितात्मनाम"
127,"सृष्टा कॊटिस तु रुद्राणाम ऋषीणाम अग्रतः सथिता
मया पूर्वतरं दृष्ट इति ते मेनिरे पृथक"
128,"तेषां तुष्टॊ महादेव ऋषीणाम उग्रतेजसाम
भक्त्या परमया राजन वरं तेषां परदिष्टवान
अद्य परभृति युष्माकं धर्मवृद्धिर भविष्यति"
129,"तत्र सनात्वा नरव्याघ्र रुद्र कॊट्यां नरः शुचिः
अश्वमेधम अवाप्नॊति कुलं चैव समुद्धरेत"
130,"ततॊ गच्छेत राजेन्द्र संगमं लॊकविश्रुतम
सरस्वत्या महापुण्यम उपासन्ते जनार्दनम"
131,"यत्र बरह्मादयॊ देवा ऋषयः सिद्धचारणाः
अभिगच्छन्ति राजेन्द्र चैत्रशुक्लचतुर्दशीम"
132,"तत्र सनात्वा नरव्याघ्र विन्देद बहुसुवर्णकम
सर्वपापविशुद्धात्मा बरह्मलॊकं च गच्छति"
133,"ऋषीणां यत्र सत्राणि समाप्तानि नराधिप
सत्रावसानम आसाद्य गॊसहस्रफलं लभेत"
