1,"[पुलस्त्य]
ततॊ गच्छेत धर्मज्ञ धर्मतीर्थं पुरातनम
तत्र सनात्वा नरॊ राजन धर्मशीलः समाहितः
आ सप्तमं कुलं राजन पुनीते नात्र संशयः"
2,"ततॊ गच्छेत धर्मज्ञ कारा पतनम उत्तमम
अग्निष्टॊमम अवाप्नॊति मुनिलॊकं च गच्छति"
3,"सौगन्धिकं वनं राजंस ततॊ गच्छेत मानवः
यत्र बरह्मादयॊ देवा ऋषयश च तपॊधनाः"
4,"सिद्धचारणगन्धर्वाः किंनराः स महॊरगाः
तद वनं परविशन्न एव सर्वपापैः परमुच्यते"
5,"ततॊ हि सा सरिच्छ्रेष्ठा नदीनाम उत्तमा नदी
पलक्षाद देवी सरुता राजन महापुण्या सरस्वती"
6,"तत्राभिषेकं कुर्वीत वल्मीकान निःसृते जले
अर्चयित्वा पितॄन देवान अश्वमेध फलं लभेत"
7,"ईशानाध्युषितं नाम तत्र तीर्थं सुदुर्लभम
षट्सु शम्या निपातेषु वल्मीकाद इति निश्चयः"
8,"कपिलानां सहस्रं च वाजिमेधं च विन्दति
तत्र सनात्वा नरव्याघ्र दृष्टम एतत पुरातने"
9,"सुगन्धां शतकुम्भां च पञ्च यज्ञां च भारत
अभिगम्य नरश्रेष्ठ सवर्गलॊके महीयते"
10,"तरिशूलखातं तत्रैव तीर्थम आसाद्य भारत
तत्राभिषेकं कुर्वीत पितृदेवार्चने रतः
गाणपत्यं स लभते देहं तयक्त्वा न संशयः"
11,"ततॊ गच्छेत राजेन्द्र देव्याः सथानं सुदुर्लभम
शाकम्भरीति विख्याता तरिषु लॊकेषु विश्रुता"
12,"दिव्यं वर्षसहस्रं हि शाकेन किल सुव्रत
आहारं सा कृतवती मासि मासि नराधिप"
13,"ऋषयॊ ऽभयागतास तत्र देव्या भक्त्या तपॊधनाः
आतिथ्यं च कृतं तेषां शाकेन किल भारत
ततः शाकम्भरीत्य एव नाम तस्याः परतिष्ठितम"
14,"शाकम्भरीं समासाद्य बरह्म चारी समाहितः
तरिरात्रम उषितः शाकं भक्षयेन नियतः शुचिः"
15,"शाकाहारस्य यत सम्यग वर्षैर दवादशभिः फलम
तत फलं तस्य भवति देव्याश छन्देन भारत"
16,"ततॊ गच्छेत सुवर्णाक्षं तरिषु लॊकेषु विश्रुतम
यत्र विष्णुः परसादार्थं रुद्रम आराधयत पुरा"
17,"वरांश च सुबहूँल लेभे दैवतेषु सुदुर्लभान
उक्तश च तरिपुरघ्नेन परितुष्टेन भारत"
18,"अपि चास्मत परियतरॊ लॊके कृष्ण भविष्यसि
तवन मुखं च जगत कृत्स्नं भविष्यति न संशयः"
19,"तत्राभिगम्य राजेन्द्र पूजयित्वा वृषध्वजम
अश्वमेधम अवाप्नॊति गाणपत्यं च विन्दति"
20,"धूमावतीं ततॊ गच्छेत तरिरत्रॊपॊषितॊ नरः
मनसा परार्थितान कामाँल लभते नात्र संशयः"
21,"देव्यास तु दक्षिणार्धेन रथावर्तॊ नराधिप
तत्रारॊहेत धर्मज्ञ शरदधानॊ जितेन्द्रियः
महादेव परसादाद धि गच्छेत परमं गतिम"
22,"परदक्षिणम उपावृत्य गच्छेत भरतर्षभ
धारां नाम महाप्राज्ञ सर्वपापप्रणाशिनीम
तत्र सनात्वा नरव्याघ्र न शॊचति नराधिप"
23,"ततॊ गच्छेत धर्मज्ञ नमस्कृत्य महागिरिम
सवर्गद्वारेण यत तुल्यं गङ्गा दवारं न संशयः"
24,"तत्राभिषेकं कुर्वीत कॊटितीर्थे समाहितः
पुण्डरीकम अवाप्नॊति कुलं चैव समुद्धरेत"
25,"सप्त गङ्गे तरिगङ्गे च शक्रावर्ते च तर्पयन
देवान पितॄंश च विधिवत पुण्यलॊके महीयते"
26,"ततः कनखले सनात्वा तरिरात्रॊपॊषितॊ नरः
अश्वमेधम अवाप्नॊति सवर्गलॊकं च गच्छति"
27,"कपिला वटं च गच्छेत तीर्थसेवी नराधिप
उष्यैकां रजनीं तत्र गॊसहस्रफलं लभेत"
28,"नागराजस्य राजेन्द्र कपिलस्य महात्मनाः
तीर्थं कुरु वरश्रेष्ठ सर्वलॊकेषु विश्रुतम"
29,"तत्राभिषेकं कुर्वीत नागतीर्थे नराधिप
कपिलानां सहस्रस्य फलं पराप्नॊति मानवः"
30,"ततॊ ललितिकां गच्छेच छंतनॊर तीर्थम उत्तमम
तत्र सनात्वा नरॊ राजन न दुर्गतिम अवाप्नुयात"
31,"गङ्गा संगमयॊश चैव सनाति यः संगमे नरः
दशाश्वमेधान आप्नॊति कुलं चैव समुद्धरेत"
32,"ततॊ गच्छेत राजेन्द्र सुगन्धां लॊकविश्रुताम
सर्वपापविशुद्धात्मा बरह्मलॊके महीयते"
33,"रुद्रावर्तं ततॊ गच्छेत तीर्थसेवी नराधिप
तत्र सनात्वा नरॊ राजन सवर्गलॊके महीयते"
34,"गङ्गायाश च नरश्रेष्ठ सरस्वत्याश च संगमे
सनातॊ ऽशवमेधम आप्नॊति सवर्गलॊकं च गच्छति"
35,"भद्र कर्णेश्वरं गत्वा देवम अर्च्य यथाविधि
न दुर्गतिम अवाप्नॊति सवर्गलॊकं च गच्छति"
36,"ततः कुब्जाम्रकं गच्छेत तीर्थसेवी यथाक्रमम
गॊसहस्रम अवाप्नॊति सवर्गलॊकं च गच्छति"
37,"अरुन्धती वटं गच्छेत तीर्थसेवी नराधिप
सामुद्रकम उपस्पृश्य तरिरात्रॊपॊषितॊ नरः
गॊसहस्रफलं विन्देत कुलं चैव समुद्धरेत"
38,"बरह्मावर्तं ततॊ गच्छेद बरह्म चारी समाहितः
अश्वमेधम अवाप्नॊति सवर्गलॊकं च गच्छति"
39,"यमुना परभवं गत्वा उपस्पृश्य च यामुने
अश्वमेध फलं लब्ध्वा सवर्गलॊके महीयते"
40,"दर्वी संक्रमणं पराप्य तीर्थं तरैलॊक्यविश्रुतम
अश्वमेधम अवाप्नॊति सवर्गलॊकं च गच्छति"
41,"सिन्धॊर च परभवं गत्वा सिद्धगन्धर्वसेवितम
तत्रॊष्य रजनीः पञ्च विन्द्याद बहुसुवर्णकम"
42,"अथ वेदीं समासाद्य नरः परमदुर्गमाम
अश्वमेधम अवाप्नॊति गच्छेच चौशनसीं गतिम"
43,"ऋषिकुल्यां समासाद्य वासिष्ठं चैव भारत
वासिष्ठं समतिक्रम्य सर्वे वर्णा दविजातयः"
44,"ऋषिकुल्यां नरः सनात्वा ऋषिलॊकं परपद्यते
यदि तत्र वसेन मासं शाकाहारॊ नराधिप"
45,"भृगुतुङ्गं समासाद्य वाजिमेधफलं लभेत
गत्वा वीर परमॊक्षं च सर्वपापैः परमुच्यते"
46,"कृत्तिका मघयॊश चैव तीर्थम आसाद्य भारत
अग्निष्टॊमातिरात्राभ्यां फलं पराप्नॊति पुण्यकृत"
47,"ततः संध्यां समासाद्य विद्या तीर्थम अनुत्तमम
उपस्पृश्य च विद्यानां सर्वासां पारगॊ भवेत"
48,"महाश्रमे वसेद रात्रिं सर्वपापप्रमॊचने
एककालं निराहारॊ लॊकान आवसते शुभान"
49,"षष्ठ कालॊपवासेन मासम उष्य महालये
सर्वपापविशुद्धात्मा विन्द्याद बहुसुवर्णकम"
50,"अथ वेतसिकां गत्वा पिता मह निषेविताम
अश्वमेधम अवाप्नॊति गच्छेच चौशनसीं गतिम"
51,"अथ सुन्दरिका तीर्थं पराप्य सिद्धनिषेवितम
रूपस्य भागी भवति दृष्टम एतत पुरातने"
52,"ततॊ वै बराह्मणीं गत्वा बरह्म चारी जितेन्द्रियः
पद्मवर्णेन यानेन बरह्मलॊकं परपद्यते"
53,"ततश च नैमिषं गच्छेत पुण्यं सिद्धनिषेवितम
तत्र नित्यं निवसति बरह्मा देवगणैर वृतः"
54,"नैमिषं परार्थयानस्य पापस्यार्धं परणश्यति
परविष्टमात्रस तु नरः सर्वपापैः परमुच्यते"
55,"तत्र मासं वसेद धीरॊ नैमिषे तीर्थतत्परः
पृथिव्यां यानि तीर्थानि नैमिषे तानि भारत"
56,"अभिषेककृतस तत्र नियतॊ नियताशनः
गवामयस्य यज्ञस्य फलं पराप्नॊति भारत
पुनात्य आ सप्तमं चैव कुलं भरतसत्तम"
57,"यस तयजेन नैमिषे पराणान उपवासपरायणः
स मॊदेत सवर्गलॊकस्थ एवम आहुर मनीषिणः
नित्यं पुण्यं च मेध्यं च नैमिषं नृपसत्तम"
58,"गङ्गॊद्भेदं समासाद्य तरिरात्रॊपॊषितॊ नरः
वाजपेयम अवाप्नॊति बरह्मभूतश च जायते"
59,"सरस्वतीं समासाद्य तर्पयेत पितृदेवताः
सारस्वतेषु लॊकेषु मॊदते नात्र संशयः"
60,"ततश च बाहुदां गच्छेद बरह्म चारी समाहितः
देव सत्रस्य यज्ञस्य फलं पराप्नॊति मानवः"
61,"ततश चीरवतीं गच्छेत पुण्यां पुण्यतमैर वृताम
पितृदेवार्चन रतॊ वाजपेयम अवाप्नुयात"
62,"विमलाशॊकम आसाद्य विराजति यथा शशी
तत्रॊष्य रजनीम एकां सवर्गलॊके महीयते"
63,"गॊप्रतारं ततॊ गच्छेत सरय्वास तीर्थम उत्तमम
यत्र रामॊ गतः सवर्गं स भृत्यबलवाहनः"
64,"देहं तयक्त्वा दिवं यातस तस्य तीर्थस्य तेजसा
रामस्य च परसादेन वयवसायाच च भारत"
65,"तस्मिंस तीर्थे नरः सनात्वा गॊमत्यां कुरुनन्दन
सर्वपापविशुद्धात्मा सवर्गलॊके महीयते"
66,"राम तीर्थे नरः सनात्वा गॊमत्यां कुरुनन्दन
अश्वमेधम अवाप्नॊति पुनाति च कुलं नरः"
67,"शतसाहस्रिकं तत्र तीर्थं भरतसत्तम
तत्रॊपस्पर्शनं कृत्वा नियतॊ नियताशनः
गॊसहस्रफलं पुण्यं पराप्नॊति भरतर्षभ"
68,"ततॊ गच्छेत राजेन्द्र भर्तृस्थानम अनुत्तमम
कॊटितीर्थे नरः सनात्वा अर्चयित्वा गुहं नृप
गॊसहस्रफलं विन्देत तेजस्वी च भवेन नरः"
69,"ततॊ वाराणसीं गत्वा अर्चयित्वा वृषध्वजम
कपिला हरदे नरः सनात्वा राजसूय फलं लभेत"
70,"मार्कण्डेयस्य राजेन्द्र तीर्थम आसाद्य दुर्लभम
गॊमती गङ्गयॊश चैव संगमे लॊकविश्रुते
अग्निष्टॊमम अवाप्नॊति कुलं चैव समुद्धरेत"
71,"ततॊ गयां समासाद्य बरह्म चारी जितेन्द्रियः
अश्वमेधम अवाप्नॊति गमनाद एव भारत"
72,"तत्राक्षयवतॊ नाम तरिषु लॊकेषु विश्रुतः
पितॄणां तत्र वै दत्तम अक्षयं भवति परभॊ"
73,"महानद्याम उपस्पृश्य तर्पयेत पितृदेवताः
अक्षयान पराप्नुयाल लॊकान कुलं चैव समुद्धरेत"
74,"ततॊ बरह्मसरॊ गच्छेद धर्मारण्यॊपशॊभितम
पौण्डरीकम अवाप्नॊति परभाताम एव शर्वरीम"
75,"तस्मिन सरसि राजेन्द्र बरह्मणॊ यूप उच्छ्रितः
यूपं परदक्षिणं कृत्वा वाजपेयफलं लभेत"
76,"ततॊ गच्छेत राजेन्द्र धेनुकां लॊकविश्रुताम
एकरत्रॊषितॊ राजन परयच्छेत तिलधेनुकाम
सर्वपापविशुद्धात्मा सॊमलॊकं वरजेद धरुवम"
77,"तत्र चिह्नं महाराज अद्यापि हि न संशयः
कपिला सह वत्सेन पर्वते विचरत्य उत
स वत्सायाः पदानि सम दृश्यन्ते ऽदयापि भारत"
78,"तेषूपस्पृश्य राजेन्द्र पदेषु नृपसत्तम
यत किं चिद अशुभं कर्म तत परणश्यति भारत"
79,"ततॊ गृध्रवटं गच्छेत सथानं देवस्य धीमतः
सनायीत भस्मना तत्र अभिगम्य वृषध्वजम"
80,"बराह्मणेन भवेच चीर्णं वरतं दवादश वार्षिकम
इतरेषां तु वर्णानां सर्वपापं परणश्यति"
81,"गच्छेत तत उद्यन्तं पर्वतं गीतनादितम
सावित्रं तु पदं तत्र दृश्यते भरतर्षभ"
82,"तत्र संध्याम उपासीत बराह्मणः संशितव्रतः
उपास्ता च भवेत संध्या तेन दवादश वार्षिकी"
83,"यॊनिद्वारं च तत्रैव विश्रुतं भरतर्षभ
तत्राभिगम्य मुच्येत पुरुषॊ यॊनिसंकरात"
84,"कृष्ण शुक्लाव उभौ पक्षौ गयायां यॊ वसेन नरः
पुनात्य आ सप्तमं राजन कुलं नास्त्य अत्र संशयः"
85,"एष्टव्या बहवः पुत्रा यद्य एकॊ ऽपि गयां वरजेत
यजेत वाश्वमेधेन नीलं वा वृषम उत्सृजेत"
86,"ततः फल्गुं वरजेद राजंस तीर्थसेवी नराधिप
अश्वमेधम अवाप्नॊति सिद्धिं च महतीं वरजेत"
87,"ततॊ गच्छेत राजेन्द्र धर्मपृष्ठं समाहितः
यत्र धर्मॊ महाराज नित्यम आस्ते युधिष्ठिर
अभिगम्य ततस तत्र वाजिमेधफलं लभेत"
88,"ततॊ गच्छेत राजेन्द्र बरह्मणस तीर्थम उत्तमम
तत्रार्चयित्वा राजेन्द्र बरह्माणम अमितौजसम
राजसूयाश्वमेधाभ्यां फलं पराप्नॊति मानवः"
89,"ततॊ राजगृहं गच्छेत तीर्थसेवी नराधिप
उपस्पृश्य तपॊदेषु काक्षीवान इव मॊदते"
90,"यक्षिण्या नैत्यकं तत्र पराश्नीत पुरुषः शुचिः
यक्षिण्यास तु परसादेन मुच्यते भरूण हत्यया"
91,"मणिनागं ततॊ गत्वा गॊसहस्रफलं लभेत
नैत्यकं भुञ्जते यस तु मणिनागस्य मानवः"
92,"दष्टस्याशीविषेणापि न तस्य करमते विषम
तत्रॊष्य रजनीम एकां सर्वपापैः परमुच्यते"
93,"ततॊ गच्छेत बरह्मर्षेर गौतमस्य वनं नृप
अहल्याया हलदे सनात्वा वरजेत परमां गतिम
अभिगम्य शरियं राजन विन्दते शरियम उत्तमाम"
94,"तत्रॊद पानॊ धर्मज्ञ तरिषु लॊकेषु विश्रुतः
तत्राभिषेकं कृत्वा तु वाजिमेधम अवाप्नुयात"
95,"जनकस्य तु राजर्षेः कूपस तरिदशपूजितः
तत्राभिषेकं कृत्वा तु विष्णुलॊकम अवाप्नुयात"
96,"ततॊ विनशनं गच्छेत सर्वपापप्रमॊचनम
वाजपेयम अवाप्नॊति सॊमलॊकं च गच्छति"
97,"गण्डकीं तु समासाद्य सर्वतीर्थजलॊद्भवाम
वाजपेयम अवाप्नॊति सूर्यलॊकं च गच्छति"
98,"ततॊ ऽधिवंश्यं धर्मज्ञ समाविश्य तपॊवनम
गुह्यकेषु महाराज मॊदते नात्र संशयः"
99,"कम्पनां तु समासाद्य नदीं सिद्धनिषेविताम
पुण्डरीकम अवाप्नॊति सूर्यलॊकं च गच्छति"
100,"ततॊ विशालाम आसाद्य नदीं तरैलॊक्यविश्रुताम
अग्निष्टॊमम अवाप्नॊति सवर्गलॊकं च गच्छति"
101,"अथ माहेश्वरीं धारां समासाद्य नराधिप
अश्वमेधम अवाप्नॊति कुलं चैव समुद्धरेत"
102,"दिवौकसां पुष्करिणीं समासाद्य नरः शुचिः
न दुर्गतिम अवाप्नॊति वाजपेयं च विन्दति"
103,"महेश्वर पदं गच्छेद बरह्म चारी समाहितः
महेश्वर पदे सनात्वा वाजिमेधफलं लभेत"
104,"तत्र कॊटिस तु तीर्थानां विश्रुता भरतर्षभ
कूर्मरूपेण राजेन्द्र असुरेण दुरात्मना
हरियमाणाहृता राजन विष्णुना परभ विष्णुना"
105,"तत्राभिषेकं कुर्वाणस तीर्थकॊट्यां युधिष्ठिर
पुण्डरीकम अवाप्नॊति विष्णुलॊकं च गच्छति"
106,"ततॊ गच्छेत राजेन्द्र सथानं नारायणस्य तु
सदा संनिहितॊ यत्र हरिर वसति भारत
शालग्राम इति खयातॊ विष्णॊर अद्भुतकर्मणः"
107,"अभिगम्य तरिलॊकेशं वरदं विष्णुम अव्ययम
अश्वमेधम अवाप्नॊति विष्णुलॊकं च गच्छति"
108,"तत्रॊद पानॊ धर्मज्ञ सर्वपापप्रमॊचनः
समुद्रास तत्र चत्वारः कूपे संनिहिताः सदा
तत्रॊपस्पृश्य राजेन्द्र न दुर्गतिम अवाप्नुयात"
109,"अभिगम्य महादेवं वरदं विष्णुम अव्ययम
विराजति यथा सॊम ऋणैर मुक्तॊ युधिष्ठिर"
