Book No,Chapter No,Paragraph No,Paragraph Text
4,32,47,"आनृशंस्य परॊ नित्यं सुसुखः सततं भव
गच्छन्तु दूतास तवरितं नगरं तव पार्थिव
सुहृदां परियम आख्यातुं घॊषयन्तु च ते जयम"
4,32,48,"ततस तद वचनान मत्स्यॊ दूतान राजा समादिशत
आचक्षध्वं पुरं गत्वा संग्रामे विजयं मम"
4,32,49,"कुमाराः समलं कृत्यपर्यागच्छन्तु मे पुरात
वादित्राणि च सर्वाणि गणिकाश च सवलं कृताः"
4,32,50,"ते गत्वा केवलां रात्रिम अथ सूर्यॊदयं परति
विराटस्य पुराभ्याशे दूता जयम अघॊषयन"
4,33,1,"[वै]
याते तरिगर्तं मत्स्ये तु पशूंस तान सवान परीप्सति
दुर्यॊधनः सहामात्यॊ विराटम उपयाद अथ"
4,33,2,"भीष्मॊ दरॊणश च कर्णश च कृपश च परमास्त्र वित
दरौणिश च सौबलश चैव तथा दुःक्शासनः परभुः"
4,33,3,"विविंशतिर विकर्णश च चित्रसेनश च वीर्यवान
दुर्मुखॊ दुःसहश चैव ये चैवान्ये मरा रथाः"
4,33,4,"एते मत्स्यान उपागम्य विराटस्य महीपतेः
घॊषान विद्राव्य तरसा गॊधनं जह्रुर ओजसा"
4,33,5,"षष्टिं गवां सहस्राणि कुरवः कालयन्ति ते
महता रथवंशेन परिवार्य समन्ततः"
4,33,6,"गॊपालानां तु घॊषेषु हन्यतां तर महारथैः
आरावः सुमहान आसीत संप्रहारे भयंकरे"
4,33,7,"गवाध्यक्षस तु संत्रस्तॊ रथम आस्थाय स तवरः
जगाम नगरायैव परिक्रॊशंस तदार्तवत"
4,33,8,"स परविश्य पुरं राज्ञॊ नृप वेश्माभ्ययात ततः
अवतीर्य रथात तूर्णम आख्यातुं परविवेश ह"
4,33,9,"दृष्ट्वा भूमिंजयं नाम पुत्रं मत्स्यस्य मानिनम
तस्मै तत सर्वम आचष्ट राष्ट्रस्य पशुकर्षणम"
4,33,10,"षष्टिं गवां सहस्राणि कुरवः कालयन्ति ते
तद विजेतुं समुत्तिष्ठ गॊधनं राष्ट्रवर्धनम"
4,33,11,"राजपुत्र हितप्रेप्सुः कषिप्रं निर्याहि वै सवयम
तवां हि मत्स्यॊ महीपालः शून्यपालम इहाकरॊत"
4,33,12,"तवया परिषदॊ मध्ये शलाघते स नराधिपः
पुत्रॊ ममानुरूपश च शूरश चेति कुलॊद्वहः"
4,33,13,"इष्वस्त्रे निपुणॊ यॊधः सदा वीरश च मे सुतः
तस्य तत सत्यम एवास्तु मनुष्येन्द्रस्य भाषितम"
4,33,14,"आवर्तय कुरूञ जित्वा पशून पशुमतां वर
निर्दहैषाम अनीकानि भीमेन शरतेजसा"
4,33,15,"धनुश्च्युतै रुक्मपुङ्खैः शरैः संनतपर्वभिः
दविषतां भिन्ध्य अनीकानि गजानाम इव यूथपः"
4,33,16,"पाशॊपधानां जयातन्त्रीं चापदण्डां महास्वनाम
शरवर्णां धनुर वीणां शत्रुमध्ये परवादय"
4,33,17,"शवेता रजतसंकाशा रथे युज्यन्तु ते हयाः
धवजं च सिंहं सौवर्णम उच्छ्रयन्तु तवाभिभॊः"
4,33,18,"रुक्मपङ्खाः परसन्नाग्रा मुक्ता हस्तवता तवया
छादयन्तु शराः सूर्यं राज्ञाम आयुर निरॊधिनः"
4,33,19,"रणे जित्वा कुरून सर्वान वर्ज पाणिर इवासुरान
यशॊ महद अवाप्य तवं परविशेदं पुरं पुनः"
4,33,20,"तवं हि राष्ट्रस्य परमा गतिर मत्स्यपतेः सुतः
गतिमन्तॊ भवन्त्व अद्य सर्वे विषयवासिनः"
4,33,21,"सत्रीमध्य उक्तस तेनासौ तद वाक्यम अभयंकरम
अन्तःपुरे शलाघमान इदं वचनम अब्रवीत"
4,34,1,"[उत्तर]
अद्याहम अनुगच्छेयं दृढधन्वा गवां पदम
यदि मे सारथिः कश चिद भवेद अश्वेषु कॊविदः"
4,34,2,"तम एव नाधिगच्छामि यॊ मे यन्ता भवेन नरः
पश्यध्वं सारधिं कषिप्रं मम युक्तं परयास्यतः"
4,34,3,"अष्टाविंशति रात्रं वा मासं वा नूनम अन्ततः
यत तद आसी महद युद्धं तत्र मे सारथिर हतः"
4,34,4,"स लभेयं यदि तव अन्यं हर यानविदं नरम
तवरावान अद्य यात्वाहं समुच्छ्रितमहाध्वजम"
4,34,5,"विगाह्य तत्परानीकं गजवाजिर अथाकुलम
शस्त्रप्रताप निर्वीर्यान कुरूञ जित्वानये पशून"
4,34,6,"दुर्यॊधनं शांतनवं कर्णं वैकर्तनं कृपम
दरॊणं च सह पुत्रेण महेष्वासान समागतान"
4,34,7,"वित्रासयित्वा संग्रामे दानवान इव वज्रभृत
अनेनैव मुहूर्तेन पुनः परत्यानये पशून"
4,34,8,"शून्यम आसाद्य कुरवः परयान्त्य आदाय गॊधनम
किं नु शक्यं मया कर्तुं यद अहं तत्र नाभवम"
4,34,9,"पश्येयुर अद्य मे वीर्यं कुरवस ते समागताः
किं नु पार्थॊ ऽरजुनः साक्षाद अयम अस्मान परबाधते"
4,34,10,"[वै]
तस्य तद वचनं सत्रीषु भाषतः सम पुनः पुनः
नामर्षयत पाञ्चाली बीभत्सॊः परिकीर्तनम"
4,34,11,"अथैनम उपसंगम्य सत्रीमध्यात सा तपस्विनी
वरीडमानेव शनकैर इदं वचनम अब्रवीत"
4,34,12,"यॊ ऽसौ बृहद वारणाभॊ युवा सुप्रिय दर्शनः
बृहन्नडेति विख्यातः पार्थस्यासीत स सारथिः"
4,34,13,"धनुष्य अनवरश चासीत तस्य शिष्यॊ महात्मनः
दृष्टपूर्वॊ मया वीर चरन्त्या पाण्डवान परति"
4,34,14,"यदा तत पावकॊ दावम अदहत खाण्डवं महत
अर्जुनस्य तदानेन संगृहीता हयॊत्तमाः"
4,34,15,"तेन सारथिना पार्थः सर्वभूतानि सर्वशः
अजयत खाण्डव परस्थे न हि यन्तास्ति तादृशः"
4,34,16,"येयं कुमारी सुश्रॊणी भगिनी ते यवीयसी
अस्याः स वचनं वीरकरिष्यति न संशयः"
4,34,17,"यदि वै सारथिः स सयात कुरून सर्वान असंशयम
जित्वा गाश च समादाय धरुवम आगमनं भवेत"
4,34,18,"एवम उक्तः स सैरन्ध्या भगिनीं परत्यभाषत
गच्छ तवम अनवद्याङ्गि ताम आनय बृहन्नडाम"
4,34,19,"सा भरात्रा परेषिता शीघ्रम अगच्छन नर्तना गृहम
यत्रास्ते स महाबाहुश छन्नः सत्रेण पाण्डवः"
4,35,1,"[वै]
स तां दृष्ट्वा विशालाक्षीं राजपुत्रीं सखीं सखा
परहसन्न अब्रवीद राजन कुत्रागमनम इत्य उत"
4,35,2,"तम अब्रवीद राजपुत्री समुपेत्य नरर्षभम
परणयं भावयन्ती सम सखीमध्य इदं वचः"
4,35,3,"गावॊ राष्ट्रस्य कुरुभिः काल्यन्ते नॊ बृहन्नडे
तान विजेतुं मम भराता परयास्यति धनुर्धरः"
4,35,4,"नचिरं च हतस तस्य संग्रामे रथसारथिः
तेन नास्ति समः सूतॊ यॊ ऽसय सारथ्यम आचरेत"
4,35,5,"तस्मै परयतमानाय सारथ्यर्थं बृहन्नडे
आचचक्षे हयज्ञाने सैरन्ध्री कौशलं तव"
4,35,6,"सा सारथ्यं मम भरातुः कुरु साधु बृहन्नडे
पुरा दूरतरं गावॊ हरियन्ते कुरुभिर हि नः"
4,35,7,"अथैतद वचनं मे ऽदय नियुक्ता न करिष्यसि
परणयाद उच्यमाना तवं परित्यक्ष्यामि जीवितम"
4,35,8,"एवम उक्तस तु सुश्रॊण्या तया सख्या परंतपः
जगाम राजपुत्रस्य सकाशम अमितौजसः"
4,35,9,"तं सा वरजन्तं तवरितं परभिन्नम इव कुञ्जरम
अन्वगच्छद विशालाक्षी शिशुर गजवधूर इव"
4,35,10,"दूराद एव तु तं परेक्ष्य राजपुत्राभ्यभाषत
तवया सारथिना पार्थः खाण्डवे ऽगनिम अतर्पयत"
4,35,11,"पृथिवीम अजयत कृत्स्नां कुन्तीपुत्रॊ धनंजयः
सैरन्ध्री तवां समाचष्ट सा हि जानाति पाण्डवान"
4,35,12,"संयच्छ मामकान अश्वांस तथैव तवं बृहन्नडा
कुरुभिर यॊत्स्यमानस्य गॊधनानि परीप्सतः"
4,35,13,"अर्जुनस्य किलासीस तवं सारथिर दयितः पुरा
तवयाजयत सहायेन पृथिवीं पाण्डवर्षभः"
4,35,14,"एवम उक्ता परत्युवाच राजपुत्रं बृहन्नडा
का शक्तिर मम सारथ्यं कर्तुं संग्राममूर्धनि"
4,35,15,"गीतं वा यदि वा नृत्तं वादित्रं वा पृथग्विधम
तत करिष्यामि भद्रं ते सारथ्यं तु कुतॊ मयि"
4,35,16,"[उत्तर]
बृहन्नडे गायनॊ वा नर्तनॊ वा पुनर भव
कषिप्रं मे रथम आस्थाय निगृह्णीष्व हयॊत्तमान"
4,35,17,"[वै]
स तत्र नर्म संयुक्तम अकरॊत पाण्डवॊ बहु
उत्तरायाः परमुखतः सर्वं जानन्न अरिंदम"
4,35,18,"ऊर्ध्वम उत्क्षिप्य कवचं शरीरे परत्यमुञ्चत
कुमार्यस तत्र तं दृष्ट्वा पराहसन पृथुलॊचनाः"
4,35,19,"स तु दृष्ट्वा विमुह्यन्तं सवयम एवॊत्तरस ततः
कवचेन महार्हेण समनह्यद बृहन्नडाम"
4,35,20,"स बिभ्रत कवचं चाग्र्यं सवयम अप्य अंशुमत परभम
धवजं च सिंहम उच्छ्रित्य सारथ्ये समकल्पयत"
4,35,21,"धनूंषि च महार्हाणि बाणांश च रुचिरान बहून
आदाय परययौ वीरः स बृहन्नड सारथिः"
4,35,22,"अथॊत्तरा च कन्याश च सख्यस ताम अब्रुवंस तदा
बृहन्नडे आनयेथा वासांसि रुचिराणि नः"
4,35,23,"पाञ्चालि कार्यं सूक्ष्माणि चित्राणि विविधानि च
विजित्य संग्रामगतान भीष्मद्रॊणमुखान कुरून"
4,35,24,"अथ ता बरुवतीः कन्याः सहिताः पाण्डुनन्दनः
परत्युवाच हसन पार्थॊ मेघदुन्दुभि निःस्वनः"
4,35,25,"यद्य उत्तरॊ ऽयं संग्रामे विजेष्यति महारथान
अथाहरिष्ये वासांसि दिव्यानि रुचिराणि च"
4,35,26,"एवम उक्त्वा तु बीभत्सुस ततः पराचॊदयद धयान
कुरून अभिमुखाञ शूरॊ नाना धवजपताकिनः"
4,36,1,"[वै]
स राजधान्या निर्याय वैराटिः पृथिवीं जयः
परयाहीत्य अब्रवीत सूतं यत्र ते कुरवॊ गताः"
4,36,2,"समवेतान कुरून यावज जिगीशून अवजित्य वै
गाश चैषां कषिप्रम आदाय पुनर आयामि सवं पुरम"
4,36,3,"ततस तांश चॊदयाम आस सदश्वान पाण्डुनन्दनः
ते हया नरसिंहेन चॊदिता वातरंहसः
आलिखन्त इवाकाशम ऊहुः काञ्चनमालिनः"
4,36,4,"नातिदूरम अथॊ यात्वा मत्स्यपुत्र धनंजयौ
अवेक्षेताम अमित्रघ्नौ कुरूणां बलिनां बलम
शमशानम अभितॊ गत्वा आससाद कुरून अथ"
4,36,5,"तद अनीकं महत तेषां विबभौ सागरस्वनम
सर्पमाणम इवाकाशे वनं बहुल पादपम"
4,36,6,"ददृशे पार्थिवॊ रेणुर जनितस तेन सर्पता
दृष्टिप्रणाशॊ भूतानां दिवस्पृश नरसत्तम"
4,36,7,"तद अनीकं महद दृष्ट्वा जगाश्वरथसंकुलम
कर्णदुर्यॊधन कृपैर गुप्तं शांतनवेन च"
4,36,8,"दरॊणेन च सपुत्रेण महेष्वासेन धीमता
हृष्टरॊमा भयॊद्विग्नः पार्थं वैराटिर अब्रवीत"
4,36,9,"नॊत्सहे कुरुभिर यॊद्धुं रॊमहर्षं हि पश्य मे
बहु परवीरम अत्युग्रं देवैर अपि दुरासदम
परतियॊद्धुं न शक्ष्यामि कुरुसैन्यम अनन्तकम"
4,36,10,"नाशंसे भारतीं सेनां परवेष्टुं भीमकार्मुकाम
रथनागाश्वकलिलां पत्तिध्वजसमाकुलाम
दृष्ट्वैव हि परान आजाव आत्मा परव्यथतीव मे"
4,36,11,"यत्र दरॊणश च भीष्मश च कृपः कर्णॊ विविंशतिः
अश्वत्थामा विकर्णश च सॊमदत्तॊ ऽथ बाह्लिकः"
4,36,12,"दुर्यॊधनस तथा वीरॊ राजा च रथिनां वरः
दयुतिमन्तॊ महेष्वासाः सर्वे युद्धविशारदाः"
4,36,13,"दृष्ट्वैव हि कुरून एतान वयूढानीकान परहारिणः
हृषितानि च रॊमाणी कश्मलं चागतं मम"
4,36,14,"[वै]
अवियातॊ वियातस्य मौर्ख्याद धूर्तस्य पश्यतः
परिदेवयते मन्दः सकाशे सव्यसाचिनः"
4,36,15,"तरिगर्तान स पिता यातः शून्ये संप्रणिधाय ताम
सर्वां सेनाम उपादाय न मे सन्तीह सैनिकाः"
4,36,16,"सॊ ऽहम एकॊ बहून बालः कृतास्त्रान अकृतश्रमः
परतियॊद्धुं न शक्यामि निवर्तस्व बृहन नडे"
4,36,17,"[अर्ज]
भयेन दीनरूपॊ ऽसि दविषतां हर्षवर्धनः
न च तावत कृतं किं चित परैः कर्म रणाजिरे"
4,36,18,"सवयम एव च माम आत्थ वह मां कौरवान परति
सॊ ऽहं तवां तत्र नेष्यामि यत्रैते बहुला धवजाः"
4,36,19,"मध्यंम आमिष गृध्राणां कुरूणाम आततायिनाम
नेष्यामि तवां महाबाहॊ पृथिव्याम अपि युध्यताम"
4,36,20,"तथा सत्रीषु परतिश्रुत्य पौरुषं पुरुषेषु च
कत्थमानॊ ऽभिनिर्याय किमर्थं न युयुत्ससे"
4,36,21,"न चेद विजित्य गास तास तवं गृहान वै परतियास्यसि
परहसिष्यन्ति वीर तवां नरा नार्यश च संगताः"
4,36,22,"अहम अप्य अत्र सैरन्ध्र्या सतुतः सारथ्य कर्मणि
न हि शक्ष्याम्य अनिर्जित्य गाः परयातुं पुरं परति"
4,36,23,"सतॊत्रेण चैव सैरन्ध्र्यास तव वाक्येन तेन च
कथं न युध्येयम अहं कुरून सर्वान सथिरॊ भव"
4,36,24,"[उत्तर]
कामं हरन्तु मत्स्यानां भूयांसं कुरवॊ धनम
परहसन्तु च मां नार्यॊ नरा वापि बृहन्नडे"
4,36,25,"[वै]
इत्य उक्त्वा पराद्रवद भीतॊ रथात परस्कन्द्य कुण्डली
तयक्त्वा मानं स मन्तात्मा विसृज्य स शरं धनुः"
4,36,26,"[बृहन]
नैष पूर्वैः समृतॊ धर्मः कषत्रियस्य पलायनम
शरेयस ते मरणं युद्धे न भीतस्य पलायनम"
4,36,27,"[वै]
एवम उक्त्वा तु कौन्तेयः सॊ ऽवप्लुत्य रथॊत्तमात
तम अन्वधावद धावन्तं राजपुत्रं धनंजयः
दीर्घां वेणीं विधुन्वानः साधु रक्ते च वाससी"
4,36,28,"विधूय वेणीं धावन्तम अजानन्तॊ ऽरजुनं तदा
सैनिकाः पराहसन के चित तथारूपम अवेक्ष्य तम"
4,36,29,"तं शीघ्रम अभिधावन्तं संप्रेक्ष्य कुरवॊ ऽबरुवन
क एष वेषप्रच्छन्नॊ भस्मनेव हुताशनः"
4,36,30,"किं चिद अस्य यथा पुंसः किं चिद अस्य यथा सत्रियः
सारूप्यम अर्जुनस्येव कलीब रूपं बिभर्ति च"
4,36,31,"तद एवैतच छिरॊ गरीवं तौ बाहू परिघॊपमौ
तद्वद एवास्य विक्रान्तं नायम अन्यॊ धनंजयात"
4,36,32,"अमरेष्व इव देवेन्द्रॊ मानुषेषु धनंजयः
एकः सॊ ऽसमान उपायायाद अन्यॊ लॊके धनंजयात"
4,36,33,"एकः पुत्रॊ विराटस्य शून्ये संनिहितः पुरे
स एष किल निर्यातॊ बालभावान न पौरुषात"
4,36,34,"सत्रेण नूनं छन्नं हि चरन्तं पार्थम अर्जुनम
उत्तरः सारथिं कृत्वा निर्यातॊ नगराद बहिः"
4,36,35,"स नॊ मन्ये धवजान दृष्ट्वा भीत एष पलायति
तं नूनम एष धावन्तं जिघृक्षति धनंजयः"
4,36,36,"इति सम कुरवः सर्वे विमृशन्तः पृथक पृथक
न च वयवसितुं किं चिद उत्तरं शक्नुवन्ति ते
छन्नं तथा तं सत्रेण पाण्डवं परेक्ष्य भारत"
4,36,37,"उत्तरं तु परधावन्तम अनुद्रुत्य धनंजयः
गत्वा पदशतं तूर्णं केशपक्षे परामृशत"
4,36,38,"सॊ ऽरजुनेन परामृष्टः पर्यदेवयद आर्तवत
बहुलं कृपणं चैव विराटस्य सुतस तदा"
4,36,39,"शातकुम्भस्य शुद्धस्य शतं निष्कान ददामिते
मणीन इष्टौ च वैडूर्यान हेमबद्धान महाप्रभान"
4,36,40,"हेमदण्डप्रतिच्छन्नं रथं युक्तं च सुव्रजैः
मत्तांश च दश मातङ्गान मुञ्च मां तवं बृहण्णडे"
