Book No,Chapter No,Paragraph No,Paragraph Text
4,53,24,"वीरौ ताव अपि संरब्धौ संनिकृष्टौ महारथौ
छादयेतां शरव्रातैर अन्यॊन्यम अपराजितौ"
4,53,25,"विस्फार्य सुमहच चापं हेमपृष्ठं दुरासदम
संरब्धॊ ऽथ भरद्वाजः फल्गुनं परत्ययुध्यत"
4,53,26,"स सायकमयैर जालैर अर्जुनस्य रथं परति
भानुमत्ल्भिः शिला धौतैर भानॊः परच्छादयत परभाम"
4,53,27,"पार्थं च स महाबाहुर महावेगैर महारथः
विव्याध निशितैर बाणैर मेघॊ वृष्ट्येव पर्वतम"
4,53,28,"तथैव दिव्यं गाण्डीवं धनुर आदाय पाण्डवः
शत्रुघ्नं वेगवद धृष्टॊ भारसाधनम उत्तमम
विससर्ज शरांश चित्रान सुवर्णविकृतान बहून"
4,53,29,"नाशयञ शरवर्षाणि भारद्वाजस्य वीर्यवान
तूर्णं चापनिविर्मुक्तैस तद अद्भुतम इवाभवत"
4,53,30,"स रथेन चरन पार्थः परेक्षणीयॊ धनंजयः
युगपद दिक्षु सर्वासु सर्वशस्त्राण्य अदर्शयत"
4,53,31,"एकछायम इवाकाशं बाणैश चक्रे समन्ततः
नादृश्यत तदा दरॊणॊ नीहारेणेव संवृतः"
4,53,32,"तस्याभवत तदा रूपं संवृतस्य शरॊत्तमैः
जाज्वल्यमानस्य यथा पर्वतस्येव सर्वतः"
4,53,33,"दृष्ट्वा तु पार्थस्य रणे शरैः सवरथम आवृतम
स विस्फार्य धनुश चित्रं मेघस्तनित निस्वनम"
4,53,34,"अग्निचक्रॊपमं घॊरं विकर्षन परमायुधम
वयशातयच छरांस तांस तु दरॊणः समितिशॊभनः
महान अभूत ततः शब्दॊ वंशानाम इव दुह्यताम"
4,53,35,"जाम्बूनदमयैः पुङ्खैश चित्रचापवरातिगैः
पराच्छादयद अमेयात्मा दिशः सूर्यस्य च परभाम"
4,53,36,"ततः कनकपुङ्खानां शराणां नतपर्वणाम
वियच चराणां वियति दृश्यन्ते बहुशः परजाः"
4,53,37,"दरॊणस्य पुङ्खसक्ताश च परभवन्तः शरासनात
एकॊ दीर्घ इवादृश्यद आकाशे संहतः शरः"
4,53,38,"एवं तौ सवर्णविकृतान विमुञ्चन्तौ महाशरान
आकाशं संवृतं वीराव उल्काभिर इव चक्रतुः"
4,53,39,"शरास तयॊश च विबभुः कङ्कबर्हिण वाससः
पङ्क्त्यः शरदि खस्थानां हंसानां चरताम इव"
4,53,40,"युद्धं समभवत तत्र सुसंरब्धं महात्मनॊः
दरॊण पाण्डवयॊर घॊरं वृत्रवासवयॊर इव"
4,53,41,"तौ जगाव इव चासाद्य विषाणाग्रैः परस्परम
शरैः पूर्णायतॊत्सृष्टैर अन्यॊन्यम अभिजघ्नतुः"
4,53,42,"तौ वयवाहरतां शूरौ संरब्धौ रणशॊभिनौ
उदीरयन्तौ समरे दिव्यान्य अस्त्राणि भागशः"
4,53,43,"अथ तव आचार्य मुख्येन शरान सृष्टाञ शिलाशितान
नयवारयच छितैर बानैर अर्जुनॊ जयतां वरः"
4,53,44,"दर्शयन्न ऐन्द्रिर आत्मानम उग्रम उग्रपराक्रमः
इषुभिस तूर्णम आकाशं बहुभिश च समावृणॊत"
4,53,45,"जिघांसन्तं नरव्याघ्रम अर्जुनं तिग्मतेजसम
आचार्य मुख्यः समरे दरॊणः शस्त्रभृतां वरः
अर्जुनेन सहाक्रीडच छरैः संनतपर्वभिः"
4,53,46,"दिव्यान्य अस्त्राणि मुञ्चन्तं भारद्वाजं महारणे
अस्त्रैर अस्त्राणि संवार्य पल्गुनः समयॊधयत"
4,53,47,"तयॊर आसीत संप्रहारः करुद्धयॊर नरसिंहयॊः
अमर्षिणॊस तदान्यॊन्यं देवदानवयॊर इव"
4,53,48,"ऐन्द्रं वायव्यम आग्नेयम अस्त्रम अस्त्रेण पाण्डवः
दरॊणेन मुक्तं मुक्तं तु गरसते सम पुनः पुनः"
4,53,49,"एवं शूरौ महेष्वासौ विसृजन्तौ शिताञ शरान
एकछायं चक्रतुस ताव आकाशं शरवृष्टिभिः"
4,53,50,"ततॊ ऽरजुनेन मुक्तानां पततां च शरीरिषु
पर्वतेष्व इव वर्जाणां शराणां शरूयते सवनः"
4,53,51,"ततॊ नागा रथाश चैव सादिनश च विशां पते
शॊणिताक्ता वयदृश्यन्त पुष्पिता इव किंशुकाः"
4,53,52,"बाहुभिश च स केयूरैर विचित्रैश च महारथैः
सुवर्णचित्रैः कवचैर धवजैश च विनिपातितैः"
4,53,53,"यॊधैश चनिहतैस तत्र पार्थ बाणप्रपीडितैः
बलम आसीत समुद्भ्रान्तं दरॊणार्जुन समागमे"
4,53,54,"विधुन्वानौ तु तौ वीरौ धनुर ई भारसाधने
आच्छायदेताम अन्यॊन्यं तितक्षन्तौ रणेषुभिः"
4,53,55,"अथान्तरिक्षे नादॊ ऽभूद दरॊणं तत्र परशंसताम
दुष्करं कृतवान दरॊणॊ यद अर्जुनम अयॊधयत"
4,53,56,"परमाथिनं महावीर्यं दृढमुष्टिं दुरासदम
जेतारं देव दैत्यानां सर्पाणां च महारथम"
4,53,57,"अविश्रमं च शिक्षां च लाघवं दूरपातिताम
पार्थस्य समरे दृष्ट्वा दरॊणस्याभूच च विस्मयः"
4,53,58,"अथ गाण्डीवम उद्यम्य दिव्यं धनुर अमर्षणः
विचकर्ष रणे पार्थॊ बाहुभ्यां भरतर्षभ"
4,53,59,"तस्य बाणमयं वर्षं शलभानाम इवायतम
न च बाणान्तरे वायुर अस्य शक्नॊति सर्पितुम"
4,53,60,"अनिशं संदधानस्य शरान उत्सृजतस तदा
ददृशे नान्तरं किं चित पार्थस्याददतॊ ऽपि च"
4,53,61,"तथा शीघ्रास्त्र युद्धे तु वर्तमाने सुदारुणे
शीघ्राच छीघ्रतरं पार्थः शरान अन्यान उदीरयत"
4,53,62,"ततः शतसहस्राणि शराणां नतपर्वणाम
युगपत परापतंस तत्र दरॊणस्य रथम अन्तिकात"
4,53,63,"अवकीर्यमाणे दरॊणे तु शरैर गाण्डीवधन्वना
हाहाकारॊ महान आसीत सैन्यानां भरतर्षभ"
4,53,64,"पाण्डवस्य तु शीघ्रास्त्रं मघवान समपूजयत
गन्धर्वाप्सरसश चैव ये च तत्र समागताः"
4,53,65,"ततॊ वृन्देन महता रथानां रथयूथपः
आचार्य पुत्रः सहसा पाण्डवं परत्यवारयत"
4,53,66,"अश्वत्थामा तु तत कर्म हृदयेन महात्मनः
पूजयाम आस पार्थस्य कॊपं चास्याकरॊद भृशम"
4,53,67,"स मन्युवशम आपन्नः पार्थम अभ्यद्रवद रणे
किरञ शरसहस्राणि पर्जन्य इव वृष्टिमान"
4,53,68,"आवृत्य तु महाबाहुर यतॊ दरौणिस ततॊ हयान
अन्तरं परददौ पार्थॊ दरॊणस्य वयपसर्पितुम"
4,53,69,"स तु लब्ध्वान्तरं तूर्णम अपायाज जवनैर हयैः
छिन्नवर्म धवजः शूरॊ निकृत्तः परमेषुभिः"
4,54,1,"[वै]
तं पार्थः परतिजग्राह वायुवेगम इवॊद्धतम
शरजालेन महता वर्षमाणम इवाम्बुदम"
4,54,2,"तयॊर देवासुरसमः संनिपातॊ महान अभूत
किरतॊः शरजालानि वृत्रवासवयॊर इव"
4,54,3,"न सम सूर्यस तदा भाति न च वाति समीरणः
शरगाढे कृते वयॊम्नि छाया भूते समन्ततः"
4,54,4,"महांश चट चटा शब्दॊ यॊधयॊर हन्यमानयॊः
दह्यताम इव वेणूनाम आसीत परपुरंजय"
4,54,5,"हयान अस्यार्जुनः सर्वान कृतवान अल्पजीवितान
स राजन अन परजानाति दिशं कां चन मॊहितः"
4,54,6,"ततॊ दरौणिर महावीर्यः पार्थस्य विचरिष्यतः
विवरं सूक्ष्मम आलॊक्य जयां चिच्छेद कषुरेण ह
तद अस्यापूजयन देवाः कर्म दृष्ट्वाति मानुषम"
4,54,7,"ततॊ दरौणिर धनूंष्य अष्टौ वयपक्रम्य नरर्षभम
पुनर अभ्याहनत पार्थं हृदये कङ्कपत्रिभिः"
4,54,8,"ततः पार्थॊ महाबाहुः परहस्य सवनवत तदा
यॊजयाम आस नवया मौर्व्या गाण्डीवम ओजसा"
4,54,9,"ततॊ ऽरधचन्द्रम आवृत्य तेन पार्थः समागमत
वारणेनेव मत्तेन मत्तॊ वारणयूथपः"
4,54,10,"ततः परववृते युद्धं पृथिव्याम एकवीरयॊः
रणमध्ये दवयॊर एव सुमहल लॊमहर्षणम"
4,54,11,"तौ वीरौ कुरवः सर्वे ददृशुर विस्मयान्विताः
युध्यमानौ महात्मानौ यूथपाव इव संगतौ"
4,54,12,"तौ समाजघ्नतुर वीराव अन्यॊन्यं पुरुषर्षभौ
शरैर आशीविशाकारैर जवलद भिर इव पन्नगैः"
4,54,13,"अक्षय्याव इषुधी दिव्यौ पाण्डवस्य महात्मनः
तेन पार्थॊ रणे शूरस तस्थौ गिरिर इवाचलः"
4,54,14,"अश्वत्थाम्नः पुनर बाणाः कषिप्रम अभ्यस्यतॊ रणे
जग्मुः परिक्षयं शीघ्रम अभूत तेनाधिकॊ ऽरजुनः"
4,54,15,"ततः कर्णॊ महच चापं विकृष्याभ्यधिकं रुषा
अवाक्षिपत ततः शब्दॊ हाहाकारॊ महान अभूत"
4,54,16,"तत्र चक्षुर दधे पार्थॊ यत्र विस्पार्यते धनुः
ददर्श तत्र राधेयं तस्य कॊपॊ ऽतयवीवृधत"
4,54,17,"सरॊषवशम आपन्नः कर्णम एव जिघांसया
अवैक्षत विवृत्ताभ्यां नेत्राभ्यां कुरुपुंगवः"
4,54,18,"तथा तु विमुखे पार्थे दरॊणपुत्रस्य सायकान
तवरिताः पुरुषा राजन्न उपाजह्रुः सहस्रशः"
4,54,19,"उत्सृज्य च महाबाहुर दरॊणपुत्रं धनंजयः
अभिदुद्राव सहसा कर्णम एव सपत्नजित"
4,54,20,"तम अभिद्रुत्य कौन्तेयः करॊधसंरक्तलॊचनः
कामयन दवैरथे युद्धम इदं वचनम अब्रवीत"
4,55,1,"[अर्ज]
कर्ण यत ते सभामध्ये बहु वाचा विकत्थितम
न मे युधि समॊ ऽसतीति तद इदं परत्युपस्थितम"
4,55,2,"अवॊचः परुषा वाचॊ धर्मम उत्सृज्य केवलम
इदं तु दुष्करं मन्ये यद इदं ते चिकीर्षितम"
4,55,3,"यत तवया कथितं पूर्वं माम अनासाद्य किं चन
तद अद्य कुरु राधेय कुरुमध्ये मया सह"
4,55,4,"यत सभायां सम पाञ्चालीं लिश्यमानां दुरात्मभिः
दृष्टवान असि तस्याद्य फलम आप्नुहि केवलम"
4,55,5,"धर्मपाशनिबद्धेन यन मया मर्षितं पुरा
तस्य राधेय कॊपस्य विजयं पश्य मे मृधे"
4,55,6,"एहि कर्ण मया सार्धं परतिपद्यस्व सागरम
परेक्षकाः कुरवः सर्वे भवन्तु सह सैनिकाः"
4,55,7,"[कर्ण]
बरवीषि वाचा यत पार्थ कर्मणा तत समाचर
अतिशेते हि वै वाचं कर्मेति परथितं भुवि"
4,55,8,"यत तवया मर्षितं पूर्वं तद अशक्तेन मर्षितम
इति गृह्णामि तत पार्थ तव दृष्ट्वापराक्रमम"
4,55,9,"धर्मपाशनिबद्धेन यदि ते मर्षितं पुरा
तथैव बद्धम आत्मानम अबद्धम इव मन्यसे"
4,55,10,"यदि तावद वनेवासा यथॊक्तश चरितस तवया
तत तवं धर्मार्थवित कलिष्टः समयं भेत्तुम इच्छसि"
4,55,11,"यदि शक्रः सवयं पार्थ युध्यते तव कारणात
तथापि न वयथा का चिन मम सयाद विक्रमिष्यतः"
4,55,12,"अयं कौन्तेय कामस ते नचिरात समुपस्थितः
यॊत्स्यसे तवं मया सार्धम अद्य दरक्ष्यसि मे बलम"
4,55,13,"[अर्ज]
इदानीम एव तावत तवम अपयातॊ रणान मम
तेन जीवसि राधेयनिहतस तव अनुजस तव"
4,55,14,"भरातरं घातयित्वा च तयक्त्वा रणशिरश च कः
तवदन्यः पुरुषः सत्सु बरूयाद एवं वयवस्थितः"
4,55,15,"[वै]
इति कर्णं बरुवन्न एव बीभत्सुर अपराजितः
अभ्ययाद विसृजन बाणान कायावरण भेदिनः"
4,55,16,"परतिजग्राह तान कर्णः शरान अग्निशिखॊपमान
शरवर्षेण महता वर्षमाण इवाम्बुदः"
4,55,17,"उत्पेतुः शरजालानि घॊररूपाणि सर्वशः
अविध्यद अश्वान बाहॊश च हस्तावापं पृथक पृथक"
4,55,18,"सॊ ऽमृष्यमाणः कर्णस्य निषङ्गस्यावलम्बनम
चिच्छेद निशिताग्रेण शरेण नतपर्वणा"
4,55,19,"उपासङ्गाद उपादाय कर्णॊ बाणान अथापरान
विव्याध पाण्डवं हस्ते तस्य मुष्टिर अशीर्यत"
4,55,20,"ततः पार्थॊ महाबाहुः कर्णस्य धनुर अच्छिनत
स शक्तिं पराहिणॊत तस्मै तां पार्थॊ वयधमच छरैः"
4,55,21,"ततॊ ऽभिपेतुर बहवॊ राधेयस्य पदानुगाः
तांश च गाण्डीवनिर्मुक्तैः पराहिणॊद यमसादनम"
4,55,22,"ततॊ ऽसयाश्वाञ शरैस तीक्ष्णैर बीभत्सुर भारसाधनैः
आ कर्ण मुक्तैर अभ्यघ्नंस ते हताः परापतन भुवि"
4,55,23,"अथापरेण बाणेन जवलितेन महाभुजः
विव्याध कर्णं कौन्तेयस तीक्ष्णेनॊरसि वीर्यवान"
4,55,24,"तस्य भित्त्वा तनुत्राणं कायम अभ्यपतच छिरः
ततः स तमसाविष्टॊ न सम किं चित परजज्ञिवान"
4,55,25,"स गाढवेदनॊ हित्वा रणं परायाद उदङ्मुखः
ततॊ ऽरजुन उपाक्रॊशद उत्तरश च महारथः"
4,56,1,"[वै]
ततॊ वैकर्तनं जित्वा पार्थॊ वैराटिम अब्रवीत
एतन मां परापयानीकं यत्र तालॊ हिरण्मयः"
4,56,2,"अत्र शांतनवॊ भीष्मॊ रथे ऽसमाकं पितामहः
काङ्क्षमाणॊ मया युद्धं तिष्ठत्य अमर दर्शनः
आदास्याम्य अहम एतस्य धनुर्ज्याम अपि चाहवे"
4,56,3,"अस्यन्तं दिव्यम अस्त्रं मां चित्रम अद्य निशामय
शतह्रदाम इवायान्तीं सतनयित्नॊर इवाम्बरे"
4,56,4,"सुवर्णपृष्ठं गाण्डीवं दरक्ष्यन्ति कुरवॊ मम
दक्षिणेनाथ वामेन कतरेण सविद अस्यति
इति मां संगताः सर्वे तर्कयिष्यन्ति शत्रवः"
4,56,5,"शॊणितॊदां रथावर्तां नागनक्रां दुरत्ययाम
नदीं परस्यन्दयिष्यामि परलॊकप्रवाहिनीम"
4,56,6,"पाणिपादशिरः पृष्ठबाहुशाखा निरन्तरम
वनं कुरूणां छेत्स्यामि भल्लैः संनतपर्वभिः"
4,56,7,"जयतः कौरवीं सेनाम एकस्य मम धन्विनः
शतं मार्गा भविष्यन्ति पावकस्येव कानने
मया चक्रम इवाविद्धं सैन्यं दरक्ष्यसि केवलम"
4,56,8,"असंभ्रान्तॊ रथे तिष्ठ समेषु विषमेषु च
दिवाम आवृत्य तिष्ठन्तं गिरिं भेत्स्यामि धारिभिः"
4,56,9,"अहम इन्द्रस्य वचनात संग्रामे ऽभयहनं पुरा
पौलॊमान कालखञ्जांश च सहस्राणि शतानि च"
4,56,10,"अहम इन्द्राद दृढां मुष्टिं बरह्मणः कृतहस्तताम
परगाढं तुमुलं चित्रम अतिविद्धं परजापतेः"
4,56,11,"अहं पारे समुद्रस्य हिरण्यपुरम आरुजम
जित्वा षष्टिसहस्राणि रथिनाम उग्रधन्विनाम"
4,56,12,"धवजवृक्षं पत्तितृणं रथसिंहगणायुतम
वनम आदीपयिष्यामि कुरूणाम अस्त्रतेजसा"
4,56,13,"तान अहं रथनीडेभ्यः शरैः संनतपर्वभिः
एकः संकालयिष्यामि वज्रपाणिर इवासुरान"
4,56,14,"रौद्रं रुद्राद अहं हय अस्त्रं वारुणं वरुणाद अपि
अस्त्रम आग्नेयम अग्नेश च वायव्यं मातरिश्वनः
वज्रादीनि तथास्त्राणि शक्राद अहम अवाप्तवान"
4,56,15,"धार्तराष्ट्र वनं घॊरं नरसिंहाभिरक्षितम
अहम उत्पाटयिष्यामि वैराटे वयेतु ते भयम"
4,56,16,"एवम आश्वासितस तेन वैराटिः सव्यसाचिना
वयगाहत रथानीकं भीमं भीष्मस्य धीमतः"
4,56,17,"तम आयान्तं महाबाहुं जिगीषन्तं रणे परान
अभ्यवारयद अव्यग्रः करूरकर्मा धनंजयम"
4,56,18,"तं चित्रमाल्याभरणाः कृतविद्या मनस्विनः
आगच्छन भीमधन्वानं मौर्वीं पर्यस्य बाहुभिः"
4,56,19,"दुःशासनॊ विकर्णश च दुःसहॊ ऽथ विविंशतिः
आगत्य भीमधन्वानं बीभत्सुं पर्यवारयन"
4,56,20,"दुःशासनस तु भल्लेन विद्ध्वा वैराटिम उत्तरम
दवितीयेनार्जुनं वीरः परत्यविध्यत सतनान्तरे"
