Book No,Chapter No,Paragraph No,Paragraph Text
14,1,1,"[व]
कृतॊदकं तु राजानं धृतराष्ट्रं युधिष्ठिरः
पुरस्कृत्य महाबाहुर उत्तताराकुलेन्द्रियः"
14,1,2,"उत्तीर्य च महीपालॊ बाष्पव्याकुललॊचनः
पपात तीरे गङ्गाया वयाधविद्ध इव दविपः"
14,1,3,"तं सीदमानं जग्राह भीमः कृष्णेन चॊदितः
मैवम इत्य अब्रवीच चैनं कृष्णः परबलार्दनः"
14,1,4,"तम आर्तं पतितं भूमौ निश्वसन्तं पुनः पुनः
ददृशुः पाण्डवा राजन धर्मात्मानं युधिष्ठिरम"
14,1,5,"तं दृष्ट्वा दीनमनसं गतसत्त्वं जनेश्वरम
भूयः शॊकसमाविष्टाः पाण्डवाः समुपाविशन"
14,1,6,"राजा च धृतराष्ट्रस तम उपासीनॊ महाभुजः
वाक्यम आह महाप्राज्ञॊ महाशॊकप्रपीडितम"
14,1,7,"उत्तिष्ठ कुरुशार्दूल कुरु कार्यम अनन्तरम
कषत्रधर्मेण कौरव्य जितेयम अवनिस तवया"
14,1,8,"तां भुङ्क्ष्व भरातृभिः सार्धं सुहृद्भिश च जनेश्वर
न शॊचितव्यं पश्यामि तवया धर्मभृतां वर"
14,1,9,"शॊचितव्यं मया चैव गान्धार्या च विशां पते
पुत्रैर विहीनॊ राज्येन सवप्नलब्धधनॊ यथा"
14,1,10,"अश्रुत्वा हितकामस्य विदुरस्य महात्मनः
वाक्यानि सुमहार्थानि परितप्यामि दुर्मतिः"
14,1,11,"उक्तवान एष मां पूर्वं धर्मात्मा दिव्यदर्शनः
दुर्यॊधनापराधेन कुलं ते विनशिष्यति"
14,1,12,"सवस्ति चेद इच्छसे राजन कुलस्यात्मन एव च
वध्यताम एष दुष्टात्मा मन्दॊ राजसुयॊधनः"
14,1,13,"कर्णश च शकुनिश चैव मैनं पश्यतु कर्हि चित
दयूतसंपातम अप्य एषाम अप्रमत्तॊ निवारय"
14,1,14,"अभिषेचय राजानं धर्मात्मानं युधिष्ठिरम
स पालयिष्यति वशीधर्मेण पृथिवीम इमाम"
14,1,15,"अथ नेच्छसि राजानं कुन्तीपुत्रं युधिष्ठिरम
मेढी भूतः सवयं राज्यं परतिगृह्णीष्व पार्थिव"
14,1,16,"समं सर्वेषु भूतेषु वर्तमानं नराधिप
अनुजीवन्तु सर्वे तवां जञातयॊ जञातिवर्धन"
14,1,17,"एवं बरुवति कौन्तेय विदुरे दीर्घदर्शिनि
दुर्यॊधनम अहं पापम अन्ववर्तं वृथा मतिः"
14,1,18,"अश्रुत्वा हय अस्य वीरस्य वाक्यानि मधुराण्य अहम
फलं पराप्य महद दुःखं निमग्नः शॊकसागरे"
14,1,19,"वृद्धौ हि ते सवः पितरौ पश्यावां दुःखितौ नृप
न शॊचितव्यं भवता पश्यामीह जनाधिप"
14,2,1,"[व]
एवम उक्तस तु राज्ञा स धृतराष्ट्रेण धीमता
तूष्णीं बभूव मेधावी तम उवाचाथ केशवः"
14,2,2,"अतीव मनसा शॊकः करियमाणॊ जनाधिप
संतापयति वैतस्य पूर्वप्रेतान पितामहान"
14,2,3,"यजस्व विविधैर यज्ञैर बहुभिः सवाप्तदक्षिणैः
देवांस तर्पय सॊमेन सवधया च पितॄन अपि"
14,2,4,"तवद्विधस्य महाबुद्धे नैतद अद्यॊपपद्यते
विदितं वेदितव्यं ते कर्तव्यम अपि ते कृतम"
14,2,5,"शरुताश च राजधर्मास ते भीष्माद भागीरथी सुतात
कृष्णद्वैपायनाच चैव नारदाद विदुरात तथा"
14,2,6,"नेमाम अर्हसि मूढानां वृत्तिं तवम अनुवर्तितुम
पितृपैतामहीं वृत्तिम आस्थाय धुरम उद्वह"
14,2,7,"युक्तं हि यशसा कषत्रं सवर्गं पराप्तुम असंशयम
न हि कश चन शूराणां निहतॊ ऽतर पराङ्मुखः"
14,2,8,"तयज शॊकं महाराज भवितव्यं हि तत तथा
न शक्यास ते पुनर दरष्टुं तवया हय अस्मिन रणे हताः"
14,2,9,"एतावद उक्त्वा गॊविन्दॊ धर्मराजं युधिष्ठिरम
विरराम महातेजास तम उवाच युधिष्ठिरः"
14,2,10,"गॊविन्द मयि या परीतिस तव सा विदिता मम
सौहृदेन तथा परेम्णा सदा माम अनुकम्पसे"
14,2,11,"परियं तु मे सयात सुमहत कृतं चक्रगदाधर
शरीमन परीतेन मनसा सर्वं यावदनन्दन"
14,2,12,"यदि माम अनुजानीयाद भवान गन्तुं तपॊवनम
न हि शान्तिं परपश्यामि घातयित्वा पितामहम
कर्णं च पुरुषव्याघ्रं संग्रामेष्व अपलायिनम"
14,2,13,"कर्मणा येन मुच्येयम अस्मात करूराद अरिंदम
कर्मणस तद विधत्स्वेह येन शुध्यति मे मनः"
14,2,14,"तम एवं वादिनं वयासस ततः परॊवाच धर्मवित
सान्त्वयन सुमहातेजाः शुभं वचनम अर्थवत"
14,2,15,"अकृता ते मतिस तात पुनर बाल्येन मुह्यसे
किम आकाशे वयं सर्वे परलपाम मुहुर मुहुः"
14,2,16,"विदिताः कषत्रधर्मास ते येषां युद्धेन जीविका
यथा परवृत्तॊ नृपतिर नाधिबन्धेन युज्यते"
14,2,17,"मॊक्षधर्माश च निखिला याथातथ्येन ते शरुताः
असकृच चैव संदेहाच छिन्नास ते कामजा मया"
14,2,18,"अश्रद्दधानॊ दुर्मेधा लुप्तस्मृतिर असि धरुवम
मैवं भव न ते युक्तम इदम अज्ञानम ईदृशम"
14,2,19,"परायश्चित्तानि सर्वाणि विदितानि च ते ऽनघ
युद्धधर्माश च ते सर्वे दानधर्माश च ते शरुताः"
14,2,20,"स कथं सर्वधर्मज्ञः सर्वागम विशारदः
परिमुह्यसि भूयस तवम अज्ञानाद इव भारत"
14,3,1,"[व]
युधिष्ठिर तव परज्ञा न सम्यग इति मे मतिः
न हि कश चित सवयं मर्त्यः सववशः कुरुते करियाः"
14,3,2,"ईश्वरेण नियुक्तॊ ऽयं साध्व असाधु च मानवः
करॊति पुरुषः कर्म तत्र का परिदेवना"
14,3,3,"आत्मानं मन्यसे चाथ पापकर्माणम अन्ततः
शृणु तत्र यथा पापम अपाकृष्येत भारत"
14,3,4,"तपॊभिः करतुभिश चैव दानेन च युधिष्ठिर
तरन्ति नित्यं पुरुषा ये सम पापानि कुर्वते"
14,3,5,"यज्ञेन तपसा चैव दानेन च नराधिप
पूयन्ते राजशार्दूल नरा दुष्कृतकर्मिणः"
14,3,6,"असुराश च सुराश चैव पुण्यहेतॊर मखक्रियाम
परयतन्ते महात्मानस तस्माद यज्ञाः परायणम"
14,3,7,"यज्ञैर एव महात्मानॊ बभूवुर अधिकाः सुराः
ततॊ देवाः करियावन्तॊ दानवान अभ्यधर्षयन"
14,3,8,"राजसूयाश्वमेधौ च सर्वमेधं च भारत
नरमेधं च नृपते तवम आहर युधिष्ठिर"
14,3,9,"यजस्व वाजिमेधेन विधिवद दक्षिणावता
बहु कामान्न वित्तेन रामॊ दाशरथिर यथा"
14,3,10,"यथा च भरतॊ राजा दौःषन्तिः पृथिवीपतिः
शाकुन्तलॊ महावीर्यस तव पूर्वपितामहः"
14,3,11,"[य]
असंशयं वाजिमेधः पावयेत पृथिवीम अपि
अभिप्रायस तु मे कश चित तं तवं शरॊतुम इहार्हसि"
14,3,12,"इमं जञातिबधं कृत्वा सुमहान्तं दविजॊत्तम
दानम अल्पं न शक्यामि दातुं वित्तं च नास्ति मे"
14,3,13,"न च बालान इमान दीनान उत्सहे वसु याचितुम
तथैवार्द्र वरणान कृच्छ्रे वर्तमानान नृपात्मजान"
14,3,14,"सवयं विनाश्य पृथिवीं यज्ञार्थे दविजसत्तम
करम आहारयिष्यामि कथं शॊकपरायणान"
14,3,15,"दुर्यॊधनापराधेन वसुधा वसुधाधिपाः
परनष्टा यॊजयित्वास्मान अकीर्त्या मुनिसत्तम"
14,3,16,"दुर्यॊधनेन पृथिवी कषयिता वित्तकारणात
कॊशश चापि विशीर्णॊ ऽसौ धार्तराष्ट्रस्य दुर्मतेः"
14,3,17,"पृथिवी दक्षिणा चात्र विधिः परथमकल्पिकः
विद्वद्भिः परिदृष्टॊ ऽयं शिष्टॊ विधिविपर्ययः"
14,3,18,"न च परतिनिधिं कर्तुं चिकीर्षामि तपॊधन
अत्र मे भगवन सम्यक साचिव्यं कर्तुम अर्हसि"
14,3,19,"[व]
एवम उक्तस तु पार्थेन कृष्णद्वैपायनस तदा
मुहूर्तम अनुसंचिन्त्य धर्मराजानम अब्रवीत"
14,3,20,"विद्यते दरविणं पार्थ गिरौ हिमवति सथितम
उत्सृष्टं बराह्मणैर यज्ञे मरुत्तस्य महीपतेः
तद आनयस्व कौन्तेय पर्याप्तं तद भविष्यति"
14,3,21,"[य]
कथं यज्ञे मरुत्तस्य दरविणं तत समाचितम
कस्मिंश च काले स नृपॊ बभूव वदतां वर"
14,3,22,"[व]
यदि शुश्रूषसे पार्थ शृणु कारंधमं नृपम
यस्मिन काले महावीर्यः स राजासीन महाधनः"
14,4,1,"[य]
शुश्रूषे तस्य धर्मज्ञ राजर्षेः परिकीर्तनम
दवैपायन मरुत्तस्य कथां परब्रूहि मे ऽनघ"
14,4,2,"[व]
आसीत कृतयुगे पूर्वं मनुर दण्डधरः परभुः
तस्य पुत्रॊ महेष्वासः परजातिर इति विश्रुतः"
14,4,3,"परजातेर अभवत पुत्रः कषुप इत्य अभिविश्रुतः
कषुपस्य पुत्रस तव इक्ष्वाकुर महीपालॊ ऽभवत परभुः"
14,4,4,"तस्य पुत्रशतं राजन्न आसीत परमधार्मिकम
तांस्त तु सर्वान महीपालान इक्ष्वाकुर अकरॊत परभुः"
14,4,5,"तेषां जयेष्ठस तु विंशॊ ऽभूत परतिमानं धनुष्मताम
विंशस्य पुत्रः कल्याणॊ विविंशॊ नाम भारत"
14,4,6,"विविंशस्य सुता राजन बभूवुर दश पञ्च च
सर्वे धनुषि विक्रान्ता बरह्मण्याः सत्यवादिनः"
14,4,7,"दानधर्मरताः सन्तः सततं परियवादिनः
तेषां जयेष्ठः खनी नेत्रः स तान सर्वान अपीडयत"
14,4,8,"सवनीनेत्रस तु विक्रान्तॊ जित्वा राज्यम अकण्टकम
नाशक्नॊद रक्षितुं राज्यं नान्वरज्यन्त तं परजाः"
14,4,9,"तम अपास्य च तद राष्ट्रं तस्य पुत्रं सुवर्चसम
अभ्यषिञ्चत राजेन्द्र मुदितं चाभवत तदा"
14,4,10,"स पितुर विक्रियां दृष्ट्वा राज्यान निरसनं तथा
नियतॊ वर्तयाम आस परजाहितचिकीर्षया"
14,4,11,"बरह्मण्यः सत्यवादी च शुचिः शम दमान्वितः
परजास तं चान्वरज्यन्त धर्मनित्यं मनस्विनम"
14,4,12,"तस्य धर्मप्रवृत्तस्य वयशीर्यत कॊशवाहनम
तं कषीणकॊशं सामन्ताः समन्तात पर्यपीडयन"
14,4,13,"स पीड्यमानॊ बहुभिः कषीणकॊशस तव अवाहनः
आर्तिम आर्छत परां राजा सह भृत्यैः पुरेण च"
14,4,14,"न चैनं परिहर्तुं ते ऽशक्नुवन परिसंक्षये
सम्यग्वृत्तॊ हि राजा स धर्मनित्यॊ युधिष्ठिर"
14,4,15,"यदा तु परमाम आर्तिं गतॊ ऽसौ स पुरॊ नृपः
ततः परदध्मौ स करं परादुरासीत ततॊ बलम"
14,4,16,"ततस तान अजयत सर्वान परातिसीमान नराधिपान
एतस्मात कारणाद राजन विश्रुतः स करंधमः"
14,4,17,"तस्य कारंधमः पुत्रस तरेतायुगमुखे ऽभवत
इन्द्राद अनवरः शरीमान देवैर अपि सुदुर्जयः"
14,4,18,"तस्य सर्वे महीपाला वर्तन्ते सम वशे तदा
स हि सम्राड अभूत तेषां वृत्तेन च बलेन च"
14,4,19,"अविक्षिन नाम धर्मात्मा शौर्येणेन्द्र समॊ ऽभवत
यज्ञशीलः कर्म रतिर धृतिमान संयतेन्द्रियः"
14,4,20,"तेजसादित्यसदृशः कषमया पृथिवीसमः
बृहस्पतिसमॊ बुद्ध्या हिमवान इव सुस्थिरः"
14,4,21,"कर्मणा मनसा वाचा दमेन परशमेन च
मनांस्य आराधयाम आस परजानां स महीपतिः"
14,4,22,"य ईजे हयमेधानां शतेन विधिवत परभुः
याजयाम आस यं विद्वान सवयम एवाङ्गिराः परभुः"
14,4,23,"तस्य पुत्रॊ ऽतिचक्राम पितरं गुणवत्तया
मरुत्तॊ नाम धर्मज्ञश चक्रवर्ती महायशाः"
14,4,24,"नागायुत समप्राणः साक्षाद विष्णुर इवापरः
स यक्ष्यमाणॊ धर्मात्मा शातकुम्भमयान्य उत
कारयाम आस शुभ्राणि भाजनानि सहस्रशः"
14,4,25,"मेरुं पर्वतम आसाद्य हिमवत्पार्श्व उत्तरे
काञ्चनः सुमहान पादस तत्र कर्म चकार सः"
14,4,26,"ततः कुण्डानि पात्रीश च पिठराण्य आसनानि च
चक्रुः सुवर्णकर्तारॊ येषां संख्या न विद्यते"
14,4,27,"तस्यैव च समीपे स यज्ञवाटॊ बभूव ह
ईजे तत्र स धर्मात्मा विधिवत पृथिवीपतिः
मरुत्तः सहितैः सर्वैः परजा पालैर नराधिपः"
14,5,1,"[य]
कथंवीर्यः समभवत स राजा वदतां वरः
कथं च जातरूपेण समयुज्यत स दविज"
14,5,2,"कव च तत सांप्रतं दरव्यं भगवन्न अवतिष्ठते
कथं च शक्यम अस्माभिस तद अवाप्तुं तपॊधन"
14,5,3,"[व]
असुराश चैव देवाश च दक्षस्यासन परजापतेः
अपत्यं बहुलं तात ते ऽसपर्धन्त परस्परम"
14,5,4,"तथैवाङ्गिरसः पुत्रौ वरततुल्यौ बभूवतुः
बृहस्पतिर बृहत तेजाः संवर्तश च तपॊधनः"
14,5,5,"ताव अपि सपर्धिनौ राजन पृथग आस्तां परस्परम
बृहस्पतिश च संवर्तं बाधते सम पुनः पुनः"
14,5,6,"स बाध्यमानः सततं भरात्रा जयेष्ठेन भारत
अर्थान उत्सृज्य दिग्वासा वनवासम अरॊचयत"
14,5,7,"वासवॊ ऽपय असुरान सर्वान निर्जित्य च निहत्य च
इन्द्रत्वं पराप्य लॊकेषु ततॊ वव्रे पुरॊहितम
पुत्रम अङ्गिरसॊ जयेष्ठं विप्र शरेष्ठं बृहस्पतिम"
14,5,8,"याज्यस तव अङ्गिरसः पूर्वम आसीद राजा करंधमः
वीर्येणाप्रतिमॊ लॊके वृत्तेन च बलेन च
शतक्रतुर इवौजस्वी धर्मात्मा संशितव्रतः"
14,5,9,"वाहनं यस्य यॊधाश च दरव्याणि विविधानि च
धयानाद एवाभवद राजन मुखवातेन सर्वशः"
14,5,10,"स गुणैः पार्थिवान सर्वान वशे चक्रे नराधिपः
संजीव्य कालमिष्टं च स शरीरॊ दिवं गतः"
14,5,11,"बभूव तस्य पुत्रस तु ययातिर इव धर्मवित
अविक्षिन नाम शत्रुक्षित स वशे कृतवान महीम
विक्रमेण गुणैश चैव पितेवासीत स पार्थिवः"
14,5,12,"तस्य वासवतुल्यॊ ऽभून मरुत्तॊ नाम वीर्यवान
पुत्रस तम अनुरक्ताभूत पृथिवी सागराम्बरा"
14,5,13,"सपर्धते सततं स सम देवराजेन पार्थिवः
वासवॊ ऽपि मरुत्तेन सपर्धते पाण्डुनन्दन"
14,5,14,"शुचिः स गुणवान आसीन मरुत्तः पृथिवीपतिः
यतमानॊ ऽपि यं शक्रॊ न विशेषयति सम ह"
14,5,15,"सॊ ऽशक्नुवन विशेषाय समाहूय बृहस्पतिम
उवाचेदं वचॊ देवैः सहितॊ हरिवाहनः"
14,5,16,"बृहस्पते मरुत्तस्य मा सम कार्षीः कथं चन
दैवं कर्माथ वा पित्र्यं कर्तासि मम चेत परियम"
14,5,17,"अहं हि तरिषु लॊकेषु सुराणां च बृहस्पते
इन्द्रत्वं पराप्तवान एकॊ मरुत्तस तु महीपतिः"
14,5,18,"कथं हय अमर्त्यं बरह्मस तवं याजयित्वा सुराधिपम
याजयेर्मृत्यु संयुक्तं मरुत्तम अविशङ्कया"
14,5,19,"मां वा वृणीष्व भद्रं ते मरुत्तं वा महीपतिम
परिज्यज्य मरुत्तं वा यथाजॊषं भजस्व माम"
14,5,20,"एवम उक्तः स कौरव्य देवराज्ञा बृहस्पतिः
मुहूर्तम इव संचिन्त्य देवराजानम अब्रवीत"
14,5,21,"तवं भूतानाम अधिपतिस तवयि लॊकाः परतिष्ठिताः
नमुचेर विश्वरूपस्य निहन्ता तवं बलस्य च"
14,5,22,"तवम आजहर्थ देवानाम एकॊ वीरश्रियं पराम
तवं बिभर्षि भुवं दयां च सदैव बलसूदन"
14,5,23,"पौरॊहित्यं कथं कृत्वा तव देवगणेश्वर
याजयेयम अहं मर्त्यं मरुत्तं पाकशासन"
