Book No,Chapter No,Paragraph No,Paragraph Text
4,18,7,"इति बरुवाणा वाक्यानि सा मां नित्यम अवेदयत
करुध्यन्तीं मां च संप्रेक्ष्य समशङ्कत मां तवयि"
4,18,8,"तस्यां तथा बरुवत्यां तु दुःखं मां महद आविशत
शॊके यौधिष्ठिरे मग्ना नाहं जीवितुम उत्सहे"
4,18,9,"यः स देवान मनुष्यांश च सर्पां चैकरथॊ ऽजयत
सॊ ऽयं राज्ञॊ विराटस्य कन्यानां नर्तकॊ युवा"
4,18,10,"यॊ ऽतर्पयद अमेयात्मा खाण्डवे जातवेदसम
सॊ ऽनतःपुर गतः पार्थः कूपे ऽगनिर इव संवृतः"
4,18,11,"यस्माद भयम अमित्राणां सदैव पुरुषर्षभात
स लॊकपरिभूतेन वेषेणास्ते धनंजयः"
4,18,12,"यस्य जयातलनिर्घॊषात समकम्पन्त शत्रवः
सत्रियॊ गीतस्वनं तस्य मुदिताः पर्युपासते"
4,18,13,"किरीटं सूर्यसंकाशं यस्य मूर्धनि शॊभते
वेणी विकृतकेशान्तः सॊ ऽयम अद्य धनंजयः"
4,18,14,"यस्मिन्न अस्त्राणि दिव्यानि समस्तानि महात्मनि
आधारः सर्वविद्यानां स धारयति कुण्डले"
4,18,15,"यं सम राजसहस्राणि तेजसाप्रतिमानि वै
समरे नातिवर्तन्ते वेलाम इव महार्णवः"
4,18,16,"सॊ ऽयं राज्ञॊ विराटस्य कन्यानां नर्तकॊ युवा
आस्ते वेषप्रतिच्छन्नः कन्यानां परिचारकः"
4,18,17,"यस्य सम रथघॊषेण समकम्पत मेदिनी
स पर्वत वना भीम सहस्थावरजङ्गमा"
4,18,18,"यस्मिञ जाते महाभागे कुन्त्याः शॊकॊ वयनश्यत
स शॊचयति माम अद्य भीमसेन तवानुजः"
4,18,19,"भूषितं तम अलंकारैः कुण्डलैः परिहाटकैः
कम्बुपाणिनम आयान्तं दृष्ट्वा सीदति मे मनः"
4,18,20,"तं वेणी कृतकेशान्तं भीमधन्वानम अर्जुनम
कन्या परिवृतं दृष्ट्वा भीम सीदति मे मनः"
4,18,21,"यदा हय एनं परिवृतं कन्याभिर देवरूपिणम
परभिन्नम इव मातङ्गं परिकीर्णं करेणुभिः"
4,18,22,"मत्स्यम अर्थपतिं पार्थं विराटं समुपस्थितम
पश्यामि तूर्यमध्य सथं दिश नश्यन्ति मे तदा"
4,18,23,"नूनम आर्या न जानाति कृच्छ्रं पराप्तं धनंजयम
अजातशत्रुं कौरव्यं मग्नं दूद्यूत देविनम"
4,18,24,"तथा दृष्ट्वा यवीयांसं सहदेवं युधां पतिम
गॊषु गॊवेषम आयान्तं पाण्डुभूतास्मि भारत"
4,18,25,"सहदेवस्य वृत्तानि चिन्तयन्ती पुनः पुनः
न विन्दामि महाबाहॊ सहदेवस्य दुष्कृतम
यस्मिन्न एवंविधं दुःखं पराप्नुयात सत्यविक्रमः"
4,18,26,"दूयामि भरतश्रेष्ठ दृष्ट्वा ते भरातरं परियम
गॊषु गॊवृषसंकाशं मत्स्येनाभिनिवेशितम"
4,18,27,"संरब्धं रक्तनेपथ्यं गॊपालानां पुरॊगमम
विराटम अभिनन्दन्तम अथ मे भवति जवरः"
4,18,28,"सहदेवं हि मे वीरं नित्यम आर्या परशंसति
महाभिजन संपन्नॊ वृत्तवाञ शीलवान इति"
4,18,29,"हरीनिषेधॊ मधुरवाग धार्मिकश च परियश च मे
स ते ऽरण्येषु बॊद्धव्यॊ याज्ञसेनि कषपास्व अपि"
4,18,30,"तं दृष्ट्वा वयापृतं गॊषु वत्स चर्म कषपाशयम
सहदेवं युधां शरेष्ठं किं नु जीवामि पाण्डव"
4,18,31,"यस तरिभिर नित्यसंपन्नॊ रूपेणास्त्रेण मेधया
सॊ ऽशवबन्धॊ विराटस्य पश्य कालस्य पर्ययम"
4,18,32,"अभ्यकीर्यन्त वृन्दानि दाम गरन्थिम उदीक्षताम
विनयन्तं जनेनाश्वान महाराजस्य पश्यतः"
4,18,33,"अपश्यम एनं शरीमन्तं मत्स्यं भराजिष्णुम उत्तमम
विराटम उपतिष्ठन्तं दर्शयन्तं च वाजिनः"
4,18,34,"किं नु मां मन्यसे पार्थ सुखितेति परंतप
एवं दुःखशताविष्टा युधिष्ठिर निमित्ततः"
4,18,35,"अतः परतिविशिष्टानि दुःखान्य अन्यानि भारत
वर्तन्ते मयि कौन्तेय वक्ष्यामि शृणु तान्य अपि"
4,18,36,"युष्मासु धरियमाणेषु दुःखानि विविधान्य उत
शॊषयन्ति शरीरं मे किं नु कुःखम अतः परम"
4,19,1,"[दरौ]
अहं सैरन्धि वेषेण चरन्ती राजवेश्मनि
शौचदास्मि सुदेष्णाया अक्षधूर्तस्य कारणात"
4,19,2,"विक्रियां पश्य मे तीव्रां राजपुत्र्याः परंतप
आसे कालम उपासीना सर्वं दुःखं किलार्तवत"
4,19,3,"अनित्या किल मर्त्यानाम अर्थसिद्धिर जयाजयौ
इति कृत्वा परतीक्षामि भर्तॄणाम उदयं पुनः"
4,19,4,"य एव हेतुर भवति पुरुषस्य जयावहः
पराजये च हेतुः स इति च परतिपालये"
4,19,5,"दत्त्वा याचन्ति पुरुषा हत्वा वध्यन्ति चापरे
पातयित्वा च पात्यन्ते परैर इति च मे शरुतम"
4,19,6,"न दैवस्याति भारॊ ऽसति न दैवस्याति वर्तनम
इति चाप्य आगमं भूयॊ दैवस्य परतिपालये"
4,19,7,"सथितं पूर्वं जलं यत्र पुनस तत्रैव तिष्ठति
इति पर्यायम इच्छन्ती परतीक्षाम्य उदयं पुनः"
4,19,8,"दैवेन किल यस्यार्थः सुनीतॊ ऽपि विपद्यते
दैवस्य चागमे यत्नस तेन कार्यॊ विजानता"
4,19,9,"यत तु मे वचनस्यास्य कथितस्य परयॊजनम
पृच्छ मां दुःखितां तत तवम अपृष्टा वा बरवीमि ते"
4,19,10,"महिषी पाण्डुपुत्राणां दुहिता दरुपदस्य च
इमाम अवस्थां संप्राप्ता का मद अन्या जिजीविषेत"
4,19,11,"कुरून परिभवन सर्वान पाञ्चालान अपि भारत
पाण्डवेयांश च संप्राप्तॊ मम कलेशॊ हय अरिंदम"
4,19,12,"भरातृभिः शवशुरैः पुत्रैर बहुभिः परवीर हन
एवं समुदिता नारी का नव अन्या दुःखिता भवेत"
4,19,13,"नूनं हि बालया धातुर मया वै विप्रियं कृतम
यस्य परसादाद दुर्नीतं पराप्तास्मि भरतर्षभ"
4,19,14,"वर्णावकाशम अपि मे पश्य पाण्डव यादृशम
यादृशॊ मे न तत्रासीद दुःखे परमके तदा"
4,19,15,"तवम एव भीम जानीषे यन मे पार्थ सुखं पुरा
साहं दासत्वम आपन्ना न शान्तिम अवशा लभे"
4,19,16,"नादैविकम इदं मन्ये यत्र पार्थॊ धनंजयः
भीम धन्वा महाबाहुर आस्ते शान्त इवानलः"
4,19,17,"अशक्या वेदितुं पार्थ पराणिनां वै गतिर नरैः
विनिपातम इमं मन्ये युष्माकम अविचिन्तितम"
4,19,18,"यस्या मम मुखप्रेक्षा यूयम इन्द्रसमाः सदा
सा परेक्षे मुखम अन्यासाम अवराणां वरा सती"
4,19,19,"पश्य पाण्डव मे ऽवस्थां यथा नार्हामि वै तथा
युष्मासु धरियमाणेषु पश्य कालस्य पर्ययम"
4,19,20,"यस्याः सागरपर्यन्ता पृथिवी वशवर्तिनी
आसीत साद्य सुदेष्णाया भीताहं वशवर्तिनी"
4,19,21,"यस्याः पुरःसरा आसन पृष्ठतश चानुगामिनः
साहम अद्य सुदेष्णायाः पुरः पश्चाच च गामिनी
इदं तु दुःखं कौन्तेय ममासह्यं निबॊध तत"
4,19,22,"या न जातु सवयं पिंषे गात्रॊद्वर्तनम आत्मनः
अन्यत्र कुन्त्या भद्रं ते साद्य पिंषामि चन्दनम
पश्य कौन्तेय पाणी मे नैवं यौ भवतः पुरा"
4,19,23,"[वै]
इत्य अस्य दर्शयाम आस किणबद्धौ कराव उभौ"
4,19,24,"[दरौ]
बिभेमि कुन्त्या या नाहं युष्माकं वा कदा चन
साद्याग्रतॊ विराटस्य भीता तिष्ठामि किंकरी"
4,19,25,"किं नु वक्ष्यति सम्राण मां वर्णकः सुकृतॊ न वा
नान्यपिष्टं हि मत्स्यस्य चन्दनं किल रॊचते"
4,19,26,"[वै]
सा कीर्तयन्ती दुःखानि भीमसेनस्य भामिनी
रुरॊद शनकैः कृष्णा भीमसेनम उदीक्षती"
4,19,27,"सा बाष्पकलया वाचा निःश्वसन्ती पुनः पुनः
हृदयं भीमसेनस्य घट्टयन्तीदम अब्रवीत"
4,19,28,"नाल्पं कृतं मया भीम देवानां किल्बिषं पुरा
अभाग्या यत तु जीवामि मर्तव्ये सति पाण्डव"
4,19,29,"ततस तस्याः करौ शूनौ किणबद्धौ वृकॊदरः
मुखम आनीय वेपन्त्या रुरॊद परवीर हा"
4,19,30,"तौ गृहीत्वा च कौन्तेयॊ बाष्पम उत्सृज्य वीर्यवान
ततः परमदुःखार्त इदं वचनम अब्रवीत"
4,20,1,"[भीमस]
धिग अस्तु मे बाहुबलं गाण्डीवं फल्गुनस्य च
यत ते रक्तौ पुरा भूत्वा पाणी कृतकिणाव उभौ"
4,20,2,"सभायां सम विराटस्य करॊमि कदनं महत
तत्र मां धर्मराजस तु कटाक्षेण नयवारयत
तद अहं तस्य विज्ञाय सथित एवास्मि भामिनि"
4,20,3,"यच च राष्ट्रात परच्यवनं कुरूणाम अवधश च यः
सुयॊधनस्य कर्णस्य शकुनेः सौबलस्य च"
4,20,4,"दुःशासनस्य पापस्य यन मया न हृतं शिरः
तन मे दहति कल्याणि हृदि शल्यम इवार्पितम
मा धर्मं जहि सुश्रॊणि करॊधं जहि महामते"
4,20,5,"इमं च समुपालम्भं तवत्तॊ राजा युधिष्ठिरः
शृणुयाद यदि कल्याणि कृत्स्नं जह्यात स जीवितम"
4,20,6,"धनंजयॊ वा सुश्रॊणि यमौ वा तनुमध्यमे
लॊकान्तर गतेष्व एषु नाहं शक्ष्यामि जीवितुम"
4,20,7,"सुकन्या नाम शार्याती भार्गवं चयचनं वने
वल्मीक भूतं शाम्यन्तम अन्वपद्यत भामिनी"
4,20,8,"नाड्दायनी चेन्द्रसेना रूपेण यदि ते शरुता
पतिम अन्वचरद वृद्धं पुरा वर्षसहस्रिणम"
4,20,9,"दुहिता जनकस्यापि वैदेही यदि ते शरुता
पतिम अन्वचरत सीता महारण्यनिवासिनम"
4,20,10,"रक्षसा निग्रहं पराप्य रामस्य महिषी परिया
कलिश्यमानापि सुश्रॊणी रामम एवान्वपद्यत"
4,20,11,"लॊपामुद्रा तथा भीरु वयॊ रूपसमन्विता
अगस्त्यम अन्वयाद धित्वा कामान सर्वान अमानुषान"
4,20,12,"यथैताः कीर्तिता नार्यॊ रूपवत्यः पतिव्रताः
तथा तवम अपि कल्याणि सर्वैः समुदिता गुणैः"
4,20,13,"मा दीर्घं कषम कालं तवं मासम अध्यर्धसंमितम
पूर्णे तरयॊदशे वर्षे राज्ञॊ राज्ञी भविष्यसि"
4,20,14,"[दरौ]
आर्तयैतन मया भीमकृतं बाष्पविमॊक्षणम
अपारयन्त्या दुःखानि न राजानम उपालभे"
4,20,15,"विमुक्तेन वयतीतेन भीमसेन महाबल
परत्युपस्थित कालस्य कार्यस्यानन्तरॊ भव"
4,20,16,"ममेह भीमकैकेयी रूपाभिभव शङ्कया
नित्यम उद्जिवते राजा कथं नेयाद इमाम इती"
4,20,17,"तस्या विदित्वा तं भावं सवयं चानृत दर्शनः
कीचकॊ ऽयं सुदुष्टात्मा सदा परार्थयते हि माम"
4,20,18,"तम अहं कुपिता भीम पुनः कॊपं नियम्य च
अब्रुवं कामसंमूढम आत्मानं रक्ष कीचक"
4,20,19,"गन्धर्वाणाम अहं भार्या पञ्चानां महिषी परिया
ते तवां निहन्युर दुर्धर्षाः शूराः साहस कारिणः"
4,20,20,"एवम उक्तः स दुष्टात्मा कीचकः परत्युवाच ह
नाहं बिभेमि सैरन्धिर गन्धर्वाणां शुचिस्मिते"
4,20,21,"शतं सहस्रम अपि वा गन्धर्वाणाम अहं रणे
समागतं हनिष्यामि तवं भीरु कुरु मे कषणम"
4,20,22,"इत्य उक्ते चाब्रुवं सूतं कामातुरम अहं पुनः
न तवं परतिबलस तेषां गन्धर्वाणां यशस्विनाम"
4,20,23,"धर्मे सथितास्मि सततं कुलशीलसमन्विता
नेच्छामि कं चिद वध्यन्तं तेन जीवसि कीचक"
4,20,24,"एवम उक्तः स दुष्टात्मा परहस्य सवनवत तदा
न तिष्ठति सम सन मार्गे न च धर्मं बुभूषति"
4,20,25,"पापात्मा पापभावश च कामरागवशानुगः
अविनीतश च दुष्टात्मा परत्याख्यातः पुनः पुनः
दर्शने दर्शने हन्यात तथा जह्यां च जीवितम"
4,20,26,"तद धर्मे यतमानानां महान धर्मॊ नशिष्यति
समयं रक्षमाणानां भार्या वॊ न भविष्यति"
4,20,27,"भार्यायां रक्ष्यमाणायां परजा भवति रक्षिता
परजायां रक्ष्यमाणायाम आत्मा भवति रक्षितः"
4,20,28,"वदतां वर्णधर्मांश च बराह्मणानां हि मे शरुतम
कषत्रियस्य सदा धर्मॊ नान्यः शत्रुनिबर्हणात"
4,20,29,"पश्यतॊ धर्मराजस्य कीचकॊ मां पदावधीत
तव चैव समक्षं वै भीमसेन महाबल"
4,20,30,"तवया हय अहं परित्राता तस्माद घॊराज जटासुरात
जयद्रथं तथैव तव मजैषीर भरातृभिः सह"
4,20,31,"जहीमम अपि पापं तवं यॊ ऽयं माम अवमन्यते
कीचकॊ राजवाल्लभ्याच छॊककृन मम भारत"
4,20,32,"तम एवं कामसंम्मत्तं भिन्धि कुम्भम इवाश्मनि
यॊ निमित्तम अनर्थानां बहूनां मम भारत"
4,20,33,"तं चेज जीवन्तम आदित्यः परातर अभ्युदयिष्यति
विषम आलॊड्य पास्यामि मां कीचक वशं गमम
शरेयॊ हि मरणं मह्यं भीमसेन तवाग्रतः"
4,20,34,"[वै]
इत्य उक्त्वा परारुदत कृष्णा भीमस्यॊरः समाश्रिता
भीमश च तां परिष्वज्य महत सान्त्वं परयुज्य च
कीचकं मनसागच्छत सृक्किणी परिसंलिहन"
4,21,1,"[भीमस]
तथा भद्रे करिष्यामि यथा तवं भीरु भाषसे
अद्य तं सूदयिष्यामि कीचकं सह बान्धवम"
4,21,2,"अस्याः परदॊषे शर्वर्याः कुरुष्वानेन संगमम
दुःखं शॊकं च निर्धूय याज्ञसेनि शुचिस्मिते"
4,21,3,"यैषा नर्तन शाला वै मत्स्यराजेन कारिता
दिवात्र कन्या नृत्यन्ति रात्रौ यान्ति यथा गृहम"
4,21,4,"तत्रास्ति शयनं भीरु दृज्ढाङ्गं सुप्रतिष्ठितम
तत्रास्य दर्शयिष्यामि पूर्वप्रेतान पितामहान"
4,21,5,"यथा च तवां न पश्येयुः कुर्वाणां तेन संविदम
कुर्यास तथा तवं कल्याणि यथा संनिहितॊ भवेत"
4,21,6,"[वै]
तथा तौ कथयित्वा तु बाष्पम उत्सृज्य दुःखितौ
रात्रिशेषं तद अत्युग्रं धारयाम आसतुर हृदा"
4,21,7,"तस्यां रात्र्यां वयतीतायां परातर उत्थाय कीचकः
गत्वा राजकुलायैव दरौपदीम इदम अब्रवीत"
4,21,8,"सभायां पश्यतॊ राज्ञः पातयित्वा पदाहनम
न चैवालभथास तराणम अभिपन्ना बलीयसा"
4,21,9,"परवादेन हि मत्स्यानां राजा नाम्नायम उच्यते
अहम एव हि मत्स्यानां राजा वै वाहिनीपतिः"
4,21,10,"सा सुखं परतिपद्यस्व दासभीरु भवामि ते
अह्नाय तव सुश्रॊणिशतं निष्कान ददाम्य अहम"
4,21,11,"दासी शतं च ते दद्यां दासानाम अपि चापरम
रथं चाश्वतरी युक्तम अस्तु नौ भीरु संगमः"
4,21,12,"[दरौ]
एकं मे समयं तव अद्य परतिपद्यस्व कीचक
न तवां सखा वा भराता वा जानीयात संगतं मया"
4,21,13,"अवबॊधाद धि भीतास्मि गन्धर्वाणां यशस्विनाम
एवं मे परतिजानीहि ततॊ ऽहं वशगा तव"
4,21,14,"[कीचक]
एवम एतत करिष्यामि यथा सुश्रॊणि भाषसे
एकॊ भद्रे गमिष्यामि शून्यम आवसथं तव"
4,21,15,"समागमार्थं रम्भॊरु तवया मदनमॊहितः
यथा तवां नावभॊत्स्यन्ति गन्धर्वाः सूर्यवर्चसः"
4,21,16,"[दरौ]
यद इदं नर्तनागारं मत्स्यराजेन कारितम
दिवात्र कन्या नृत्यन्ति रात्रौ यान्ति यथा गृहम"
