Book No,Chapter No,Paragraph No,Paragraph Text
18,1,1,"[ज]
सवर्गं तरिविष्टपं पराप्य मम पूर्वपितामहाः
पाण्डवा धार्तराष्ट्राश च कानि सथानानि भेजिरे"
18,1,2,"एतद इच्छाम्य अहं शरॊतुं सर्वविच चासि मे मतः
महर्षिणाभ्यनुज्ञातॊ वयासेनाद्भुत कर्मणा"
18,1,3,"[वै]
सवर्गं तरिविष्टपं पराप्य तव पूर्वपितामहाः
युधिष्ठिरप्रभृतयॊ यद अकुर्वत तच छृणु"
18,1,4,"सवर्गं तरिविष्टपं पराप्य धर्मराजॊ युधिष्ठिरः
दुर्यॊधनं शरिया जुष्टं ददर्शासीनम आसने"
18,1,5,"भराजमानाम इवादित्यं वीर लक्ष्म्याभिसंवृतम
देवैर भराजिष्णुभिः साध्यैः सहितं पुण्यकर्मभिः"
18,1,6,"ततॊ युधिष्ठिरॊ दृष्ट्व दुर्यॊधनम अमर्षितः
सहसा संनिवृत्तॊ ऽभूच छरियं दृष्ट्वा सुयॊधने"
18,1,7,"बरुवन्न उच्चैर वचस तान वै नाहं दुर्यॊधनेन वै
सहितः कामये लॊकाँल लुब्धेनादीर्घ दर्शिना"
18,1,8,"यत्कृते पृथिवी सर्वा सुहृदॊ बान्धवास तथा
हतास्माभिः परसह्याजौ कलिष्टैः पूर्वं महावने"
18,1,9,"दरौपदी च सभामध्ये पाञ्चाली धर्मचारिणी
परिक्लिष्टानवद्याङ्गी पत्नी नॊ गुरुसंनिधौ"
18,1,10,"सवस्ति देवा न मे कामः सुयॊधनम उदीक्षितुम
तत्राहं गन्तुम इच्छामि यत्र ते भरातरॊ मम"
18,1,11,"मैवम इत्य अब्रवीत तं तु नारदः परहसन्न इव
सवर्गे निवासॊ राजेन्द्र विरुद्धं चापि नश्यति"
18,1,12,"युधिष्ठिर महाबाहॊ मैवं वॊचः कथं चन
दुर्यॊधनं परति नृपं शृणु चेदं वचॊ मम"
18,1,13,"एष दुर्यॊधनॊ राजा पूज्यते तरिदशैः सह
सद्भिश च राजप्रवरैर य इमे सवर्गवासिनः"
18,1,14,"वीरलॊकगतिं पराप्तॊ युद्धे हुत्वात्मनस तनुम
यूयं सवर्गे सुरसमा येना युद्धे समासिताः"
18,1,15,"स एष कषत्रधर्मेण सथानम एतद अवाप्तवान
भये महति यॊ ऽभीतॊ बभूव पृथिवीपतिः"
18,1,16,"न तन मनसि कर्तव्यं पुत्र यद दयूतकारितम
दरौपद्याश च परिक्लेशं न चिन्तयतुम अर्हसि"
18,1,17,"ये चान्ये ऽपि परिक्लेशा युष्माकं दयूतकारिताः
संग्रामेष्व अथ वान्यात्र न तान संस्मर्तुम अर्हसि"
18,1,18,"समागच्छ यथान्यायं राज्ञा दुर्यॊधनेन वै
सवर्गॊ ऽयं नेह वैराणि भवन्ति मनुजाधिप"
18,1,19,"नारदेनैवम उक्तस तु कुरुराजॊ युधिष्ठिरः
भरातॄन पप्रच्छ मेधावी वाक्यम एतद उवाच ह"
18,1,20,"यदि दुर्यॊधनस्यैते वीरलॊकः सनातनाः
अधर्मज्ञस्य पापस्य पृथिवी सुहृद अद्रुहः"
18,1,21,"यत्कृते पृथिवी नष्टा सहया सरथ दविपा
वयं च मन्युना दग्धा वैरं परतिचिकीर्षवः"
18,1,22,"ये ते वीरा महात्मानॊ भरातरॊ मे महाव्रताः
सत्यप्रतिज्ञा लॊकस्य शूरा वै सत्यवादिनः"
18,1,23,"तेषाम इदानीं के लॊका दरष्टुम इच्छामि तान अहम
कर्णं चैव महात्मानं कौन्तेयं सत्यसंगरम"
18,1,24,"धृष्टद्युम्नं सात्यकिं च धृष्टद्युम्नस्य चात्मजान
ये च शस्त्रैर वधं पराप्ताः कषत्रधर्मेण पार्थिवाः"
18,1,25,"कव नु ते पार्थिवा बरह्मन्न एतान पश्यामि नारद
विराटद्रुपदौ चैव धृष्टकेतुमुखांश च तान"
18,1,26,"शिखण्डिनं च पाञ्चाल्यं दरौपदेयांश च सर्वशः
अभिमन्युं च दुर्धर्षं दरष्टुम इच्छामि नारद"
18,2,1,"[य]
नेह पश्यामि विबुधा राधेयम अमितौजसम 
भरातरौ च महात्मानौ युधामन्यूत्तमौजसौ"
18,2,2,"जुहुवुर ये शरीराणि रणवह्नौ महारथाः
राजानॊ राजपुत्राश च ये मदर्थे हता रणे"
18,2,3,"कव ते महारथाः सर्वे शार्दूलसमविक्रमाः
तैर अप्य अयं जितॊ लॊकः कच चित पुरुषसत्तमैः"
18,2,4,"यदि लॊकान इमान पराप्तास ते च सर्वे महारथाः
सथितं वित्तहि मां देवाः सहितं तैर महात्मभिः"
18,2,5,"कच चिन न तैर अवाप्तॊ ऽयं नृपैर लॊकॊ ऽकषयः शुभः
न तैर अहं विना वत्स्ये जञातिभिर भरातृभिस तथा"
18,2,6,"मातुर हि वचनं शरुत्वा तदा सलिलकर्मणि
कर्णस्य करियतां तॊयम इति तप्यामि तेन वै"
18,2,7,"इदं च परितप्यामि पुनः पुनर अहं सुराः
यन मातुः सदृशौ पादौ तस्याहम अमितौजसः"
18,2,8,"दृष्ट्वैव तं नानुगतः कर्णं परबलार्दनम
न हय अस्मान कर्ण सहिताञ जयेच छक्रॊ ऽपि संयुगे"
18,2,9,"तम अहं यत्र तत्रस्थं दरष्टुम इच्छामि सूर्यजम
अविज्ञातॊ मया यॊ ऽसौ घातितः सव्यसाचिना"
18,2,10,"भीमं च भीमविक्रान्तं पराणेभ्यॊ ऽपि परियं मम
अर्जुनं चेन्द्र संकाशं यमौ तौ च यमॊपमौ"
18,2,11,"दरष्टुम इच्छामि तां चाहं पाञ्चालीं धर्मचारिणीम
न चेह सथातुम इच्छामि सत्यम एतद बरवीमि वः"
18,2,12,"किं मे भरातृविहीनस्य सवर्गेण सुरसत्तमाः
यत्र ते स मम सवर्गॊ नायं सवर्गॊ मतॊ मम"
18,2,13,"[देवाह]
यदि वै तत्र ते शरद्धा गम्यतां पुत्र माचिरम
परिये हि तव वर्तामॊ देवराजस्य शासनात"
18,2,14,"[वै]
इत्य उक्त्वा तं ततॊ देवा देवदूतम उपादिशम
युधिष्ठिरस्य सुहृदॊ दर्शयेति परंतप"
18,2,15,"ततः कुन्तीसुतॊ राजा देवदूतश च जग्मतुः
सहितौ राजशार्दूल यत्र ते पुरुषर्षभाः"
18,2,16,"अग्रतॊ देवदूतस तु ययौ राजा च पृष्ठतः
पन्थानम अशुभं दुर्गं सेवितं पापकर्मभिः"
18,2,17,"तपसा संवृतं घॊरं केशशौवल शाद्वलम
युक्तं पापकृतां गन्धैर मांसशॊणितकर्दमम"
18,2,18,"दंशॊत्थानं सझिल्लीकं मक्षिका मशकावृतम
इतश चेतश च कुणपैः समन्तात परिवारितम"
18,2,19,"अस्थि केशसमाकीर्णं कृमिकीट समाकुलम
जवलनेन परदीप्तेन समन्तात परिवेष्टितम"
18,2,20,"अयॊ मूखैश च काकॊलैर गृध्रैश च समभिद्रुतम
सूचीमुखैस तथा परेतैर विन्ध्यशैलॊपमैर वृतम"
18,2,21,"मेदॊ रुधिरयुक्तैश च छिन्नबाहूरुपाणिभिः
निकृत्तॊदर पादैश च तत्र तत्र परवेरितैः"
18,2,22,"स तत कुणप दुर्गन्धम अशिवं रॊमहर्षणम
जगाम राजा धर्मात्मा मध्ये बहु विचिन्तयन"
18,2,23,"ददर्शॊष्णॊदकैः पूर्णां नदीं चापि सुदुर्गमाम
असि पत्रवनं चैव निशितक्षुर संवृतम"
18,2,24,"करम्भ वालुकास तप्ता आयसीश च शिलाः पृथक
लॊहकुम्भीश च तैलस्य कवाथ्यमानाः समन्ततः"
18,2,25,"कूटशाल्मलिकं चापि दुस्पर्शं तिक्ष्ण कण्टकम
ददर्श चापि कौन्तेयॊ यातनाः पापकर्मिणाम"
18,2,26,"स तं दुर्गन्धम आलक्ष्य देवदूतम उवाच ह
कियद अध्वानम अस्माभिर गन्तव्यम इदम ईदृशम"
18,2,27,"कव च ते भरातरॊ मह्यं तन ममाख्यातुम अर्हसि
देशॊ ऽयं कश च देवानाम एतद इच्छामि वेदितुम"
18,2,28,"स संनिववृते शरुत्वा धर्मराजस्य भाषितम
देवदूतॊ ऽबरवीच चैनम एतावद गमनं तव"
18,2,29,"निवर्तितव्यं हि मया तथास्म्य उक्तॊ दिवौकसैः
यदि शरान्तॊ ऽसि राजेन्द्र तवम अथागन्तुम अर्हसि"
18,2,30,"युधिष्ठिरस तु निर्विण्णस तेन गन्धेन मूर्छितः
निवर्तने धृतमनाः पर्यावर्तत भारत"
18,2,31,"स संनिवृत्तॊ धर्मात्मा दुःखशॊकसमन्वितः
शुश्राव तत्र वदतां दीना वाचः समन्ततः"
18,2,32,"भॊ भॊ धर्मज राजर्षे पुण्याभिजन पाण्डव
अनुग्रहार्थम अस्माकं तिष्ठ तावन मुहूर्तकम"
18,2,33,"आयाति तवयि दुर्धर्षे वाति पुण्यः समीरणः
तव गन्धानुगस तात येनास्मान सुखम आगमत"
18,2,34,"ते वयं पार्थ दीर्घस्य कालस्य पुरुषर्षभ
सुखम आसादयिष्यामस तवां दृष्ट्वा राजसत्तम"
18,2,35,"संतिष्ठस्व महाबाहॊ मुहूर्तम अपि भारत
तवयि तिष्ठति कौरव्य यतनास्मान न बाधते"
18,2,36,"एवं बहुविधा वाचः कृपणा वेदनावताम
तस्मिन देशे स शुश्राव समन्ताद वदतां नृप"
18,2,37,"तेषां तद वचनं शरुत्वा दयावान दीनभाषिणाम
अहॊ कृच्छ्रम इति पराह तस्थौ स च युधिष्ठिरः"
18,2,38,"स ता गिरः पुरस्ताद वै शरुतपूर्वाः पुनः पुनः
गलानानां दुःखितानां च नाभ्यजानत पाण्डवः"
18,2,39,"अबुध्यमानस ता वाचॊ धर्मपुत्रॊ युधिष्ठिरः
उवाच के भवन्तॊ वै किमर्थम इह तिष्ठथ"
18,2,40,"इत्य उक्तास ते ततः सर्वे समन्ताद अवभाषिरे
कर्णॊ ऽहं भीमसेनॊ ऽहम अर्जुनॊ ऽहम इति परभॊ"
18,2,41,"नकुलः सहदेवॊ ऽहं धृष्टद्युम्नॊ ऽहम इत्य उत
दरौपदी दरौपदेयाश च इत्य एवं ते विचुक्रुशुः"
18,2,42,"ता वाचः सा तदा शरुत्वा तद देशसदृशीर नृप
ततॊ विममृशे राजा किं नव इदं दैवकारितम"
18,2,43,"किं नु तत कलुषं कर्मकृतम एभिर महात्मभिः
कर्णेन दरौपदेयैर वा पाञ्चाल्या वा सुमध्यया"
18,2,44,"य इमे पापगन्धे ऽसमिन देशे सन्ति सुदारुणे
न हि जानामि सर्वेषां दुष्कृतं पुण्यकर्मणाम"
18,2,45,"किं कृत्वा धृतराष्ट्रस्य पुत्रॊ राजसुयॊधनः
तथा शरिया युतः पापः सह सर्वैः पदानुगैः"
18,2,46,"महेन्द्र इव लक्ष्मीवान आस्ते परमपूजितः
कस्येदानीं विकारॊ ऽयं यद इमे नरकं गतः"
18,2,47,"सर्वधर्मविदः शूराः सत्यागम परायणाः
कषात्र धर्मपराः पराज्ञा यज्वानॊ भूरिदक्षिणाः"
18,2,48,"किं नु सुप्तॊ ऽसमि जागर्मि चेतयानॊ न चेतये
अहॊ चित्तविकारॊ ऽयं सयाद वा मे चित्तविभ्रमः"
18,2,49,"एवं बहुविधं राजा विममर्श युधिष्ठिरः
दुःखशॊकसमाविष्टश चिन्ताव्याकुलितेन्द्रियः"
18,2,50,"करॊधम आहारयच चैव तीव्रं धर्मसुतॊ नृपः
देवांश च गर्हयाम आस धर्मं चैव युधिष्ठिरः"
18,2,51,"स तीव्रगन्धसंतप्तॊ देवदूतम उवाच ह
गम्यतां भद्र येषां तवं दूतस तेषाम उपान्तिकम"
18,2,52,"न हय अहं तत्र यास्म्यामि सथितॊ ऽसमीति निवेद्यताम
मत संश्रयाद इमे दूत सुखिनॊ भरातरॊ हि मे"
18,2,53,"इत्य उक्तः स तदा दूतः पाण्डुपुत्रेण धीमता
जगाम तत्र यत्रास्ते देवराजः शतक्रतुः"
18,2,54,"निवेदयाम आस च तद धर्मराज चिकीर्षितम
यथॊक्तं धर्मपुत्रेण सर्वम एव जनाधिप"
18,3,1,"[वै]
सथिते मुहूर्तं पार्थे तु धर्मराजे युधिष्ठिरे
आजग्मुस तत्र कौरव्य देवाः शक्रपुरॊगमाः"
18,3,2,"सवयं विग्रहवान धर्मॊ राजानं परसमीक्षितुम
तत्राजगाम यत्रासौ कुरुराजॊ युधिष्ठिरः"
18,3,3,"तेषु भास्वरदेहेषु पुण्याभिजन कर्मसु
समागतेषु देवेषु वयगमत तत तमॊ नृप"
18,3,4,"नादृश्यन्त च तास तत्र यातनाः पापकर्मिणाम
नदी वैतरणी चैव कूटशाल्मलिना सह"
18,3,5,"लॊहकुम्भ्यः शिलाश चैव नादृश्यन्त भयानकाः
विकृतानि शरीराणि यानि तत्र समन्ततः
ददर्श राजा कौन्तेयस तान्य अदृश्यानि चाभवन"
18,3,6,"ततॊ वयुः सुखस्पर्शः पुण्यगन्धवहः शिवः
ववौ देवसमीपस्थः शीतलॊ ऽतीव भारत"
18,3,7,"मरुतः सह शक्रेण वसवश चाश्विनौ सह
साध्या रुद्रास तथादित्या ये चान्ये ऽपि दिवौकसः"
18,3,8,"सर्वे तत्र समाजग्मुः सिद्धाश च परमर्षयः
यत्र राजा महातेजा धर्मपुत्रः सथितॊ ऽभवत"
18,3,9,"ततः शक्रः सुरपतिः शरिया परमया युतः
युधिष्ठिरम उवाचेदं सान्त्वपूर्वम इदं वचः"
18,3,10,"युधिष्ठिर महाबाहॊ परीता देवगणास तव
एह्य एहि पुरुषव्याघ्र कृतम एतावता विभॊ
सिद्धिः पराप्ता तवया राजँल लॊकाश चाप्य अक्षयास तव"
18,3,11,"न च मन्युस तवया कार्यः शृणु चेदं वचॊ मम
अवश्यं नरकस तात दरष्टव्यः सर्वराजभिः"
18,3,12,"शुभानाम अशुभानां च दवौ राशीपुरुषर्षभ
यः पूर्वं सुकृतं भुङ्क्ते पश्चान निरयम एति सः
पूर्वं नरकभाग्यस तु पश्चात सवगम उपैति सः"
18,3,13,"भूयिष्ठं पापकर्मा यः स पूर्वं सवर्गम अश्नुते
तेन तवम एवं गमितॊ मया शरेयॊ ऽरथिना नृप"
18,3,14,"वयाजेन हि तवया दरॊण उपचीर्णः सुतं परति
वयाजेनैव ततॊ राजन दर्शितॊ नरकस तव"
18,3,15,"यथैव तवं तथा भीमस तथा पार्थॊ यमौ तथा
दरौपदी च तथा कृष्णा वयाजेन नरकं गताः"
18,3,16,"आगच्छ नरशार्दूल मुक्तास ते चैव किल्बिषात
सवपक्षाश चैव ये तुभ्यं पार्थिवा निहता रणे
सर्वे सवर्गम अनुप्राप्तास तान पश्य पुरुषर्षभ"
18,3,17,"कर्णश चैव महेष्वासः सर्वशस्त्रभृतां वरः
स गतः परमां सिद्धिं यदर्थं परितप्यसे"
18,3,18,"तं पश्य पुरुषव्याघ्रम आदित्यतनयं विभॊ
सवस्थानस्थं महाबाहॊ जहि शॊकं नरर्षभ"
18,3,19,"भरातॄंश चान्यांस तथा पश्य सवपक्षांश चैव पार्थिवान
सवं सवं सथानम अनुप्राप्तान वयेतु ते मानसॊ जवरः"
18,3,20,"अनुभूय पूर्वं तवं कृच्छ्रम इतः परभृति कौरव
विहरस्व मया सार्धं गतशॊकॊ निरामयः"
18,3,21,"कर्मणां तात पुण्यानां जितानां तपसा सवयम
दानानां च महाबाहॊ फलं पराप्नुहि पाण्डव"
18,3,22,"अद्य तवां देवगन्धर्वा दिव्याश चाप्सरसॊ दिवि
उपसेवन्तु कल्याणं विरजॊऽमबरवाससः"
18,3,23,"राजसूय जिताँल लॊकान अश्वमेधाभिवर्धितान
पराप्नुहि तवं महाबाहॊ तपसश च फलं महत"
18,3,24,"उपर्य उपरि राज्ञां हि तव लॊका युधिष्ठिर
हरिश्चन्द्र समाः पार्थ येषु तवं विहरिष्यसि"
18,3,25,"मान्धाता यत्र राजर्षिर यत्र राजा भगीरथः
दौःषन्तिर यत्र भरतस तत्र तवं विहरिष्यसि"
18,3,26,"एषा देव नदी पुण्या पर्थ तरैलॊक्यपावनी
आकाशगङ्गा राजेन्द्र तत्राप्लुत्य गमिष्यसि"
18,3,27,"अत्र सनातस्य ते भावॊ मानुषॊ विगमिष्यति
गतशॊकॊ निरायासॊ मुक्तवैरॊ भविष्यसि"
18,3,28,"एवं बरुवति देवेन्द्रे कौरवेन्द्रं युधिष्ठिरम
धर्मॊ विग्रहवान साक्षाद उवाच सुतम आत्मनः"
18,3,29,"भॊ भॊ राजन महाप्राज्ञ परीतॊ ऽसमि तव पुत्रक
मद्भक्त्या सत्यवाक्येन कषमया च दमेन च"
18,3,30,"एषा तृतीया जिज्ञास तव राजन कृता मया
न शक्यसे चालयितुं सवभावात पार्थ हेतुभिः"
18,3,31,"पूर्वं परीक्षितॊ हि तवम आसीर दवैतवनं परति
अरणी सहितस्यार्थे तच च निस्तीर्णवान असि"
18,3,32,"सॊदर्येषु विनष्टेषु दरौपद्यां तत्र भारत
शवरूपधारिणा पुत्र पुनस तवं मे परीक्षितः"
