Book No,Chapter No,Paragraph No,Paragraph Text
18,3,33,"इदं तृतीयं भरातॄणाम अर्थे यत सथातुम इच्छसि
विशुद्धॊ ऽसि महाभाग सुखी विगतकल्मषः"
18,3,34,"न च ते भरातरः पार्थ नरकस्था विशां पते
मायैषा देवराजेन महेन्द्रेण परयॊजिता"
18,3,35,"अवश्यं नरकस तात दरष्टव्यः सर्वराजभिः
ततस तवया पराप्तम इदं मुहूर्तं दुःखम उत्तमम"
18,3,36,"न सव्यसाची भीमॊ वा यमौ वा पुरुषर्षभौ
कर्णॊ वा सत्यवाक शूरॊ नरकार्हाश चिरं नृप"
18,3,37,"न कृष्णा राजपुत्री च नारकार्हा युधिष्ठिर
एह्य एहि भरतश्रेष्ठ पश्य गङ्गां तरिलॊकगाम"
18,3,38,"एवम उक्तः स राजर्षिस तव पूर्वपितामहः
जगाम सहधर्मेण सर्वैश च तरिदशालयैः"
18,3,39,"गङ्गां देव नदीं पुण्यां पावनीम ऋषिसंस्तुताम
अवगाह्य तु तां राजा तनुं तत्याज मानुषीम"
18,3,40,"ततॊ दिव्यवपुर भूत्वा धर्मराजॊ युधिष्ठिरः
निर्वैरॊ गतसंतापॊ जले तस्मिन समाप्लुतः"
18,3,41,"ततॊ ययौ वृतॊ देवैः कुरुराजॊ युधिष्ठिरः
धर्मेण सहितॊ धर्मान सतूयमानॊ महर्षिभिः"
18,4,1,"[वै]
ततॊ युधिष्ठिरॊ राजा देवैः सर्पि मरुद्गणैः
पूज्यमानॊ ययौ ततत्र यत्र ते कुरुपुंगवाः"
18,4,2,"ददर्श तत्र गॊविन्दं बराह्मेण वपुषान्वितम
तेनैव दृष्टपूर्वेण सादृश्येनॊपसूचितम"
18,4,3,"दीप्यमानं सववपुषा दिव्यैर अस्त्रैर उपस्थितम
चक्रप्रभृतिभिर घॊरैर दिव्यैः पुरुषविग्रहैः
उपास्यमानं वीरेण फल्गुनेन सुवर्चसा"
18,4,4,"अपरस्मिन्न अथॊद्देशे कर्णं शस्त्रभृतां वरम
दवादशादित्य सहितं ददर्श कुरुनन्दनः"
18,4,5,"अथापरस्मिन्न उद्देशे मरुद्गणवृतं परभुम
भीमसेनम अथापश्यत तेनैव वपुषान्वितम"
18,4,6,"अश्विनॊस तु तथा सथाने दीप्यमानौ सवतेजसा
नकुलं सहदेवं च ददर्श कुरुनन्दनः"
18,4,7,"तथा ददर्श पाञ्चालीं कमलॊत्पलमालिनीम
वपुषा सवर्गम आक्रम्य तिष्ठन्तीम अर्कवर्चसम"
18,4,8,"अथैनां सहसा राजा परष्टुम ऐच्छद युधिष्ठिरः
ततॊ ऽसय भगवान इन्द्रः कथयाम आस देवराट"
18,4,9,"शरीर एषा दरौपदी रूपा तवदर्थे मानुषं गता
अयॊनिजा लॊककान्ता पुण्यगन्धा युधिष्ठिर"
18,4,10,"दरुपदस्य कुले जाता भवद्भिश चॊपजीविता
रत्यर्थं भवतां हय एषा निमिता शूलपाणिना"
18,4,11,"एते पञ्च महाभागा गन्धर्वाः पावकप्रभाः
दरौपद्यास तनया राजन युष्माकम अमितौजसः"
18,4,12,"पश्य गन्धर्वराजानं धृतराष्ट्रं मनीषिणम
एनं च तवं विजानीहि भरातरं पूर्वजं पितुः"
18,4,13,"अयं ते पूर्वजॊ भराता कौन्तेयः पावकद्युतिः
सूर्यपुत्रॊ ऽगरजः शरेष्ठॊ राधेय इति विश्रुतः
आदित्यसहितॊ याति पश्यैनं पुरुषर्षभ"
18,4,14,"साध्यानाम अथ देवानां वसूनां मरुताम अपि
गणेषु पश्य राजेन्द्र वृष्ण्यन्धकमहारथान
सात्यकिप्रमुखान वीरान भॊजांश चैव महारथान"
18,4,15,"सॊमेन सहितं पश्य सौभद्रम अपराजितम
अभिमन्युं महेष्वासं निशाकरसमद्युतिम"
18,4,16,"एष पाण्डुर महेष्वासः कुन्त्या माद्र्या च संगतः
विमानेन सदाभ्येति पिता तव ममान्तिकम"
18,4,17,"वसुभिः सहितं पश्य भीष्मं शांतनवं नृपम
दरॊणं बृहस्पतेः पार्श्वे गुरुम एनं निशामय"
18,4,18,"एते चान्ये महीपाला यॊधास तव च पाण्डव
गन्धर्वैः सहिता यान्ति यक्षैः पुण्यजनैस तथा"
18,4,19,"गुह्यकानां गतिं चापि के चित पराप्ता नृसत्तमाः
तयक्त्वा देहं जितस्वर्गाः पुण्यवाग बुद्धिकर्मभिः"
18,5,1,"[ज]
भीष्मद्रॊणौ महात्मानौ धृतराष्ट्रश च पार्थिवः
विराटद्रुपदौ चॊभौ शङ्खश चैवॊत्तरस तथा"
18,5,2,"धृष्टकेतुर जयत्सेनॊ राजा चैव स सत्यजित
दुर्यॊधन सुताश चैव शकुनिश चैव सौबलः"
18,5,3,"कर्ण पुत्राश च विक्रान्ता राजा चैव जयद्रथः
घटॊत्चकादयश चैव ये चान्ये नानुकीर्तिताः"
18,5,4,"ये चान्ये कीर्तितास तत्र राजानॊ दीप्तमूर्तयः
सवर्गे कालं कियन्तं ते तस्थुस तद अपि शंस मे"
18,5,5,"आहॊस्विच छाश्वतं सथानं तेषां तत्र दविजॊत्तम
अन्ये वा कर्मणः कां ते गतिं पराप्ता नरर्षभाः
एतद इच्छाम्य अहं शरॊतुं परॊच्यमानं तवया दविज"
18,5,6,"[सूत]
इत्य उक्तः स तु विप्रर्षिर अनुज्ञातॊ महात्मना 
वयासेन तस्य नृपतेर आख्यातुम उपचक्रमे"
18,5,7,"[वै]
गन्तव्यं कर्मणाम अन्ते सर्वेण मनुजाधिप
शृणु गुह्यम इदं राजन देवानां भरतर्षभ
यद उवाच महातेजा दिव्यचक्षुः परतापवान"
18,5,8,"मुनिः पुराणः कौरव्य पाराशर्यॊ महाव्रतः
अगाध बुद्धिः सर्वज्ञॊ गतिज्ञः सर्वकर्मणाम"
18,5,9,"वसून एव महातेजा भीष्मः पराप महाद्युतिः
अष्टाव एव हि दृश्यन्ते वसवॊ भरतर्षभ"
18,5,10,"बृहस्पतिं विवेशाथ दरॊणॊ हय अङ्गिरसां वरम
कृतवर्मा तु हार्दिक्यः परविवेश मरुद्गणम"
18,5,11,"सनत कुमारं परद्युम्नः परविवेश यथागतम
धृतराष्ट्रॊ धनेशस्य लॊकान पराप दुरासदान"
18,5,12,"धृतराष्ट्रेण सहिता गान्धारी च यशस्विनी
पत्नीभ्यां सहितः पाण्डुर महेन्द्र सदनं ययौ"
18,5,13,"विराटद्रुपदौ चॊभौ धृष्टकेतुश च पार्थिव
निशठाक्रूर साम्बाश च भानुः कम्पॊ विडूरथः"
18,5,14,"भूरिश्रवाः शलश चैव भूरिश च पृथिवीपतिः
उग्रसेनस तथा कंसॊ वसुदेवश च वीर्यवान"
18,5,15,"उत्तरश च सह भरात्रा शङ्खेन नरपुंगवः
विश्वेषां देवतानां ते विविशुर नरसत्तमाः"
18,5,16,"वर्चा नाम महातेजाः सॊमपुत्रः परतापवान
सॊ ऽभिमन्युर नृसिंहस्य फल्गुनस्य सुतॊ ऽभवत"
18,5,17,"स युद्ध्वा कषत्रधर्मेण यथा नान्यः पुमान कव चित
विवेश सॊमं धर्मात्मा कर्मणॊ ऽनते महारथः"
18,5,18,"आविवेश रविं कर्णः पितरं पुरुषर्षभ
दवापरं शकुनिः पराप धृष्टद्युम्नस तु पावकम"
18,5,19,"धृतराष्ट्रात्मजाः सर्वे यातुधाना बलॊत्कटाः
ऋद्धिमन्तॊ महात्मानः शस्त्रपूता दिवं गताः
धर्मम एवाविशत कषत्ता राजा चैव युधिष्ठिरः"
18,5,20,"अनन्तॊ भगवान देवः परविवेश रसातलम
पितामह नियॊगाद धि यॊ यॊगाद गाम अधारयत"
18,5,21,"षॊडश सत्रीसहस्राणि वासुदेव परिग्रहः
नयमज्जन्त सरस्वत्यां कालेन जनमेजय
ताश चाप्य अप्सरसॊ भूत्वा वासुदेवम उपागमन"
18,5,22,"हतास तस्मिन महायुद्धे ये वीरास तु महारथाः
घटॊत्कचादयः सर्वे देवान यक्षांश च भेजिरे"
18,5,23,"दुर्यॊधन सहायाश च राक्षसाः परिकीर्तिताः
पराप्तास ते करमशॊ राजन सर्वलॊकान अनुत्तमान"
18,5,24,"भवनं च महेन्द्रस्य कुबेरस्य च धीमतः
वरुणस्य तथा लॊकान विविशुः पुरुषर्षभाः"
18,5,25,"एतत ते सर्वम आख्यातं विस्तरेण महाद्युते
कुरूणां चरितं कृत्स्नं पाण्डवानां च भारत"
18,5,26,"[सूत]
एतच छरुत्वा दविजश्रेष्ठात स राजा जनमेजयः
विस्मितॊ ऽभवद अत्यर्थं यज्ञकर्मान्तरेष्व अथ"
18,5,27,"ततः समापयाम आसुः कर्म तत तस्य याजकाः
आस्तीकश चाभवत परीतः परिमॊक्ष्य भुजंगमान"
18,5,28,"ततॊ दविजातीन सर्वांस तान दक्षिणाभिर अतॊषयत
पूजिताश चापि ते राज्ञा ततॊ जग्मुर यथागतम"
18,5,29,"विसर्जयित्वा विप्रांस तान राजापि जनमेजयः
ततस तक्षशिलायाः स पुनर आयाद गजाह्वयम"
18,5,30,"एतत ते सर्वम आख्यातं वैशम्पायन कीर्तितम
वयासाज्ञया समाख्यातं सर्पसत्त्रे नृपस्य ह"
18,5,31,"पुण्यॊ ऽयम इतिहासाख्यः पवित्रं चेदम उत्तमम
कृष्णेन मुनिना विप्र नियतं सत्यवादिना"
18,5,32,"सर्वज्ञेन विधिज्ञेन धर्मज्ञानवता सता
अतीन्द्रियेण शुचिना तपसा भावितात्मना"
18,5,33,"ऐश्वर्ये वर्तता चैव सांख्ययॊगविदा तथा
नैकतन्त्र विबुद्धेन दृष्ट्वा दिव्येन चक्षुषा"
18,5,34,"कीर्तिं परथयता लॊके पाण्डवानां महात्मनाम
अन्येषां कषत्रियाणां च भूरि दरविण तेजसाम"
18,5,35,"य इदं शरावयेद विद्वान सदा पर्वणि पर्वणि
धूतपाप्मा जितस्वर्गॊ बरह्मभूयाय गच्छति"
18,5,36,"यश चेदं शरावयेच छराद्धे बराह्मणान पादम अन्ततः
अक्षय्यम अन्नपानं वै पितॄंस तस्यॊपतिष्ठते"
18,5,37,"अह्ना यद एनः कुरुते इन्द्रियैर मनसापि वा
महाभारतम आख्याय पश्चात संध्यां परमुच्यते"
18,5,38,"धर्मे चार्थे च कामे च मॊक्षे च भरतर्षभ
यद इहास्ति तद अन्यत्र यन नेहास्ति न तत कव चित"
18,5,39,"यजॊ नामेतिहासॊ ऽयं शरॊतव्यॊ भूतिम इच्छता
रज्ञा राजसुतैश चापि गर्भिण्या चैव यॊषिता"
18,5,40,"सवर्गकामॊ लभेत सवर्गं जय कामॊ लभेज जयम
गर्भिणी लभते पुत्रं कन्यां वा बहु भागिनीम"
18,5,41,"अनागतं तरिभिर वर्षैः कृष्णद्वैपायनः परभुः
संदर्भं भारतस्यास्य कृतवान धर्मकाम्यया"
18,5,42,"नारदॊ ऽशरावयद देवान असितॊ देवलः पितॄन
रक्षॊयक्षाञ शुकॊ मर्त्यान वैशम्पायन एव तु"
18,5,43,"इतिहासम इमं पुण्यं महार्थं वेद संमितम
शरावयेद यस तु वर्णांस तरीन कृत्वा बराह्मणम अग्रतः"
18,5,44,"स नरः पापनिर्मुक्तः कीरितं पराप्येह शौनक
गच्छेत परमिकां सिद्धिम अत्र मे नास्ति संशयः"
18,5,45,"भारताध्ययनात पुण्याद अपि पादम अधीयतः
शरद्दधानस्य पूयन्ते सर्वपापान्य अशेषतः"
18,5,46,"महर्षिर भगवान वयासः कृत्वेमां संहितां पुरा
शलॊकैश चतुर्भिर भगवान पुत्रम अध्यापयच छुकम"
18,5,47,"माता पितृसहस्राणि पुत्रदारशतानि च
संसारेष्व अनुभूतानि यान्ति यास्यन्ति चापरे"
18,5,48,"हर्षस्थान सहस्राणि भयस्थान शतानि च
दिवसे दिवसे मूढम आविशन्ति न पण्डितम"
18,5,49,"ऊर्ध्वबाहुर विरौम्य एष न च कश चिच छृणॊति मे
धर्माद अर्थश च कामश च स किमर्थं न सेव्यते"
18,5,50,"न जातु कामान न भयान न लॊभाद; धर्मं तयजेज जीवितस्यापि हेतॊः
नित्यॊ धर्मः सुखदुःखे तव अनित्ये; जीवॊ नित्यॊ हेतुर अस्य तव अनित्यः"
18,5,51,"इमां भारत सावित्रीं परातर उत्थाय यः पठेत
स भारत फलं पराप्य परं बरह्माधिगच्छति"
18,5,52,"यथा समुद्रॊ भगवान यथा च हिमवान गिरिः
खयाताव उभौ रत्ननिधी तथा भारतम उच्यते"
18,5,53,"महाभारतम आख्यानं यः पठेत सुसमाहितः
स गच्छेत परमां सिद्धिम इति मे नास्ति संशयः"
18,5,54,"दवैपायनॊष्ठपुटनिःसृतम अप्रमेयं; पुण्यं पवित्रम अथ पापहरं शिवं च
यॊ भारतं समधिगच्छति वाच्यमानं; किं तस्य पुष्करजलैर अभिषेचनेन"
