Book No,Chapter No,Paragraph No,Paragraph Text
14,48,11,"तथैवैकत्व नानात्वम इष्यते विदुषां नयः
मशकॊदुम्बरे तव ऐक्यं पृथक्त्वम अपि दृश्यते"
14,48,12,"मत्स्यॊ यथान्यः सयाद अप्सु संप्रयॊगस तथानयॊः
संबन्धस तॊयबिन्दूनां पर्णे कॊक नदस्य च"
14,48,13,"[गुरु]
इत्य उक्तवन्तं ते विप्रास तदा लॊकपितामहम
पुनः संशयम आपन्नाः पप्रच्छुर दविजसत्तमाः"
14,48,14,"[रसयह]
किंश चिद एवेह धर्माणाम अनुष्ठेयतमं समृतम
वयाहताम इव पश्यामॊ धर्मस्य विविधां गतिम"
14,48,15,"ऊर्ध्वं देहाद वदन्त्य एके नैतद अस्तीति चापरे
के चित संशयितं सर्वं निःसंशयम अथापरे"
14,48,16,"अनित्यं नित्यम इत्य एके नास्त्य अस्त्य इत्य अपि चापरे
एकरूपं दविधेत्य एके वयामिश्रम इति चापरे
एकम एके पृथक चान्ये बहुत्वम इति चापरे"
14,48,17,"मन्यन्ते बराह्मणा एवं पराज्ञास तत्त्वार्थ दर्शिनः
जटाजिनधराश चान्ये मुण्डाः के चिद असंवृताः"
14,48,18,"अस्नानं के चिद इच्छन्ति सनानम इत्य अपि चापरे
आहारं के चिद इच्छन्ति के चिच चानशने रताः"
14,48,19,"कर्म के चित परशंसन्ति परशान्तम अपि चापरे
देशकालाव उभौ के चिन नैतद अस्तीति चापरे
के चिन मॊक्षं परशंसन्ति के चिद भॊगान पृथग्विधान"
14,48,20,"धनानि के चिद इच्छन्ति निर्धनत्वं तथापरे
उपास्य साधनं तव एके नैतद अस्तीति चापरे"
14,48,21,"अहिंसा निरताश चान्ये केचिद धिंसा परायणाः
पुण्येन यशसेत्य एके नैतद अस्तीति चापरे"
14,48,22,"सद्भावनिरताश चान्ये के चित संशयिते सथिताः
दुःखाद अन्ये सुखाद अन्ये धयानम इत्य अपरे सथिताः"
14,48,23,"यज्ञम इत्य अपरे धीराः परदानम इति चापरे
सर्वम एके परशंसन्ति न सर्वम इति चापरे"
14,48,24,"तपस तव अन्ये परशंसन्ति सवाध्यायम अपरे जनाः
जञानं संन्यासम इत्य एके सवभावं भूतचिन्तकाः"
14,48,25,"एवं वयुत्थापिते धर्मे बहुधा विप्रधावति
निश्चयं नाधिगच्छामः संमूढाः सुरसत्तम"
14,48,26,"इदं शरेय इदं शरेय इत्य एवं परस्थितॊ जनः
यॊ हि यस्मिन रतॊ धर्मे स तं पूजयते सदा"
14,48,27,"तत्र नॊ विहता परज्ञा मनश च बहुलीकृतम
एतद आख्यातुम इच्छामः शरेयः किम इति सत्तम"
14,48,28,"अतः परं च यद गुह्यं तद भवान वक्तुम अर्हति
सत्त्वक्षत्रज्ञयॊश चैव संबन्धः केन हेतुना"
14,48,29,"एवम उक्तः स तैर विप्रैर भगवाँल लॊकभावनः
तेभ्यः शशंस धर्मात्मा याथा तथ्येन बुद्धिमान"
14,49,1,"[बर]
हन्त वः संप्रवक्ष्यामि यन मां पृच्छथ सत्तमाः
समस्तम इह तच छरुत्वा सम्यग एवावधार्यताम"
14,49,2,"अहिंसा सर्वभूतानाम एतत कृत्यतमं मतम
एतत पदम अनुद्विग्नं वरिष्ठं धर्मलक्षणम"
14,49,3,"जञानं निःश्रेय इत्य आहुर वृद्धा निश्चयदर्शिनः
तस्माज जञानेन शुद्धेन मुच्यते सर्वपातकैः"
14,49,4,"हिंसा पराश च ये लॊके ये च नास्तिक वृत्तयः
लॊभमॊहसमायुक्तास ते वै निरयगामिनः"
14,49,5,"आशीर युक्तानि कर्माणि कुर्वते य तव अतन्द्रिताः
ते ऽसमिँल लॊके परमॊदन्ते जायमानाः पुनः पुनः"
14,49,6,"कुर्वते ये तु कर्माणि शरद्दधाना विपश्चितः
अनाशीर यॊगसंयुक्तास ते धीराः साधु दर्शिनः"
14,49,7,"अतः परं परवक्ष्यामि सत्त्वक्षेत्रज्ञयॊर यथा
संयॊगॊ विप्रयॊगश च तन निबॊधत सत्तमाः"
14,49,8,"विषयॊ विषयित्वं च संबन्धॊ ऽयम इहॊच्यते
विषयी पुरुषॊ नित्यं सत्त्वं च विषयः समृतः"
14,49,9,"वयाख्यातं पूर्वकल्पेन मशकॊदुम्बरं यथा
भुज्यमानं न जानीते नित्यं सत्त्वम अचेतनम
यस तव एव तु विजानीते यॊ भुङ्क्ते यश च भुज्यते"
14,49,10,"अनित्यं दवंद्व संयुक्तं सत्त्वम आहुर गुणात्मकम
निर्द्वंद्वॊ निष्कलॊ नित्यः कषेत्रज्ञॊ निर्गुणात्मकः"
14,49,11,"समः संज्ञा गतस तव एवं यदा सर्वत्र दृश्यते
उपभुङ्क्ते सदा सत्त्वम आपः पुष्करपर्णवत"
14,49,12,"सर्वैर अपि गुणैर विद्वान वयतिषक्तॊ न लिप्यते
जलबिन्दुर यथा लॊलः पद्मिनी पत्रसंस्थितः
एवम एवाप्य असंसक्तः पुरुषः सयान न संशयः"
14,49,13,"दरव्यमात्रम अभूत सत्त्वं पुरुषस्येति निश्चयः
यथा दरव्यं च कर्ता च संयॊगॊ ऽपय अनयॊस तथा"
14,49,14,"यथा परदीपम आदाय कश चित तमसि गच्छति
तथा सत्त्वप्रदीपेन गच्छन्ति परमैषिणः"
14,49,15,"यावद दरव्यगुणस तावत परदीपः संप्रकाशते
कषीणद्रव्यगुणं जयॊतिर अन्तर्धानाय गच्छति"
14,49,16,"वयक्तः सत्त्वगुणस तव एवं पुरुषॊ ऽवयक्त इष्यते
एतद विप्रा विजानीत हन्त भूयॊ बरवीमि वः"
14,49,17,"सहस्रेणापि दुर्मेधा न वृद्धिम अधिगच्छति
चतुर्थेनाप्य अथांशेन वृद्धिमान सुखम एधते"
14,49,18,"एवं धर्मस्य विज्ञेयं संसाधनम उपायतः
उपायज्ञॊ हि मेधावी सुखम अत्यन्तम अश्नुते"
14,49,19,"यथाध्वानम अपाथेयः परपन्नॊ मानवः कव चित
कलेशेन याति महता विनश्यत्य अन्तरापि वा"
14,49,20,"तथा कर्मसु विज्ञेयं फलं भवति वा न वा
पुरुषस्यात्म निःश्रेयः शुभाशुभनिदर्शनम"
14,49,21,"यथा च दीर्घम अध्वानं पद्भ्याम एव परपद्यते
अदृष्टपूर्वं सहसा तत्त्वदर्शनवर्जितः"
14,49,22,"तम एव च यथाध्वानं रथेनेहाशु गामिना
यायाद अश्वप्रयुक्तेन तथा बुद्धिमतां गतिः"
14,49,23,"उच्चं पर्वतम आरुह्य नान्ववेक्षेत भूगतम
रथेन रथिनं पश्येत कलिश्यमानम अचेतनम"
14,49,24,"यावद रथपथस तावद रथेन स तु गच्छति
कषीणे रथपथे पराज्ञॊ रथम उत्सृज्य गच्छति"
14,49,25,"एवं गच्छति मेधावी तत्त्वयॊगविधानवित
समाज्ञाय महाबुद्धिर उत्तराद उत्तरॊत्तरम"
14,49,26,"यथा महार्णवं घॊरम अप्लवः संप्रगाहते
बाहुभ्याम एव संमॊहाद वधं चर्च्छत्य असंशयम"
14,49,27,"नावा चापि यथा पराज्ञॊ विभागज्ञस तरित्रया
अक्लान्तः सलिलं गाहेत कषिप्रं संतरति धरुवम"
14,49,28,"तीर्णॊ गच्छेत परं पारं नावम उत्सृज्य निर्ममः
वयाख्यातं पूर्वकल्पेन यथा रथि पदातिनौ"
14,49,29,"सनेहात संमॊहम आपन्नॊ नावि दाशॊ यथातथा
ममत्वेनाभिभूतः स तत्रैव परिवर्तते"
14,49,30,"नावं न शक्यम आरुह्य सथले विपरिवर्तितुम
तथैव रथम आरुह्य नाप्सु चर्या विधीयते"
14,49,31,"एवं कर्मकृतं चित्रं विषयस्थं पृथक पृथक
यथा कर्मकृतं लॊके तथा तद उपपद्यते"
14,49,32,"यन नैव गन्धिनॊ रस्यं न रूपस्पर्श शब्दवत
मन्यन्ते मुनयॊ बुद्ध्या तत परधानं परचक्षते"
14,49,33,"तत्र परधानम अव्यक्तम अव्यक्तस्य गुणॊ महान
महतः परधानभूतस्य गुणॊ ऽहंकार एव च"
14,49,34,"अहंकारप्रधानस्य महाभूतकृतॊ गुणः
पृथक्त्वेन हि भूतानां विषया वै गुणाः समृताः"
14,49,35,"बीजधर्मं यथाव्यक्तं तथैव परसवात्मकम
बीजधर्मा महान आत्मा परसवश चेति नः शरुतम"
14,49,36,"बीजधर्मा तव अहंकारः परसवश च पुनः पुनः
बीजप्रसव धर्माणि महाभूतानि पञ्च वै"
14,49,37,"बीजधर्मिण इत्य आहुः परसवं च न कुर्वते
विशेषाः पञ्च भूतानां तेषां वित्तं विशेषणम"
14,49,38,"तत्रैकगुणम आकाशं दविगुणॊ वायुर उच्यते
तरिगुणं जयॊतिर इत्य आहुर आपश चापि चतुर्गुणः"
14,49,39,"पृथ्वी पञ्च गुणा जञेया तरस सथावरसंकुला
सर्वभूतकरी देवी शुभाशुभनिदर्शना"
14,49,40,"शब्दः सपर्शस तथारूपं रसॊ गन्धश च पञ्चमः
एते पञ्च गुणा भूमेर विज्ञेया दविजसत्तमाः"
14,49,41,"पार्थिवश च सदा गन्धॊ गन्धश च बहुधा समृतः
तस्य गन्धस्य वक्ष्यामि विस्तरेण बहून गुणान"
14,49,42,"इष्टश चानिष्ट गन्धश च मधुरॊ ऽमलः कटुस तथा
निर्हारी संहतः सनिग्धॊ रूक्षॊ विशद एव च
एवं दशविधॊ जञेयः पार्थिवॊ गन्ध इत्य उत"
14,49,43,"शब्दः सपर्शस तथारूपं रसश चापां गुणाः समृताः
रसज्ञानं तु वक्ष्यामि रसस तु बहुधा समृतः"
14,49,44,"मधुरॊ ऽमलः कटुस तिक्तः कषायॊ लवणस तथा
एवं षड विधविस्तारॊ रसॊ वारिमयः समृतः"
14,49,45,"शब्दः सपर्शस तथारूपं तरिगुणं जयॊतिर उच्यते
जयॊतिषश च गुणॊ रूपं रूपं च बहुधा समृतम"
14,49,46,"शुक्लं कृष्णं तथा रक्तं नीलं पीतारुणं तथा
हरस्वं दीर्घं तथा सथूलं चतुरस्राणु वृत्तकम"
14,49,47,"एवं दवादश विस्तारं तेजसॊ रूपम उच्यते
विज्ञेयं बराह्मणैर नित्यं धर्मज्ञैः सत्यवादिभिः"
14,49,48,"शब्दस्पर्शौ च विज्ञेयौ दविगुणॊ वायुर उच्यते
वायॊश चापि गुणः सपर्शः सपर्शश च बहुधा समृतः"
14,49,49,"उष्णः शीतः सुखॊ दुःखः सनिग्धॊ विशद एव च
कठिनश चिक्कणः शलक्ष्णः पिच्छिलॊ दारुणॊ मृदुः"
14,49,50,"एवं दवादश विस्तारॊ वायव्यॊ गुण उच्यते
विधिवद बरह्मणैः सिद्धैर धर्मज्ञैस तत्त्वदर्शिभिः"
14,49,51,"तत्रैकगुणम आकाशं शब्द इत्य एव च समृतः
तस्य शब्दस्य वक्ष्यामि विस्तरेण बहून गुणान"
14,49,52,"षड्जर्षभौ च गान्धारॊ मध्यमः पञ्चमस तथा
अतः परं तु विज्ञेयॊ निषादॊ धैवतस तथा"
14,49,53,"इष्टॊ ऽनिष्टश च शब्दस तु संहतः परविभागवान
एवं बहुविधॊ जञेयः शब्द आकाशसंभवः"
14,49,54,"आकाशम उत्तमं भूतम अहंकारस ततः परम
अहंकारात परा बुद्धिर बुद्धेर आत्मा ततः परम"
14,49,55,"तस्मात तु परम अव्यक्तम अव्यक्तात पुरुषः परः
परावरज्ञॊ भूतानां यं पराप्यानन्त्यम अश्नुते"
14,50,1,"[बर]
भूतानाम अथ पञ्चानां यथैषाम ईश्वरं मनः
नियमे च विसर्गे च भूतात्मा मन एव च"
14,50,2,"अधिष्ठाता मनॊ नित्यं भूतानां महतां तथा
बुद्धिर ऐश्वर्यम आचष्टे कषेत्रज्ञः सर्व उच्यते"
14,50,3,"इन्द्रियाणि मनॊ युङ्क्ते सदश्वान इव सारथिः
इन्द्रियाणि मनॊ बुद्धिं कषेत्रज्ञॊ युञ्जते सदा"
14,50,4,"महाभूतसमायुक्तं बुद्धिसंयमनं रथम
तम आरुह्य स भूतात्मा समन्तात परिधावति"
14,50,5,"इन्द्रियग्रामसंयुक्तॊ मनः सारथिर एव च
बुद्धिसंयमनॊ नित्यं महान बरह्ममयॊ रथ"
14,50,6,"एवं यॊ वेत्ति विद्वान वै सदा बरह्ममयं रथम
स धीरः सर्वलॊकेषु न मॊहम अधिगच्छति"
14,50,7,"अव्यक्तादि विशेषान्तं तरस सथावरसंकुलम
चन्द्रसूर्यप्रभालॊकं गरहनक्षत्रमण्डितम"
14,50,8,"नदी पर्वत जालैश च सर्वतः परिभूषितम
विविधाबिःस तथाद्भिश च सततं समलंकृतम"
14,50,9,"आजीवः सर्वभूतानां सर्वप्राणभृतां गतिः
एतद बरह्म वनं नित्यं यस्मिंश चरति कषेत्रवित"
14,50,10,"लॊके ऽसमिन यानि भूतानि सथावराणि चराणि च
तान्य एवाग्रे परलीयन्ते पश्चाद भूतकृता गुणाः
गुणेभ्यः पञ्च भूतानि एष भूतसमुच्छ्रयः"
14,50,11,"देवा मनुष्या गन्धर्वाः पिशाचासुरराक्षसाः
सर्वे सवभावतः सृष्टा न करियाभ्यॊ न कारणात"
14,50,12,"एते विश्वकृतॊ विप्रा जायन्ते ह पुनः पुनः
तेभ्यः परसूतास तेष्व एव महाभूतेषु पञ्चसु
परलीयन्ते यथाकालम ऊर्मयः सागरे यथा"
14,50,13,"विश्वसृग्भ्यस तु भूतेभ्यॊ महाभूतानि गच्छति
भूतेभ्यश चापि पञ्चभ्यॊ मुक्तॊ गच्छेत परजापतिम"
14,50,14,"परजापतिर इदं सर्वं तपसैवासृजत परभुः
तथैव वेदान ऋषयस तपसा परतिपेदिरे"
14,50,15,"तपसश चानुपूर्व्येण फलमूलाशिनस तथा
तरैलॊक्यं तपसा सिद्धाः पश्यन्तीह समाहिताः"
14,50,16,"ओषधान्य अगदादीनी नाना विद्याश च सर्वशः
तपसैव परसिध्यन्ति तपॊ मूलं हि साधनम"
14,50,17,"यद दुरापं दुराम्नायं दुराधर्षं दुरन्वयम
तत सर्वं तपसा साध्यं तपॊ हि दुरतिक्रमम"
14,50,18,"सुरापॊ बरह्महा सतेयी भरूणहा गुरुतल्पगः
तपसैव सुतप्तेन मुच्यन्ते किल्बिषात ततः"
14,50,19,"मनुष्याः पितरॊ देवाः पशवॊ मृगपक्षिणः
यानि चान्यानि भूतानि तरसानि सथावराणि च"
14,50,20,"तपः परायणा नित्यं सिध्यन्ते तपसा सदा
तथैव तपसा देवा महाभागा दिवं गताः"
14,50,21,"आशीर युक्तानि कर्माणि कुर्वते ये तव अतन्द्रिताः
अहंकारसमायुक्तास ते सकाशे परजापतेः"
14,50,22,"धयानयॊगेन शुद्धेन निर्ममा निरहंकृताः
पराप्नुवन्ति महात्मानॊ महान्तं लॊकम उत्तमम"
14,50,23,"धयानयॊगाद उपागम्य परसन्नमतयः सदा
सुखॊपचयम अव्यक्तं परविशन्त्य आत्मवत्तया"
14,50,24,"धयानयॊगाद उपागम्य निर्ममा निरहंकृताः
अव्यक्तं परविशन्तीह महान्तं लॊकम उत्तमम"
14,50,25,"अव्यक्ताद एव संभूतः समयज्ञॊ गतः पुनः
तमॊ रजॊभ्यां निर्मुक्तः सत्त्वम आस्थाय केवलम"
14,50,26,"विमुक्तः सर्वपापेभ्यः सर्वं तयजति निष्कलः
कषेत्रज्ञ इति तं विद्याद यस तं वेद स वेदवित"
14,50,27,"चित्तं चित्ताद उपागम्य मुनिर आसीत संयतः
यच चित्तस तन मना भूत्वा गुह्यम एतत सनातनम"
14,50,28,"अव्यक्तादि विशेषान्तम अविद्या लक्षणं समृतम
निबॊधत यथा हीदं गुणैर लक्षणम इत्य उत"
14,50,29,"दव्यक्षरस तु भवेन मृत्युस तर्यक्षरं बरह्म शाश्वतम
ममेति च भवेन मृत्युर न ममेति च शाश्वतम"
14,50,30,"कर्म के चित परशंसन्ति मन्दबुद्धितरा नराः
ये तु बुद्धा महात्मानॊ न परशंसन्ति कर्म ते"
14,50,31,"कर्मणा जायते जन्तुर मूर्तिमान षॊडशात्मकः
पुरुषं सृजते ऽविद्या अग्राह्यम अमृताशिनम"
14,50,32,"तस्मात कर्मसु निःस्नेहा ये के चित पारदर्शिनः
विद्यामयॊ ऽयं पुरुषॊ न तु कर्ममयः समृतः"
14,50,33,"अपूर्वम अमृतं नित्यं य एनम अविचारिणम
य एनं विन्दते ऽऽतमानम अग्राह्यम अमृताशिनम
अग्राह्यॊ ऽमृतॊ भवति य एभिः कारणैर धरुवः"
14,50,34,"अपॊह्य सर्वसंकल्पान संयम्यात्मानम आत्मनि
स तद बरह्म शुभं वेत्ति यस्माद भूयॊ न विद्यते"
14,50,35,"परसादेनैव सत्त्वस्य परसादं समवाप्नुयात
लक्षणं हि परसादस्य यथा सयात सवप्नदर्शनम"
