Book No,Chapter No,Paragraph No,Paragraph Text
4,1,1,"[ज]
कथं विराटनगरे मम पूर्वपितामहाः
अज्ञातवासम उषिता दुर्यॊधन भयार्दिताः"
4,1,2,"तथा तु स वराँल लब्ध्वा धर्माधर्मभृतां वरः
गत्वाश्रमं बराह्मणेभ्य आचख्यौ सर्वम एव तत"
4,1,3,"कथयित्वा तु तत सर्वं बराह्मणेभ्यॊ युधिष्ठिरः
अरणी सहितं तस्मै बराह्मणाय नयवेदयत"
4,1,4,"ततॊ युधिष्ठिरॊ राजा धर्मपुत्रॊ महामनाः
संनिवर्त्यानुजान सर्वान इति हॊवाच भारत"
4,1,5,"दवादशेमानि वर्षाणि राष्ट्राद विप्रॊषिता वयम
तरयॊदशॊ ऽयं संप्राप्तः कृच्छ्रः परमदुर्वसः"
4,1,6,"स साधु कौन्तेय इतॊ वासम अर्जुन रॊचय
यत्रेमा वसतीः सर्वा वसेमाविदिताः परैः"
4,1,7,"तस्यैव वरदानेन धर्मस्य मनुजाधिप
अज्ञाता विचरिष्यामॊ नराणा भरतर्षभ"
4,1,8,"किं तु वासाय राष्ट्राणि कीर्तयिष्यामि कानि चित
रमणीयानि गुप्तानि तेषां किं चित सम रॊचय"
4,1,9,"सन्ति रम्या जनपदा बह्व अन्नाः परितः कुरून
पाञ्चालाश चेदिमत्स्याश च शूरसेनाः पटच्चराः
दशार्णा नव राष्ट्रं च मल्लाः शाल्व युगंधराः"
4,1,10,"एतेषां कतमॊ राजन निवासस तव रॊचते
वत्स्यामॊ यत्र राजेन्द्र संवत्सरम इमं वयम"
4,1,11,"एवम एतन महाबाहॊ यथा स भगवान परभुः
अब्रवीत सर्वभूतेशस तत तथा न तद अन्यथा"
4,1,12,"अवश्यं तव एव वासार्थं रमणीयं शिवं सुखम
संमन्त्र्य सहितैः सर्वैर दरष्टव्यम अकुतॊभयम"
4,1,13,"मत्स्यॊ विराटॊ बलवान अभिरक्षेत स पाण्डवान
धर्मशीलॊ वदान्यश च वृद्धश च सुमहाधनः"
4,1,14,"विराटनगरे तात संवत्सरम इमं वयम
कुर्वन्तस तस्य कर्माणि विहरिष्याम भारत"
4,1,15,"यानि यानि च कर्माणि तस्य शक्ष्यामहे वयम
कर्तुं यॊ यत स तत कर्म बरवीतु कुरुनन्दनाः"
4,1,16,"नरदेव कथं कर्म राष्ट्रे तस्य करिष्यसि
विराट नृपतेः साधॊ रंस्यसे केन कर्मणा"
4,1,17,"मृदुर वदान्यॊ हरीमांश च धार्मिकः सत्यविक्रमः
राजंस तवम आपदा कलिष्टः किं करिष्यसि पाण्डव"
4,1,18,"न दुःखम उचितं किं चिद राजन वेद यथा जनः
स इमाम आपदं पराप्य कथं घॊरां तरिष्यसि"
4,1,19,"शृणुध्वं यत करिष्यामि कर्म वै कुरुनन्दनाः
विराटम अनुसंप्राप्य राजानं पुरुषर्षभम"
4,1,20,"सभास्तारॊ भविष्यामि तस्य राज्ञॊ महात्मनः
कङ्कॊ नाम दविजॊ भूत्वा मताक्षः परिय देविता"
4,1,21,"वैडूर्यान काञ्चनान दान्तान फलैर जयॊती रसैः सह
कृष्णाक्षाँल लॊहिताक्षांश च निर्वर्त्स्यामि मनॊरमान"
4,1,22,"आसं युधिष्ठिरस्याहं पुरा पराणसमः सखा
इति वक्ष्यामि राजानं यदि माम अनुयॊक्ष्यते"
4,1,23,"इत्य एतद वॊ मयाख्यातं विहरिष्याम्य अहं यथा
वृकॊदर विराटे तवं रंस्यसे केन कर्मणा"
4,2,1,"[भम]
पौरॊगवॊ बरुवाणॊ ऽहं बल्लवॊ नाम नामतः
उपस्थास्यामि राजानं विराटम इति मे मतिः"
4,2,2,"सूपानस्य करिष्यामि कुशलॊ ऽसमि महानसे
कृतपूर्वाणि यैर अस्य वयञ्जनानि सुशिक्षितैः
तान अप्य अभिभविष्यामि परीतिं संजनयन्न अहम"
4,2,3,"आहरिष्यामि दारूणां निचयान महतॊ ऽपि च
तत परेक्ष्य विपुलं कर्म राजा परीतॊ भविष्यति"
4,2,4,"दविपा वा बलिनॊ राजन वृषभा वा महाबलाः
विनिग्राह्या यदि मया निग्रहीष्यामि तान अपि"
4,2,5,"ये च के चिन नियॊत्स्यन्ति समाजेषु नियॊधकाः
तान अहं निहनिष्यामि परीतिं तस्य विवर्धयन"
4,2,6,"न तव एतान युध्यमानां वै हनिष्यामि कथं चन
तथैतान पातयिष्यामि यथा यास्यन्ति न कषयम"
4,2,7,"आरालिकॊ गॊविकर्ता सूपकर्ता नियॊधकः
आसं युधिष्ठिरस्याहम इति वक्ष्यामि पृच्छतः"
4,2,8,"आत्मानम आत्मना रक्षंश चरिष्यामि विशां पते
इत्य एतत परतिजानामि विहरिष्याम्य अहं यथा"
4,2,9,"यम अग्निर बराह्मणॊ भूत्वा समागच्छन नृणां वरम
दिधक्षुः खाण्डवं दावं दाशार्ह सहितं पुरा"
4,2,10,"महाबलं महाबाहुम अजितं कुरुनन्दनम
सॊ ऽयं किं कर्म कौन्तेयः करिष्यति धनंजयः"
4,2,11,"यॊ ऽयम आसाद्य तं तावं तर्पयाम आस पावकम
विजित्यैक रथेनेन्द्रं हत्वा पन्नगरक्षसान
शरेष्ठः परतियुधां नाम सॊ ऽरजुनः किं करिष्यति"
4,2,12,"सूर्यः परपततां शरेष्ठॊ दविपदां बराह्मणॊ वरः
आशीविषश च सर्पाणाम अग्निस तेजस्विनां वरः"
4,2,13,"आयुधानां वरॊ वर्जः ककुद्मी च गवां वरः
हरदानाम उदधिः शरेष्ठः पर्जन्यॊ वर्षतां वरः"
4,2,14,"धृतराष्ट्रश च नागानां हस्तिष्व ऐरावतॊ वरः
पुत्रः परियाणाम अधिकॊ भार्या च सुहृदां वरा"
4,2,15,"यथैतानि विशिष्टानि जात्यां जात्यां वृकॊदर
एवं युवा गुडाकेशः शरेष्ठः सर्वधनुर्मताम"
4,2,16,"सॊ ऽयम इन्द्राद अनवरॊ वासुदेवाच च भारत
गाण्डीवधन्वा शवेताश्वॊ बीभत्सुः किं करिष्यति"
4,2,17,"उषित्वा पञ्चवर्षाणि सहस्राक्षस्य वेश्मनि
दिव्यान्य अस्त्राण्य अवाप्तानि देवरूपेण भास्वता"
4,2,18,"यं मन्ये दवादशं रुद्रम आदित्यानां तरयॊदशम
यस्य बाहू समौ दीर्घौ जया घातकठिन तवचौ
दक्षिणे चैव सव्ये च गवाम इव वहः कृतः"
4,2,19,"हिमवान इव शैलानां समुद्रः सरिताम इव
तरिदशानां यथा शक्रॊ वसूनाम इव हव्यवाः"
4,2,20,"मृगाणाम इव शार्दूलॊ गरुडः पतताम इव
वरः संनह्यमानानाम अर्जुनः किं करिष्यति"
4,2,21,"परतिज्ञां षण्ढकॊ ऽसमीति करिष्यामि महीपते
जया घातौ हि महान्तौ मे संवर्तुं नृप दुष्करौ"
4,2,22,"कर्णयॊः परतिमुच्याहं कुण्डले जवलनॊपमे
वेणी कृतशिरॊ राजन नाम्ना चैव बृहन्नडा"
4,2,23,"पठन्न आख्यायिकां नाम सत्रीभावेन पुनः पुनः
रमयिष्ये महीपालम अन्यांश चान्तःपुरे जनान"
4,2,24,"गीतं नृत्तं विचित्रं च वादित्रं विविधं तथा
शिक्षयिष्याम्य अहं राजन विराट भवने सत्रियः"
4,2,25,"परजानां समुदाचारं बहु कर्मकृतं वदन
छादयिष्यामि कौन्तेय माययात्मानम आत्मना"
4,2,26,"युधिष्ठिरस्य गेहे ऽसमि दरौपद्याः परिचारिका
उषितास्मीति वक्ष्यामि पृष्टॊ राज्ञा च भारत"
4,2,27,"एतेन विधिना छन्नः कृतकेन यथा नलः
विहरिष्यामि राजेन्द्र विराट भवने सुखम"
4,3,1,"[वै]
किं तवं नकुल कुर्वाणस तत्र तात चरिष्यसि
सुकुमारश च शूरश च दर्शनीयः सुखॊचितः"
4,3,2,"अश्वबन्धॊ भविष्यामि विराट नृपतेर अहम
गरन्थिकॊ नाम नाम्नाहं कर्मैतत सुप्रियं मम"
4,3,3,"कुशलॊ ऽसम्य अश्वशिक्षायां तथैवाश्वचिकित्सिते
परियाश च सततं मे ऽशवाः कुरुराज यथा तव"
4,3,4,"ये माम आमन्त्रयिष्यन्ति विराटनगरे जनाः
तेभ्य एवं परवक्ष्यामि विहरिष्याम्य अहं यथा"
4,3,5,"सहदेव कथं तस्य समीपे विहरिष्यसि
किं वा तवं तात कुर्वाणः परच्छन्नॊ विचरिष्यसि"
4,3,6,"गॊसंख्याता भविष्यामि विराटस्य महीपतेः
परतिषेद्धा च दॊग्धा च संख्याने कुशलॊ गवाम"
4,3,7,"तन्तिपाल इति खयातॊ नाम्ना विदितम अस्तु ते
निपुणं च चरिष्यामि वयेतु ते मानसॊ जवरः"
4,3,8,"अहं हि भवता गॊषु सततं परकृतः पुरा
तत्र मे कौशलं कर्म अवबुद्धं विशां पते"
4,3,9,"लक्षणं चरितं चापि गवां यच चापि मङ्गलम
तत सर्वं मे सुविदितम अन्यच चापि महीपते"
4,3,10,"वृषभान अपि जानामि राजन पूजित लक्षणान
येषां मूत्रम उपाघ्राय अपि वन्ध्या परसूयते"
4,3,11,"सॊ ऽहम एवं चरिष्यामि परीतिर अत्र हि मे सदा
न च मां वेत्स्यति परस तत ते रॊचतु पार्थिव"
4,3,12,"इयं तु नः परिया भार्या पराणेभ्यॊ ऽपि गरीयसी
मातेव परिपाल्या च पूज्या जयेष्ठेव च सवसा"
4,3,13,"केन सम कर्मणा कृष्णा दरौपदी विचरिष्यति
न हि किं चिद विजानाति कर्म कर्तुं यथा सत्रियः"
4,3,14,"सुकुमारी च बाला च राजपुत्री यशस्विनी
पतिव्रता महाभागा कथं नु विचरिष्यति"
4,3,15,"माल्यगन्धान अलंकारान वस्त्राणि विविधानि च
एतान्य एवाभिजानाति यतॊ जाता हि भामिनी"
4,3,16,"सैरन्ध्र्यॊ ऽरक्षिता लॊके भुजिष्याः सन्ति भारत
नैवम अन्याः सत्रियॊ यान्ति इति लॊकस्य निश्चयः"
4,3,17,"साहं बरुवाणा सैरन्ध्री कुशला केशकर्मणि
आत्मगुप्ता चरिष्यामि यन मां तवम अनुपृच्छसि"
4,3,18,"सुदेष्णां परत्युपस्थास्ये राजभार्यां यशस्विनीम
सा रक्षिष्यति मां पराप्तां मा ते भूद दुःखम ईदृशम"
4,3,19,"[य]
कल्याणं भाषसे कृष्णे कुले जाता यथा वदेत
न पापम अभिजानासि साधु साध्वी वरते सथिता"
4,4,1,"[य]
कर्माण्य उक्तानि युष्माभिर यानि तानि करिष्यथ
मम चापि यथाबुद्धिरुचितानि विनिश्चयात"
4,4,2,"पुरॊहितॊ ऽयम अस्माकम अग्निहॊत्राणि रक्षतु
सूदपौरॊगवैः सार्धं दरुपदस्य निवेशने"
4,4,3,"इन्द्रसेन मुखाश चेमे रथान आदाय केवलान
यान्तु दवारवतीं शीघ्रम इति मे वर्तते मतिः"
4,4,4,"इमाश च नार्यॊ दरौपद्याः सर्वशः परिचारिकाः
पाञ्चालान एव गच्छन्तु सूदपौरॊगवैः सह"
4,4,5,"सर्वैर अपि च वक्तव्यं न परज्ञायन्त पाण्डवाः
गता हय अस्मान अपाकीर्य सर्वे दवैतवनाद इति"
4,4,6,"विदिते चापि वक्तव्यं सुहृद्भिर अनुरागतः
अतॊ ऽहम अपि वक्ष्यामि हेतुमात्रं निबॊधत"
4,4,7,"हन्तेमां राजवसतिं राजपुत्रा बरवीमि वः
यथा राजकुलं पराप्य चरन परेष्यॊ न रिष्यति"
4,4,8,"दुर्वसं तव एव कौरव्या जानता राजवेश्मनि
अमानितैः सुमानार्हा अज्ञातैः परिवत्सरम"
4,4,9,"दिष्ट दवारॊ लभेद दवारं न च राजसु विश्वसेत
तद एवासनम अन्विच्छेद यत्र नाभिषजेत परः"
4,4,10,"नास्य यानं न पर्यङ्कं न पीठं न जगं रथम
आरॊहेत संमतॊ ऽसमीति स राजवसतिं वसेत"
4,4,11,"अथ यत्रैनम आसीनं शङ्केरन दुष्टचारिणः
न तत्रॊपविशेज जातु स राजवसतिं वसेत"
4,4,12,"न चानुशिष्येद राजानम अपृच्छन्तं कदा चन
तूष्णीं तव एनम उपासीत काले समभिपूजयन"
4,4,13,"असूयन्ति हि राजानॊ जनान अनृतवादिनः
तथैव चावमन्यन्ते मन्त्रिणं वादिनं मृषा"
4,4,14,"नैषां दारेषु कुर्वीत मैत्रीं पराज्ञः कथं चन
अन्तःपुर चरा ये च दवेष्टि यानहिताश च ये"
4,4,15,"विदिते चास्य कुर्वीत कर्याणि सुलघून्य अपि
एवं विचरतॊ राज्ञॊ न कषतिर जायते कव चित"
4,4,16,"यत्नाच चॊपचरेद एनम अग्निवद देववच च ह
अनृतेनॊपचीर्णॊ हि हिंस्याद एनम असंशयम"
4,4,17,"यच च भर्तानुयुञ्जीत तद एवाभ्यनुवर्तयेत
परमादम अवलेहां च कॊपं च परिवर्जयेत"
4,4,18,"समर्थनासु सर्वासु हितं च परियम एव च
संवर्णयेत तद एवास्य परियाद अपि हितं वदेत"
4,4,19,"अनुकूलॊ भवेच चास्य सर्वार्थेषु कथासु च
अप्रियं चाहितं यत सयात तद अस्मै नानुवर्णयेत"
4,4,20,"नाहम अस्य परियॊ ऽसमीति मत्वा सेवेत पण्डितः
अप्रमत्तश च यत्तश च हितं कुर्यात परियं च यत"
4,4,21,"नास्यानिष्टानि सेवेत नाहितैः सह संवसेत
सवस्थानान न विकम्पेत स राजवसतिं वसेत"
4,4,22,"दक्षिणं वाथ वामं वा पार्श्वम आसीत पण्डितः
रक्षिणां हय आत्तशस्त्राणां सथानं पश्चाद विधीयते
नित्यं विप्रतिषिद्धं तु पुरस्ताद आसनं महत"
4,4,23,"न च संदर्शने किं चित परवृद्धम अपि संजपेत
अपि हय एतद दरिद्राणां वयलीक सथानम उत्तमम"
4,4,24,"न मृषाभिहितं राज्ञॊ मनुष्येषु परकाशयेत
यं चासूयन्ति राजानः पुरुषं न वदेच च तम"
4,4,25,"शूरॊ ऽसमीति न दृप्तः सयाद बुद्धिमान इति वा पुनः
परियम एवाचरन राज्ञः परियॊ भवति भॊगवान"
4,4,26,"ऐश्वर्यं पराप्य दुष्प्रापं परियं पराप्य च राजतः
अप्रमत्तॊ भवेद राज्ञः परियेषु च हितेषु च"
4,4,27,"यस्य कॊपॊ महाबाधः परसादश च महाफलः
कस तस्य मनसापीच्छेद अनर्थं पराज्ञसंमतः"
4,4,28,"न चौष्ठौ निर्भुजेज जातु न च वाक्यं समाक्षिपेत
सदा कषुतं च वातं च षठीवनं चाचरेच छनैः"
4,4,29,"हास्यवस्तुषु चाप्य अस्य वर्तमानेषु केषु चित
नातिगाढं परहृष्येत न चाप्य उन्मत्तवद धसेत"
4,4,30,"न चातिधैर्येण चरेद गुरुतां हि वरजेत तथा
समितं तु मृदुपूर्वेण दर्शयेत परसादजम"
4,4,31,"लाभे न हर्षयेद यस तु न वयथेद यॊ ऽवमानितः
असंमूढश च यॊ नित्यं स राजवसतिं वसेत"
4,4,32,"राजानं राजपुत्रं वा संवर्तयति यः सदा
अमात्यः पण्डितॊ भूत्वा स चिरं तिष्ठति शरियम"
4,4,33,"परगृहीतश च यॊ ऽमात्यॊ निगृहीतश च कारणैः
न निर्बध्नाति राजानं लभते परग्रहं पुनः"
4,4,34,"परत्यक्षं च परॊक्षं च गुणवादी विचक्षणः
उपजीवी भवेद राज्ञॊ विषये चापि यॊ वसेत"
4,4,35,"अमात्यॊ हि बलाद भॊक्तुं राजानं परार्थयेत तु यः
न स तिष्ठेच चिरं सथानं गच्छेच च पराणसंशयम"
4,4,36,"शरेयः सदात्मनॊ दृष्ट्वा परं राज्ञा न संवदेत
विशेषयेन न राजानं यॊग्या भूमिषु सर्वदा"
4,4,37,"अम्लानॊ बलवाञ शूरश छायेवानपगः सदा
सत्यवादी मृदुर दान्तः स राजवसतिं वसेत"
4,4,38,"अन्यस्मिन परेष्यमाणे तु पुरस्ताद यः समुत्पतेत
अहं किं करवाणीति स राजवसतिं वसेत"
4,4,39,"उष्णे वा यदि वा शीते रात्रौ वा यदि वा दिवा
आदिष्टॊ न विकल्पेत स राजवसतिं वसेत"
4,4,40,"यॊ वै गृहेभ्यः परवसन परियाणां नानुसंस्मरेत
दुःखेन सुखम अन्विच्छेत स राजवसतिं वसेत"
4,4,41,"समवेषं न कुर्वीत नात्युच्चैः संनिधौ हसेत
मन्त्रं न बहुधा कुर्याद एवं राज्ञः परियॊ भवेत"
4,4,42,"न कर्मणि नियुक्तः सन धनं किं चिद उपस्पृशेत
पराप्नॊति हि हरन दरव्यं बन्धनं यदि वा वधम"
4,4,43,"यानं वस्त्रम अलंकारं यच चान्यत संप्रयच्छति
तद एव धारयेन नित्यम एवं परियतरॊ भवेत"
