Book No,Chapter No,Paragraph No,Paragraph Text
14,22,13,"अत्राप्य उदाहरन्तीमम इतिहासं पुरातनम
इन्द्रियाणां च संवादं मनसश चैव भामिनि"
14,22,14,"[मनस]
न घराति माम ऋते घराणं रसं जिह्वा न बुध्यते
रूपं चक्षुर न गृह्णाति तवक सपर्शं नावबुध्यते"
14,22,15,"न शरॊत्रं बुध्यते शब्दं मया हीनं कथं चन
परवरं सर्वभूतानाम अहम अस्मि सनातनम"
14,22,16,"अगाराणीव शून्यानि शान्तार्चिष इवाग्नयः
इन्द्रियाणि न भासन्ते मया हीनानि नित्यशः"
14,22,17,"काष्ठानीवार्द्र शुष्काणि यतमानैर अपीन्द्रियैः
गुणार्थान नाधिगच्छन्ति माम ऋते सर्वजन्तवः"
14,22,18,"[इन्द्रियाणि]
एवम एतद भवेत सत्यं यथैतन मन्यते भवान
ऋते ऽसमान अस्मदर्थांस तु भॊगान भुङ्क्ते भवान यदि"
14,22,19,"यद्य अस्मासु परलीनेषु तर्पणं पराणधारणम
भॊगान भुङ्क्ते रसान भुङ्क्ते यथैतन मन्यते तथा"
14,22,20,"अथ वास्मासु लीनेषु तिष्ठत्सु विषयेषु च
यदि संकल्पमात्रेण भुङ्क्ते भॊगान यथार्थवत"
14,22,21,"अथ चेन मन्यसे सिद्धिम अस्मदर्थेषु नित्यदा
घराणेन रूपम आदत्स्व रसम आदत्स्व चक्षुषा"
14,22,22,"शरॊत्रेण गन्धम आदत्स्व निष्ठाम आदत्स्व जिह्वया
तवचा च शब्दम आदत्स्व बुद्ध्या सपर्शम अथापि च"
14,22,23,"बलवन्तॊ हय अनियमा नियमा दुर्बलीयसाम
भॊगान अपूर्वान आदत्स्व नॊच्छिष्टं भॊक्तुम अर्हसि"
14,22,24,"यथा हि शिष्यः शास्तारं शरुत्यर्थम अभिधावति
ततः शरुतम उपादाय शरुतार्थम उपतिष्ठति"
14,22,25,"विषयान एवम अस्माभिर दर्शितान अभिमन्यसे
अनागतान अतीतांश च सवप्ने जागरणे तथा"
14,22,26,"वैमनस्यं गतानां च जन्तूनाम अल्पचेतसाम
अस्मदर्थे कृते कार्ये दृश्यते पराणधारणम"
14,22,27,"बहून अपि हि संकल्पान मत्वा सवप्नान उपास्य च
बुभुक्षया पीड्यमानॊ विषयान एव धावसि"
14,22,28,"अगारम अद्वारम इव परविश्य; संकल्पभॊगॊ विषयान अविन्दन
पराणक्षये शान्तिम उपैति नित्यं; दारु कषये ऽगनिर जवलितॊ यथैव"
14,22,29,"कामं तु नः सवेषु गुणेषु संगः; कामच नान्यॊन्य गुणॊपलब्धिः
अस्मान ऋते नास्ति तवॊपलब्धिस; तवाम अप्य ऋते ऽसमान न भजेत हर्षः"
14,23,1,"[बर]
अत्राप्य उदाहरन्तीमम इतिहासं पुरातनम
सुभगे पञ्च हॊतॄणां विधानम इह यादृशम"
14,23,2,"पराणापानाव उदानश च समानॊ वयान एव च
पञ्च हॊतॄन अथैतान वै परं भावं विदुर बुधाः"
14,23,3,"[बराह्मणी]
सवभावात सप्त हॊतार इति ते पूर्विका मतिः
यथा वै पञ्च हॊतारः परॊ भावस तथॊच्यताम"
14,23,4,"[बर]
पराणेन संभृतॊ वायुर अपानॊ जायते ततः
अपाने संभृतॊ वायुस ततॊ वयानः परवर्तते"
14,23,5,"वयानेन संभृतॊ वायुस तदॊदानः परवर्तते
उदाने संभृतॊ वायुः समानः संप्रवर्तते"
14,23,6,"ते ऽपृच्छन्त पुरा गत्वा पूर्वजातं परजापतिम
यॊ नॊ जयेष्ठस तम आचक्ष्व स नः शरेष्ठॊ भविष्यति"
14,23,7,"[बरह्मा]
यस्मिन परलीने परलयं वरजन्ति; सर्वे पराणाः पराणभृतां शरीरे
यस्मिन परचीर्णे च पुनश चरन्ति; स वै शरेष्ठॊ गच्छत यत्र कामः"
14,23,8,"[पराण]
मयि परलीने परलयं वरजन्ति; सर्वे पराणाः पराणभृतां शरीरे
मयि परचीर्णे च पुनश चरन्ति; शरेष्ठॊ हय अहं पश्यत मां परलीनम"
14,23,9,"[बराह्मण]
पराणः परलीयत ततः पुनश च परचचार ह
समानश चाप्य उदानश च वचॊ ऽबरूतां ततः शुभे"
14,23,10,"न तवं सर्वम इदं वयाप्य तिष्ठसीह यथा वयम
न तवं शरेष्ठॊ ऽसि नः पराण अपानॊ हि वशे तव
परचचार पुनः पराणस तम अपानॊ ऽभयभाषत"
14,23,11,"मयि परलीने परलयं वरजन्ति; सर्वे पराणाः पराणभृतां शरीरे
मयि परचीर्णे च पुनश चरन्ति; शरेष्ठॊ हय अहं पश्यत मां परलीनम"
14,23,12,"वयानश च तम उदानश च भाषमाणम अथॊचतुः
अपान न तवं शरेष्ठॊ ऽसि पराणॊ हि वशगस तव"
14,23,13,"अपानः परचचाराथ वयानस तं पुनर अब्रवीत
शरेष्ठॊ ऽहम अस्मि सर्वेषां शरूयतां येन हेतुना"
14,23,14,"मयि परलीने परलयं वरजन्ति; सर्वे पराणाः पराणभृतां शरीरे
मयि परचीर्णे च पुनश चरन्ति; शरेष्ठॊ हय अहं पश्यत मां परलीनम"
14,23,15,"परालीयत ततॊ वयानः पुनश च परचचार ह
पराणापानाव उदानश च समानश च तम अब्रुवन
न तवं शरेष्ठॊ ऽसि नॊ वयान समानॊ हि वशे तव"
14,23,16,"परचचार पुनर वयानः समानः पुनर अब्रवीत
शरेष्ठॊ ऽहम अस्मि सर्वेषां शरूयतां येन हेतुना"
14,23,17,"मयि परलीने परलयं वरजन्ति; सर्वे पराणाः पराणभृतां शरीरे
मयि परचीर्णे च पुनश चरन्ति; शरेष्ठॊ हय अहं पश्यत मां परलीनम"
14,23,18,"ततः समानः परालिल्ये पुनश च परचचार ह
पराणापानाव उदानश च वयानश चैव तम अब्रुवन
समानन तवं शरेष्ठॊ ऽसि वयान एव वशे तव"
14,23,19,"समानः परचचाराथ उदानस तम उवाच ह
शरेष्ठॊ ऽहम अस्मि सर्वेषां शरूयतां येन हेतुना"
14,23,20,"मयि परलीने परलयं वरजन्ति; सर्वे पराणाः पराणभृतां शरीरे
मयि परचीर्णे च पुनश चरन्ति; शरेष्ठॊ हय अहं पश्यत मां परलीनम"
14,23,21,"ततः परालीयतॊदानः पुनश च परचचार ह
पराणापानौ समानश च वयानश चैव तम अब्रुवन
उदान न तवं शरेष्ठॊ ऽसि वयान एव वशे तव"
14,23,22,"ततस तान अब्रवीद बरह्मा समवेतान परजापतिः
सर्वे शरेष्ठा न वा शरेष्ठाः सर्वे चान्यॊन्य धर्मिणः
सर्वे सवविषये शरेष्ठाः सर्वे चान्यॊन्य रक्षिणः"
14,23,23,"एकः सथिरश चास्थिरश च विशेषात पञ्च वायवः
एक एव ममैवात्मा बहुधाप्य उपचीयते"
14,23,24,"परस्परस्य सुहृदॊ भावयन्तः परस्परम
सवस्ति वरजत भद्रं वॊ धारयध्वं परस्परम"
14,24,1,"[बराह्मण]
अत्राप्य उदाहरन्तीमम इतिहासं पुरातनम
नारदस्य च संवादम ऋषेर देवमतस्य च"
14,24,2,"[देवमत]
जन्तॊः संजायमानस्य किं नु पूर्वं परवर्तते
पराणॊ ऽपानः समानॊ वा वयानॊ वॊदान एव च"
14,24,3,"[नारद]
येनायं सृज्यते जन्तुस ततॊ ऽनयः पूर्वम एति तम
पराणद्वंद्वं च विज्ञेयं तिर्यगं चॊर्ध्वगं च यत"
14,24,4,"[द]
केनायं सृज्यते जन्तुः कश चान्यः पूर्वम एति तम
पराणद्वंद्वं च मे बरूहि तिर्यग ऊर्ध्वं च निश्चयात"
14,24,5,"[न]
संकल्पाज जायते हर्षः शब्दाद अपि च जायते
रसात संजायते चापि रूपाद अपि च जायते"
14,24,6,"सपर्शात संजायते चापि गन्धाद अपि च जायते
एतद रूपम उदानस्य हर्षॊ मिथुन संभवः"
14,24,7,"कामात संजायते शुक्रं कामात संजायते रसः
समानव्यान जनिते सामान्ये शुक्रशॊणिते"
14,24,8,"शुक्राच छॊणित संसृष्टात पूर्वं पराणः परवर्तते
पराणेन विकृते शुक्रे ततॊ ऽपानः परवर्तते"
14,24,9,"पराणापानाव इदं दवंद्वम अवाक्चॊर्ध्वं च गच्छतः
वयानः समानश चैवॊभौ तिर्यग दवंद्वत्वम उच्यते"
14,24,10,"अग्निर वै देवताः सर्वा इति वेदस्य शासनम
संजायते बराह्मणेषु जञानं बुद्धिसमन्वितम"
14,24,11,"तस्य धूमस तमॊ रूपं रजॊ भस्म सुरेतसः
सत्त्वं संजायते तस्य यत्र परक्षिप्यते हविः"
14,24,12,"आघारौ समानॊ वयानश चेति यज्ञविदॊ विदुः
पराणापानाव आज्यभागौ तयॊर मध्ये हुताशनः
एतद रूपम उदानस्य परमं बराह्मणा विदुः"
14,24,13,निर्द्वंद्वम इति यत तव एतत तन मे निगदतः शृणु
14,24,14,"अहॊरात्रम इदं दवंद्वं तयॊर मध्ये हुताशनः
एतद रूपम उदानस्य परमं बराह्मणा विदुः"
14,24,15,"उभे चैवायने दवंद्वं तयॊर मध्ये हुताशनः
एतद रूपम उदानस्य परमं बराह्मणा विदुः"
14,24,16,"उभे सत्यानृते दवंद्वं तयॊर मध्ये हुताशनः
एतद रूपम उदानस्य परमं बराह्मणा विदुः"
14,24,17,"उभे शुभाशुभे दवंद्वं तयॊर मध्ये हुताशनः
एतद रूपम उदानस्य परमं बराह्मणा विदुः"
14,24,18,"सच चासच चैव तद दवंद्वं तयॊर मध्ये हुताशनः
एतद रूपम उदानस्य परमं बराह्मणा विदुः"
14,24,19,"परथमं समानॊ वयानॊ वयस्यते कर्म तेन तत
तृतीयं तु समानेन पुनर एव वयवस्यते"
14,24,20,"शान्त्य अर्थं वामदेवं च शान्तिर बरह्म सनातनम
एतद रूपम उदानस्य परमं बराह्मणा विदुः"
14,25,1,"[बराह्मण]
अत्राप्य उदाहरन्तीमम इतिहासं पुरातनम
चातुर्हॊत्र विधानस्य विधानम इह यादृशम"
14,25,2,"तस्य सर्वस्य विधिवद विधानम उपदेक्ष्यते
शृणु मे गदतॊ भद्रे रहस्यम इदम उत्तमम"
14,25,3,"करणं कर्म कर्ता च मॊक्ष इत्य एव भामिनि
चत्वार एते हॊतारॊ यैर इदं जगद आवृतम"
14,25,4,"हॊतॄणां साधनं चैव शृणु सर्वम अशेषतः
घराणं जिह्वा च चक्षुश च तवक च शरॊत्रं च पञ्चमम
मनॊ बुद्धिश च सप्तैते विज्ञेया गुणहेतवः"
14,25,5,"गन्धॊ रसश च रूपं च शब्दः सपर्शश च पञ्चमः
मन्तव्यम अथ बॊद्धव्यं सप्तैते कर्महेतवः"
14,25,6,"घराता भक्षयिता दरष्टा सप्रष्टा शरॊता च पञ्चमः
मन्ता बॊद्धा च सप्तैते विज्ञेयाः कर्तृहेतवः"
14,25,7,"सवगुणं भक्षयन्त्य एते गुणवन्तः शुभाशुभम
अहं च निर्गुणॊ ऽतरेति सप्तैते मॊक्षहेतवः"
14,25,8,"विदुषां बुध्यमानानां सवं सवस्थानं यथाविधि
गुणास ते देवता भूताः सततं भुञ्जते हविः"
14,25,9,"अदन हय अविद्वान अन्नानि ममत्वेनॊपपद्यते
आत्मार्थं पाचयन नित्यं ममत्वेनॊपहन्यते"
14,25,10,"अभक्ष्य भक्षणं चैव मद्य पानं च हन्ति तम
स चान्नं हन्ति तच चान्नं स हत्वा हन्यते बुधः"
14,25,11,"अत्ता हय अन्नम इदं विद्वान पुनर जनयतीश्वरः
स चान्नाज जायते तस्मिन सूक्ष्मॊ नाम वयतिक्रमः"
14,25,12,"मनसा गम्यते यच च यच च वाचा निरुध्यते
शरॊत्रेण शरूयते यच च चक्षुषा यच च दृश्यते"
14,25,13,"सपर्शेन सपृश्यते यच च घराणेन घरायते च यत
मनःषष्ठानि संयम्य हवींष्य एतानि सर्वशः"
14,25,14,"गुणवत पावकॊ मह्यं दीप्यते हव्यवाहनः
यॊगयज्ञः परवृत्तॊ मे जञानब्रह्म मनॊद्भवः
पराणस्तॊत्रॊ ऽपान शस्त्रः सर्वत्यागसु दक्षिणः"
14,25,15,"कर्मानुमन्ता बरह्मा मे कर्ताध्वर्युः कृतस्तुतिः
कृतप्रशास्ता तच छास्त्रम अपवर्गॊ ऽसय दक्षिणा"
14,25,16,"ऋचश चाप्य अत्र शंसन्ति नारायण विदॊ जनाः
नारायणाय देवाय यद अबध्नन पशून पुरा"
14,25,17,"तत्र सामानि गायन्ति तानि चाहुर निदर्शनम
देवं नारायणं भीरु सर्वात्मानं निबॊध मे"
14,26,1,"[बर]
एकः शास्ता न दवितीयॊ ऽसति शास्ता; यथा नियुक्तॊ ऽसमि तथा चरामि
हृद्य एष तिष्ठन पुरुषः शास्ति शास्ता; तेनैव युक्तः परवणाद इवॊदकम"
14,26,2,"एकॊ गुरुर नास्ति ततॊ दवितीयॊ; यॊ हृच्छयस तम अहम अनुब्रवीमि
तेनानुशिष्टा गुरुणा सदैव; पराभूता दानवाः सर्व एव"
14,26,3,"एकॊ बन्धुर नास्ति ततॊ दवितीयॊ; यॊ हृच्छयस तम अहम अनुब्रवीमि
तेनानुशिष्टा बान्धवा बन्धुमन्तः; सप्तर्षयः सप्त दिवि परभान्ति"
14,26,4,"एकः शरॊता नास्ति ततॊ दवितीयॊ; यॊ हृच्छयस तम अहम अनुब्रवीमि
तस्मिन गुरौ गुरु वासं निरुष्य; शक्रॊ गतः सर्वलॊकामरत्वम"
14,26,5,"एकॊ दवेष्टा नास्ति ततॊ दवितीयॊ; यॊ हृच्छयस तम अहम अनुब्रवीमि
तेनानुशिष्टा गुरुणा सदैव; लॊकद्विष्टाः पन्नगाः सर्व एव"
14,26,6,"अत्राप्य उदाहरन्तीमम इतिहासं पुरातनम
परजापतौ पन्नगानां देवर्षीणां च संविदम"
14,26,7,"देवर्षयश च नागाश च असुराश च परजापतिम
पर्यपृच्छन्न उपासीनाः शरेयॊ नः परॊच्यताम इति"
14,26,8,"तेषां परॊवाच भगवाञ शरेयः समनुपृच्छताम
ओम इत्य एकाक्षरं बरह्म ते शरुत्वा पराद्रवन दिशः"
14,26,9,"तेषां पराद्रवमाणानाम उपदेशार्थम आत्मनः
सर्पाणां दशने भावः परवृत्तः पूर्वम एव तु"
14,26,10,"असुराणां परवृत्तस तु दम्भभावः सवभावजः
दानं देवा वयवसिता दमम एव महर्षयः"
14,26,11,"एकं शास्तारम आसाद्य शब्देनैकेन संस्कृताः
नाना वयवसिताः सर्वे सर्पदेवर्षिदानवाः"
14,26,12,"शृणॊत्य अयं परॊच्यमानं गृह्णाति च यथातथम
पृच्छतस तावतॊ भूयॊ गुरुर अन्यॊ ऽनुमन्यते"
14,26,13,"तस्य चानुमते कर्म ततः पश्चात परवर्तते
गुरुर बॊद्धा च शत्रुश च दवेष्टा च हृदि संश्रितः"
14,26,14,"पापेन विचरँल लॊके पापचारी भवत्य अयम
शुभेन विचरँल लॊके शुभचारी भवत्य उत"
14,26,15,"कामचारी तु कामेन य इन्द्रियसुखे रतः
वरतवारी सदैवैष य इन्द्रियजये रतः"
14,26,16,"अपेतव्रतकर्मा तु केवलं बरह्मणि शरितः
बरह्मभूतश चरँल लॊके बरह्म चारी भवत्य अयम"
14,26,17,"बरह्मैव समिधस तस्य बरह्माग्निर बरह्म संस्तरः
आपॊ बरह्म गुरुर बरह्म स बरह्मणि समाहितः"
14,26,18,"एतद एतादृशं सूक्ष्मं बरह्मचर्यं विदुर बुधाः
विदित्वा चान्वपद्यन्त कषेत्रज्ञेनानुदर्शिनः"
14,27,1,"[बर]
संकल्पदंश मशकं शॊकहर्षहिमातपम
मॊहान्ध कारतिमिरं लॊभव्याल सरीसृपम"
14,27,2,"विषयैकात्ययाध्वानं कामक्रॊधविरॊधकम
तद अतीत्य महादुर्गं परविष्टॊ ऽसमि महद वनम"
14,27,3,"[बराह्मणी]
कव तद वनं महाप्राज्ञ के वृक्षाः सरितश च काः
गिरयः पर्वताश चैव कियत्य अध्वनि तद वनम"
14,27,4,"न तद अस्ति पृथग्भावे किं चिद अन्यत ततः समम
न तद अस्त्य अपृथग भावे किं चिद दूरतरं ततः"
14,27,5,"तस्माद धरस्वतरं नास्ति न ततॊ ऽसति बृहत्तरम
नास्ति तस्माद दुःखतरं नास्त्य अन्यत तत समं सुखम"
14,27,6,"न तत परविश्य शॊचन्ति न परहृष्यन्ति च दविजाः
न च बिभ्यति केषां चित तेभ्यॊ बिभ्यति के च न"
14,27,7,"तस्मिन वने सप्त महाद्रुमाश च; फलानि सप्तातिथयश च सप्त
सप्ताश्रमाः सप्त समाधयश च; दीक्षाश च सप्तैतद अरण्यरूपम"
14,27,8,"पञ्च वर्णानि दिव्यानि पुष्पाणि च फलानि च
सृजन्तः पादपास तत्र वयाप्य तिष्ठन्ति तद वनम"
