Book No,Chapter No,Paragraph No,Paragraph Text
14,73,17,"तस्य तां शीघ्रताम ईक्ष्य तुतॊषातीव वीर्यवान
गुडाकेशॊ महातेजा बालस्य धृतवर्मणः"
14,73,18,"न संदधानं ददृशे नाददानं च तं तदा
किरन्तम एव स शरान ददृशे पाकशासनिः"
14,73,19,"स तु तं पूजयाम आस धृतवर्माणम आहवे
मनसा स मुहूर्तं वै रणे समभिहर्षयन"
14,73,20,"तं पन्नगम इव करुद्धं कुरुवीरः समयन्न इव
परीतिपूर्वं महाराज पराणैर न वयपरॊपयत"
14,73,21,"स तथा रक्ष्यमाणॊ वै पार्थेनामित तेजसा
धृतवर्मा शरं तीक्ष्णं मुमॊच विजये तदा"
14,73,22,"स तेन विजयस तूर्णम अस्यन विद्धः करे भृशम
मुमॊच गाण्डीवं दुःखात तत पपाताथ भूतले"
14,73,23,"धनुषः पततस तस्य सव्यसाचि कराद विभॊ
इन्द्रस्येवायुधस्यासीद रूपं भरतसत्तम"
14,73,24,"तस्मिन निपतिते दिव्ये महाधनुषि पार्थिव
जहास स सवनं हासं धृतवर्मा महाहवे"
14,73,25,"ततॊ रॊषान्वितॊ जिष्णुः परमृज्य रुधिरं करात
धनुर आदत्त तद दिव्यं शरवर्षं ववर्ष च"
14,73,26,"ततॊ हलहलाशब्दॊ दिवस्पृग अभवत तदा
नानाविधानां भूतानां तत कर्मातीव शंसताम"
14,73,27,"ततः संप्रेक्ष्य तं करुद्धं कालान्तकयमॊपमम
जिष्णुं तरैगर्तका यॊधास तवरिताः पर्यवारयन"
14,73,28,"अभिसृत्य परीप्सार्थं ततस ते धृतवर्मणः
परिवव्रुर गुडाकेशं तत्राक्रुध्यद धनंजयः"
14,73,29,"ततॊ यॊधाञ जघानाशु तेषां स दश चाष्ट च
महेन्द्रवज्रप्रतिमैर आयसैर निशितैः शरैः"
14,73,30,"तांस तु परभग्नान संप्रेक्ष्य तवरमाणॊ धनंजयः
शरैर आशीविषाकारैर जघान सवनवद धसन"
14,73,31,"ते भग्नमनसः सर्वे तरैगर्तक महारथाः
दिशॊ विदुद्रुवुः सर्वा धनंजय शरार्दिताः"
14,73,32,"त ऊचु पुरुषव्याघ्रं संशप्तक निषूदनम
तव सम किंकराः सर्वे सर्वे च वशगास तव"
14,73,33,"आज्ञापयस्व नः पार्थ परह्वान परेष्यान अवस्थितान
करिष्यामः परियं सर्वं तव कौरवनन्दन"
14,73,34,"एतद आज्ञाय वचनं सर्वांस तान अब्रवीत तदा
जीवितं रक्षत नृपाः शासनं गृह्यताम इति"
14,74,1,"[व]
पराग्ज्यॊतिषम अथाभ्येत्य वयचरत सहयॊत्तमः
भगदत्तात्मजस तत्र निर्ययौ रणकर्कशः"
14,74,2,"सहयं पाण्डुपुत्रस्य विषयान्तम उपागतम
युयुधे भरतश्रेष्ठ वज्रदत्तॊ महीपतिः"
14,74,3,"सॊ ऽभिनिर्याय नगराद भगदत्तसुतॊ नृपः
अश्वम आयान्तम उन्मथ्य नगराभिमुखॊ ययौ"
14,74,4,"तम आलक्ष्य महाबाहुः कुरूणाम ऋषभस तदा
गाण्डीवं विक्षिपंस तूर्णं सहसा समुपाद्रवत"
14,74,5,"ततॊ गाण्डीवनिर्मुक्तैर इषुभिर मॊहितॊ नृपः
हयम उत्सृज्य तं वीरस ततः पार्थम उपाद्रवत"
14,74,6,"पुनः परविश्य नगरं दंशितः स नृपॊत्तमः
आरुह्य नागप्रवरं निर्ययौ युद्धकाङ्क्षया"
14,74,7,"पाण्डुरेणातपत्रेण धरियमाणेन मूर्धनि
दॊधूयता चामरेण शवेतेन च महारथः"
14,74,8,"ततः पार्थं समासाद्य पाण्डवानां महारथम
आह्वयाम आस कौरव्यं बाल्यान मॊहाच च संयुगे"
14,74,9,"स वारणं नगप्रख्यं परभिन्नकरटा मुखम
परेषयाम आस संक्रुद्धस ततः शवेतहयं परति"
14,74,10,"विक्षरन्तं यथा मेघं परवारणवारणम
शास्त्रवत कल्पितं संख्ये तरिसाहं युद्धदुर्मदम"
14,74,11,"परचॊद्यमानः स गजस तेन राज्ञा महाबलः
तदाङ्कुशेन विबभाव उत्पतिष्यन्न इवाम्बरम"
14,74,12,"तम आपतन्तं संप्रेक्ष्य करुद्धॊ राजन धनंजयः
भूमिष्ठॊ वारणगतं यॊधयाम आस भारत"
14,74,13,"वज्रदत्तस तु संक्रुद्धॊ मुमॊचाशु धनंजये
तॊमरान अग्निसंकाशाञ शलभान इव वेगितान"
14,74,14,"अर्जुनस तान असंप्राप्तान गाण्डीवप्रेषितैः शरैः
दविधा तरिधा च चिच्छेद ख एव खगमैस तदा"
14,74,15,"स तान दृष्ट्वा तथा छिन्नांस तॊमरान भगदत्तजः
इषून असक्तांस तवरितः पराहिणॊत पाण्डवं परति"
14,74,16,"ततॊ ऽरजुनस तूर्णतरं रुक्मपुङ्खान अजिह्मगान
परेषयाम आस संक्रुद्धॊ भगदत्तात्मजं परति"
14,74,17,"स तैर विद्धॊ महातेजा वज्रदत्तॊ महाहवे
भृशाहतः पपातॊर्व्यां न तव एनम अजहात समृतिः"
14,74,18,"ततः स पुनर आरुह्य वारणप्रवरं रणे
अव्यग्रः परेषयाम आस जयार्थी विजयं परति"
14,74,19,"तस्मै बाणांस ततॊ जिष्णुर निर्मुक्ताशीविषॊपमान
परेषयाम आस संक्रुद्धॊ जवलितान इव पावकान"
14,74,20,"स तैर विद्धॊ महानागॊ विस्रवन रुधिरं बभौ
हिमवान इव शैलेन्द्रॊ बहु परस्रवणस तदा"
14,75,1,"[व]
एवं तरिरात्रम अभवत तद युद्धं भरतर्षभ
अर्जुनस्य नरेन्द्रेण वृत्रेणेव शतक्रतॊः"
14,75,2,"ततश चतुर्थे दिवसे वज्रदत्तॊ महाबलः
जहास स सवनं हासं वाक्यं चेदम अथाब्रवीत"
14,75,3,"अर्जुनार्जुन तिष्ठस्व न मे जीवन विमॊक्ष्यसे
तवां निहत्य करिष्यामि पुतुस तॊयं यथाविधि"
14,75,4,"तवया वृद्धॊ मम पिता भगदत्तः पितुः सखा
हतॊ वृद्धॊ ऽपचायित्वाच छिशुं माम अद्य यॊधय"
14,75,5,"इत्य एवम उक्त्वा संक्रुद्धॊ वज्रदत्तॊ नराधिपः
परेषयाम आस कौरव्य वारणं पाण्डवं परति"
14,75,6,"संप्रेष्यमाणॊ नागेन्द्रॊ वज्रदत्तेन धीमता
उत्पतिष्यन्न इवाकाशम अभिदुद्राव पाण्डवम"
14,75,7,"अग्रहस्तप्रमुक्तेन शीकरेण सफल्गुनम
समुक्षत महाराज शैलं नील इवाम्बुदः"
14,75,8,"स तेन परेषितॊ राज्ञा मेघवन निनदन मुहुः
मुखाडम्बर घॊषेण समाद्रवत फल्गुनम"
14,75,9,"स नृत्यन्न इव नागेन्द्रॊ वज्रदत्तप्रचॊदितः
आससाद दरुतं राजन कौरवाणां महारथम"
14,75,10,"तम आपतन्तं संप्रेक्ष्य वज्रदत्तस्य वारणम
गाण्डीवम आश्रित्य बली न वयकम्पत शत्रुहा"
14,75,11,"चुक्रॊध बलवच चापि पाण्डवस तस्य भूपतेः
कार्यविघ्नम अनुस्मृत्य पूर्ववैरं च भारत"
14,75,12,"ततस तं वारणं करुद्धः शरजालेन पाण्डवः
निवारयाम आस तदा वेलेव मकरालयम"
14,75,13,"स नागप्रवरॊ वीर्याद अर्जुनेन निवारितः
तस्थौ शरैर वितुन्नाङ्गः शवाविच छललितॊ यथा"
14,75,14,"निवारितं गजं दृष्ट्वा भगदत्तात्मजॊ नृपः
उत्ससर्ज शितान बाणान अर्जुने करॊधमूर्छितः"
14,75,15,"अर्जुनस तु महाराज शरैः शरविघातिभिः
वारयाम आस तान अस्तांस तद अद्भुतम इवाभवत"
14,75,16,"ततः पुनर अतिक्रुद्धॊ राजा पराग्ज्यॊतिषाधिपः
परेषयाम आस नागेन्द्रं बलवच छवसनॊपमम"
14,75,17,"तम आपतन्तं संप्रेक्ष्य बलवान पाकशासनिः
नाराचम अग्निसंकाशं पराहिणॊद वारणं परति"
14,75,18,"स तेन वारणॊ राजन मर्माण्य अभिहतॊ भृशम
पपात सहसा भूमौ वज्ररुग्ण इवाचलः"
14,75,19,"स पतञ शुशुभे नागॊ धनंजय शराहतः
विशन्न इव महाशैलॊ महीं वज्रप्रपीडितः"
14,75,20,"तस्मिन निपतिते नागे वज्रदत्तस्य पाण्डवः
तं न भेतव्यम इत्य आह ततॊ भूमिगतं नृपम"
14,75,21,"अब्रवीद धि महातेजाः परस्थितं मां युधिष्ठिरः
राजानस ते न हन्तव्या धनंजय कथंचनन"
14,75,22,"सर्वम एतन नरव्याघ्र भवत्व एतावता कृतम
यॊधाश चापि न हन्तव्या धनंजय रणे तवया"
14,75,23,"वक्तव्याश चापि राजानः सर्वैः सह सुहृज्जनैः
युधिष्ठिरस्याश्वमेधॊ भवद्भिर अनुभूयताम"
14,75,24,"इति भरातृवचः शरुत्वा न हन्मि तवां जनाधिप
उत्तिष्ठ न भयं ते ऽसति सवस्तिमान गच्छ पार्थिव"
14,75,25,"आगच्छेथा महाराज परां चैत्रीम उपस्थिताम
तदाश्वमेधॊ भविता धर्मराजस्य धीमतः"
14,75,26,"एवम उक्तः स राजा तु भगदत्तात्मजस तदा
तथेत्य एवाब्रवीद वाक्यं पाण्डवेनाभिनिर्जितः"
14,76,1,"[व]
सैन्धवैर अभवद युद्धं ततस तस्य किरीटिनः
हतशेषैर महाराज हतानां च सुतैर अपि"
14,76,2,"ते ऽवतीर्णम उपाश्रुत्य विषयं शवेतवाहनम
परत्युद्ययुर अमृष्यन्तॊ राजानः पाण्डवर्षभम"
14,76,3,"अश्वं च तं परामृश्य विषयान्ते विषॊपमाः
न भयं चक्रिरे पार्थाद भीमसेनाद अनन्तरात"
14,76,4,"ते ऽविदूराद धनुष्पाणिं यज्ञियस्य हयस्य च
बीभत्सुं परत्यपद्यन्त पदातिनम अवस्थितम"
14,76,5,"ततस ते तु महावीर्या राजानः पर्यवारयन
जिगीषन्तॊ नरव्याघ्राः पूर्वं विनिकृता युधि"
14,76,6,"ते नामान्य अथ गॊत्राणि कर्माणि विविधानि च
कीर्तयन्तस तदा पार्थं शरवर्षैर अवाकिरन"
14,76,7,"ते किरन्तः शरांस तीक्ष्णान वारणेन्द्र निवारणान
रणे जयम अभीप्सन्तः कौन्तेयं पर्यवारयन"
14,76,8,"ते ऽसमीक्ष्यैव तं वीरम उग्रकर्माणम आहवे
सर्वे युयुधिरे वीरा रथस्थास तं पदातिनम"
14,76,9,"ते तम आजघ्निरे वीरं निवातकवचान्तकम
संशप्तक निहन्तारं हन्तारं सैन्धवस्य च"
14,76,10,"ततॊ रथसहस्रेण हयानाम अयुतेन च
कॊष्ठकी कृत्यकौन्तेयं संप्रहृष्टम अयॊधयन"
14,76,11,"संस्मरन्तॊ वधं वीराः सिन्धुराजस्य धीमतः
जयद्रथस्य कौरव्य समरे सव्यसाचिना"
14,76,12,"ततः पर्जन्यवत सर्वे शरवृष्टिम अवासृजन
तैः कीर्णः शुशुभे पार्थॊ रविर मेघान्तरे यथा"
14,76,13,"स शरैः समवच्छन्नॊ ददृशे पाण्डवर्षभः
पञ्जरान्तर संचारी शकुन्त इव भारत"
14,76,14,"ततॊ हाहाकृतं सर्वं कौन्तेये शरपीडिते
तरैलॊक्यम अभवद राजन रविश चासीद रजॊऽरुणः"
14,76,15,"ततॊ ववौ महाराज मारुतॊ रॊमहर्षणः
राहुर अग्रसद आदित्यं युगपत सॊमम एव च"
14,76,16,"उल्काश च जघ्निरे सूर्यं विकीर्यन्त्यः समन्ततः
वेपथुश चाभवद राजन कैलासस्य महागिरेः"
14,76,17,"मुमुचुश चास्रम अत्युष्णं दुःखशॊकसमन्विताः
सप्तर्षयॊ जातभयास तथा देवर्षयॊ ऽपि च"
14,76,18,"शशश चाशु निविर्भिद्य मण्डलं शशिनॊ ऽपतत
विपरीतस तदा राजंस तस्मिन्न उत्पातलक्षणे"
14,76,19,"रासभारुण संकाशा धनुष्मन्तः स विद्युतः
आवृत्य गगनं मेघा मुमुचुर मांसशॊणितम"
14,76,20,"एवम आसीत तदा वीरे शरवर्षाभिसंवृते
लॊके ऽसमिन भरतश्रेष्ठ तद अद्भुतम इवाभवत"
14,76,21,"तस्य तेनावकीर्णस्य शरजालेन सर्वशः
मॊहात पपात गाण्डीवम आवापश च कराद अपि"
14,76,22,"तस्मिन मॊहम अनुप्राप्ते शरजालं महत्तरम
सैन्धवा मुमुचुस तूर्णं गतसत्त्वे महारथे"
14,76,23,"ततॊ मॊहसमापन्नं जञात्वा पार्थं दिवौकसः
सर्वे वित्रस्तम अनसस तस्य शान्ति पराभवन"
14,76,24,"ततॊ देवर्षयः सर्वे तथा सप्तर्षयॊ ऽपि च
बरह्मर्षयश च विजयं जेपुः पार्थस्य धीमतः"
14,76,25,"ततः परदीपिते देवैः पार्थ तेजसि पार्थिव
तस्थाव अचलवद धीमान संग्रामे परमास्त्रवित"
14,76,26,"विचकर्ष धनुर दिव्यं ततः कौरवनन्दनः
यन्त्रस्येवेह शब्दॊ ऽभून महांस तस्य पुनः पुनः"
14,76,27,"ततः स शरवर्षाणि परत्यमित्रान परति परभुः
ववर्ष धनुषा पार्थॊ वर्षाणीव सुरेश्वरः"
14,76,28,"ततस ते सैन्धवा यॊधाः सर्व एव सराजकाः
नादृश्यन्त शरैः कीर्णाः शलभैर इव पावकाः"
14,76,29,"तस्य शब्देन वित्रेसुर भयार्ताश च विदुद्रुवुः
मुमुचुश चाश्रुशॊकार्ताः सुषुपुश चापि सैन्धवाः"
14,76,30,"तांस तु सर्वान नरश्रेष्ठः सर्वतॊ विचरन बली
अलातचक्रवद राजञ शरजालैः समर्पयत"
14,76,31,"तद इन्द्र जालप्रतिमं बाणजालम अमित्रहा
वयसृजद दिष्कु सर्वासु महेन्द्र इव वज्रभृत"
14,76,32,"मेघजालनिभं सैन्यं विदार्य स रविप्रभः
विबभौ कौरवश्रेष्ठः शरदीव दिवाकरः"
14,77,1,"[व]
ततॊ गाण्डीवभृच छूरॊ युद्धाय समवस्थितः
विबभौ युधि दुर्धर्षॊ हिमवान अचलॊ यथा"
14,77,2,"ततः सैन्धव यॊधास ते पुनर एव वयवस्थिताः
विमुञ्चन्तः सुसंरब्धाः शरवर्षाणि भारत"
14,77,3,"तान परसह्य महावीर्यः पुनर एव वयवस्थितान
ततः परॊवाच कौन्तेयॊ मुमूर्षञ शलक्ष्णया गिरा"
14,77,4,"युध्यध्वं परया शक्त्या यतध्वं च वधे मम
कुरुध्वं सर्वकार्याणि महद वॊ भयम आगतम"
14,77,5,"एष यॊत्स्यामि वः सर्वान निवार्य शरवागुराम
तिष्ठध्वं युद्धमनसॊ दर्पं विनयितास्मि वः"
14,77,6,"एतावद उक्त्वा कौरव्यॊ रुषा गाण्डीवभृत तदा
ततॊ ऽथ वचनं समृत्वा भरातुर जयेष्ठस्य भारत"
14,77,7,"न हन्तव्या रणे तात कषत्रिया विजिगीषवः
जेतव्याश चेति यत परॊक्तं धर्मराज्ञा महात्मना
चिन्तयाम आस च तदा फल्गुनः पुरुषर्षभः"
14,77,8,"इत्य उक्तॊ ऽहं नरेन्द्रेण न हन्तव्या नृपा इति
कथं तन न मृषेह सयाद धर्मराज वचः शुभम"
14,77,9,"न हन्येरंश च राजानॊ राज्ञश चाज्ञा कृता भवेत
इति संचिन्त्य स तदा भरातुः परियहिते रतः
परॊवाच वाक्यं धर्मज्ञः सन्धवान युद्धदुर्मदान"
14,77,10,"बालान सत्रियॊ वा युष्माकं न हनिष्ये वयवस्थितान
यश च वक्ष्यति संग्रामे तवास्मीति पराजितः"
14,77,11,"एतच छरुत्वा वचॊ मह्यं कुरुध्वं हितम आत्मनः
अतॊ ऽनयथा कृच्छ्रगता भविष्यथ महार्दिताः"
14,77,12,"एवम उक्त्वा तु तान वीरान युयुधे कुरुपुंगवः
अत्वरावान असंरब्धः संरब्धैर विजिगीषुभिः"
14,77,13,"ततः शतसहस्राणि शराणां नतपर्वणाम
मुमुचुः सैन्धवा राजंस तदा गाण्डीवधन्वनि"
14,77,14,"स तान आतपतः करूरान आशीविषविषॊपमान
चिच्छेद निशितैर बाणैर अन्तरैव धनंजयः"
14,77,15,"छित्त्वा तु तान आशु गमान कङ्कपत्राञ शिलाशितान
एकैकम एष दशभिर बिभेद समरे शरैः"
14,77,16,"ततः परासांश च शक्तींश च पुनर एव धनंजये
जयद्रथं हतं समृत्वा चिक्षिपुः सैन्धवा नृपाः"
14,77,17,"तेषां किरीटी संकल्पं मॊघं चक्रे महामनाः
सर्वांस तान अन्तरा छित्त्वा मुदा चुक्रॊश पाण्डवः"
14,77,18,"तथैवापततां तेषां यॊधानां जय गृद्धिनाम
शिरांसि पातयाम आस भल्लैः संनतपर्वभिः"
14,77,19,"तेषां परद्रवतां चैव पुनर एव च धावताम
निवर्ततां च शब्दॊ ऽभूत पूर्णस्येव महॊदधेः"
