1,"[स]
तस्मिंस तथा वर्तमाने नराश्वगजसंक्षये
दुःशासनॊ महाराज धृष्टद्युम्नम अयॊधयत"
115,"तस्य रूपं शरस्यासीद धनुर्ज्या मण्डलान्तरे
दयॊततॊ भास्करस्येव घनान्ते परिवेशिनः"
116,"पार्षतेन परामृष्टं जवलन्तम इव तद धनुः
अन्तकालम इव पराप्तं मेनिरे वीक्ष्य सैनिकाः"
117,"तम इषुं संहितं तेन भारद्वाजः परतापवान
दृष्ट्वामन्यत देहस्य कालपर्यायम आगतम"
118,"ततः स यत्नम आतिष्ठद आचार्यस तस्य वारणे
न चास्यास्त्राणि राजेन्द्र परादुरासन महात्मनः"
119,"तस्य तव अहानि चत्वारि कषपा चैकास्यतॊ गता
तस्य चाह्नस तरिभागेन कषयं जग्मुः पतत्रिणः"
120,"स शरक्षयम आसाद्य पुत्रशॊकेन चार्दितः
विविधानां च दिव्यानाम अस्त्राणाम अप्रसन्नताम"
121,"उत्स्रष्टुकामः शस्त्राणि विप्रवाक्याभिचॊदितः
तेजसा परेर्यमाणश च युयुधे सॊ ऽतिमानुषम"
122,"अथान्यत स समादाय दिव्यम आङ्गिरसं धनुः
शरांश च शरवर्षेण महता समवाकिरत"
123,"ततस तं शरवर्षेण महता समवाकिरत
वयशातयच च संक्रुद्धॊ धृष्टद्युम्नम अमर्षणः"
124,"तं शरं शतधा चास्य दरॊणश चिच्छेद सायकैः
धवजं धनुश च निशितैः सारथिं चाप्य अपातयत"
125,"धृष्टद्युम्नः परहस्यान्यत पुनर आदाय कार्मुकम
शितेन चैनं बाणेन परत्यविध्यत सतनान्तरे"
126,"सॊ ऽतिविद्धॊ महेष्वासः संभ्रान्त इव संयुगे
भल्लेन शितधारेण चिच्छेदास्य महद धनुः"
127,"यच चास्य बाणं विकृतं धनूंषि च विशां पते
सर्वं संछिद्य दुर्धर्षॊ गदां खड्गम अथापि च"
128,"धृष्टद्युम्नं ततॊ ऽविध्यन नवभिर निशितैः शरैः
जीवितान्तकरैः करुद्धैः करुद्ध रूपं परंतपः"
129,"धृष्टद्युम्न रथस्याश्वान सवरथाश्वैर महारथः
अमिश्रयद अमेयात्मा बराह्मम अस्त्रम उदीरयन"
130,"ते मिश्रा बह्व अशॊभन्त जवना वातरंहसः
पारावत सवर्णाश च शॊणाश च भरतर्षभ"
131,"यथा स विद्युतॊ मेघा नदन्तॊ जललागमे
तथा रेजुर महाराज मिश्रिता रणमूर्धनि"
132,"ईषा बन्धं चक्रबन्धं रथबन्धं तथैव च
परणाशयद अमेयात्मा धृष्टद्युम्नस्य स दविजः"
133,"स छिन्नधन्वा विरथॊ हताश्वॊ हतसारथिः
उत्तमाम आपदं पराप्य गदां वीरः परामृशत"
134,"ताम अस्य विशिखैस तीक्ष्णैः कषिप्यमाणां महारथः
निजघान शरैर दरॊणः करुद्धः सत्यपराक्रमः"
135,"तां दृष्ट्वा तु नरव्याघ्रॊ दरॊणेन निहतां शरैः
विमलं खड्गम आदत्त शतचन्द्रं च भानुमत"
136,"असंशयं तथा भूते पाञ्चाल्यः साध्व अमन्यत
वधम आचार्य मुख्यस्य पराप्तकालं महात्मनः"
137,"ततः सवरथनीडस्थः सवरथस्य रथेषया
अगच्छद असिम उद्यम्य शतचन्द्रं च भानुमत"
138,"चिकीर्षुर दुष्करं कर्म धृष्टद्युम्नॊ महारथः
इयेष वक्षॊ भेत्तुं च भारद्वाजस्य संयुगे"
139,"सॊ ऽतिष्ठद युगमध्ये वै युगसंनहनेषु च
शॊणानां जघनार्धेषु तत सैन्याः समपूजयन"
140,"तिष्ठतॊ युगपालीषु शॊणान अप्य अधितिष्ठतः
नापश्यद अन्तरं दॊणस तद अद्भुतम इवाभवत"
141,"कषिप्रं शयेनस्य चरतॊ यथैवामिष गृद्धिनः
तद्वद आसीद अभीसारॊ दरॊणं परार्थयतॊ रणे"
142,"तस्याश्वान रथशक्त्यासौ तदा करुद्धः पराक्रमी
सर्वान एकैकशॊ दरॊणः कपॊताभान अजीघनत"
143,"ते हता नयपतन भूमौ धृष्टद्युम्नस्य वाजिनः
शॊणाश च पर्यमुच्यन्त रथबन्धाद विशां पते"
144,"तान हयान निहतान दृष्ट्वा दविजाग्र्येण स पार्षतः
नामृष्यत युधां शरेष्ठॊ याज्ञसेनिर महारथः"
145,"विरथः स गृहीत्वा तु खड्गं खड्गभृतां वरः
दरॊणम अभ्यपतद राजन वैनतेय इवॊरगम"
146,"तस्य रूपं बभौ राजन भारद्वाजं जिघांसतः
यथा रूपं परं विष्णॊर हिरण्यकशिपॊर वधे"
147,"सॊ ऽचिरद विविधान मार्गान परकारान एकविंशतिम
भरान्तम उद्भ्रान्तम आविद्धम आप्लुतं परसृतं सृतम"
148,"परिवृत्तं निवृत्तंच खड्गं चर्म च धारयन
संपातं समुदीर्णं च दर्शयाम आस पार्षतः"
149,"ततः शरसहस्रेण शतचन्द्रम अपातयत
खड्गं चर्म च संबाधे धृष्टद्युम्नस्य स दविजः"
150,"ते तु वैतस्तिका नाम शरा हय आसन्न घातिनः
निकृष्ट युद्धे दरॊणस्य नान्येषां सन्ति ते शराः"
151,"शारद्वतस्य पार्थस्य दरौणेर वैकर्तनस्य च
परद्युम्न युयुधानाभ्याम अभिमन्यॊश च ते शराः"
152,"अथास्येषुं समाधत्त दृढं परमसंशितम
अन्तेवासिनम आचार्यॊ जिघांसुः पुत्र संमितम"
153,"तं शरैर दशभिस तीक्ष्णैश चिच्छेद शिनिपुंगवः
पश्यतस तव पुत्रस्य कर्णस्य च महात्मनः
गरस्तम आचार्य मुख्येन धृट्षद्युम्नम अमॊचयत"
154,"चरन्तं रथमार्गेषु सात्यकिं सत्यविक्रमम
दरॊणकर्णान्तर गतं कृपस्यापि च भारत
अपश्येतां महात्मानौ विष्वक्सेन धनंजयौ"
155,"अपूजयेतां वार्ष्णेयं बरुवाणौ साधु साध्व इति
दिव्यान्य अस्त्राणि सर्वेषां युधि निघ्नन्तम अच्युतम
अभिपत्य ततः सेनां विष्वक्सेन धनंजयौ"
156,"धनंजयस ततः कृष्णम अब्रवीत पश्य केशव
आचार्य वरमुख्यानां मध्ये करीडन मधूद्वहः"
157,"आनन्दयति मां भूयः सात्यकिः सत्यविक्रमः
माद्रीपुत्रौ च भीमं च राजानं च युधिष्ठिरम"
158,"यच छिक्षयानुद्धतः सन रणे चरति सात्यकिः
महारथान उपक्रीडन वृष्णीनां कीर्तिवर्धनः"
159,"तम एते परतिनन्दन्ति सिद्धाः सैन्याश च विस्मिताः
अजय्यं समरे दृष्ट्वा साहु साध्व इति सात्वतम
यॊधाश चॊभयतः सर्वे कर्मभिः समपूजयन"
